"orgId","type of session","number","date","notBefore","notAfter","persId","chairman","spId","nodeId","titleId","taxonomyIds","topicIds","type","text string"
"parl.DruzPolZb","seja",16,"1991-03-29","10:25:00","12:40:00","SmoleJoze1927",0,"DruzPolZb.1991-03-29.s016-03.sp-599","DruzPolZb.1991-03-29.s016-03.sp-599.7",DruzPolZb.1991-03-29.s016-03.toc-item5,"taxonomy.4.3.3","topic.472","utterance","Zato ponovno predlagam, da se odpre najprej v Komisiji za mednarodne odnose resna razprava o zunanjepolitični usmeritvi Slovenije. Povod je lahko izjava dr. Bučarja, kajti jaz te izjave, gospod Bučar, ne morem drugače tolmačiti, kot avstrofilsko izjavo. Vi imate to pravico, da ste avstrofil. Jaz imam pravico biti evropsko usmerjen, ne pa avstrofilsko. O tem prosim, da gremo v razpravo, ki jo je treba nadaljevati v vseh treh zborih skupščine, o zunanjepolitični usmeritvi."
"parl.DruzPolZb","seja",16,"1991-03-29","10:25:00","12:40:00","SmoleJoze1927",0,"DruzPolZb.1991-03-29.s016-03.sp-599","DruzPolZb.1991-03-29.s016-03.sp-599.8",DruzPolZb.1991-03-29.s016-03.toc-item5,"taxonomy.4.3.3","topic.472","utterance","To kar se sedaj dogaja, da se nekateri naši državniki in politiki ponižujejo pred Avstrijci, poslušajte, to nikamor ne pelje. Ne bom nadaljeval, imam pa veliko podatkov o tem, kaj se na tem področju dogaja."
"parl.DruzPolZb","seja",16,"1991-03-29","10:25:00","12:40:00","SmoleJoze1927",0,"DruzPolZb.1991-03-29.s016-03.sp-599","DruzPolZb.1991-03-29.s016-03.sp-599.9",DruzPolZb.1991-03-29.s016-03.toc-item5,"taxonomy.4.3.3","topic.472","utterance","In zaradi tega še enkrat ponavljam. Jaz sem to vprašanje sprožil iz načelnih razlogov, ker gre za vprašanje zunanjepolitične usmeritve. Jaz nisem za to, da bomo mi v imenu suverene Slovenije, nekemu tujcu ""čevlje čistili."" Daleč stran. In prosim, če govorimo o suverenosti, potem bomo suverenost resnično branili."
"parl.DruzPolZb","seja",16,"1991-03-29","10:25:00","12:40:00","SmoleJoze1927",0,"DruzPolZb.1991-03-29.s016-03.sp-599","DruzPolZb.1991-03-29.s016-03.sp-599.10",DruzPolZb.1991-03-29.s016-03.toc-item5,"taxonomy.4.3.3","topic.472","utterance","Sedaj pa, ker sem že pri besedi."
"parl.DruzPolZb","seja",16,"1991-03-29","10:25:00","12:40:00","commentator",0,"DruzPolZb.1991-03-29.s016-03.sp-599","DruzPolZb.1991-03-29.s016-03.sp-599.11",DruzPolZb.1991-03-29.s016-03.toc-item5,"taxonomy.4.3.3","topic.472","vocal","Smeh v dvorani."
"parl.DruzPolZb","seja",16,"1991-03-29","10:25:00","12:40:00","SmoleJoze1927",0,"DruzPolZb.1991-03-29.s016-03.sp-599","DruzPolZb.1991-03-29.s016-03.sp-599.12",DruzPolZb.1991-03-29.s016-03.toc-item5,"taxonomy.4.3.3","topic.472","utterance","PREDSEDNIK Izvršnega sveta - zaenkrat, gospod Peterle je omenjal ta odnos do narodne skupnosti. Stalno so očitki, da smo mi prej nekoga forsirali, drugega podcenjevali. Jaz to zavračam. Predlagal sem pred nekaj meseci v skupščinski komisiji za mednarodne odnose razpravo o našem dosedanjem odnosu do Slovencev v Avstriji, Italiji in na Madžarskem. Vztrajam na tej razpravi. Prosim, da se z argumenti pogovorimo. Imam pa celo vrsto podatkov, da gre sedanja vlada na drugo orientacijo in podpira samo en del Slovencev. In prosim, jaz imam tu svoje argumente, dajmo se v komisiji najprej domeniti. Mislim pa, da je stvar tako pomembna, da mora priti na plenum, da na vseh treh zborih razpravljamo o odnosu do Slovencev v Italiji, Avstriji in na Madžarskem. In prosim, ne odkrivajte Amerike, ker je ta Slovenija ves čas podpirala slovensko narodnost. In nikar ne paradirajte, da ste šele sedaj vi začeli podpirati slovenske narodnosti."
"parl.DruzPolZb","seja",16,"1991-03-29","10:25:00","12:40:00","SmoleJoze1927",0,"DruzPolZb.1991-03-29.s016-03.sp-599","DruzPolZb.1991-03-29.s016-03.sp-599.13",DruzPolZb.1991-03-29.s016-03.toc-item5,"taxonomy.4.3.3","topic.472","utterance","Jaz to obsojam. O konkretnih problemih, koliko se je podpiralo, kako se je podpiralo, pa prosim, da začnemo strokovno razpravo."
"parl.DruzPolZb","seja",16,"1991-03-29","10:25:00","12:40:00","",0,"DruzPolZb.1991-03-29.s016-03.sp-600","DruzPolZb.1991-03-29.s016-03.sp-600.1",DruzPolZb.1991-03-29.s016-03.toc-item5,"","","speaker","PREDSEDNIK DR. LUDVIK TOPLAK:"
"parl.DruzPolZb","seja",16,"1991-03-29","10:25:00","12:40:00","ToplakLudvik1942",1,"DruzPolZb.1991-03-29.s016-03.sp-600","DruzPolZb.1991-03-29.s016-03.sp-600.2",DruzPolZb.1991-03-29.s016-03.toc-item5,"taxonomy.4.3.3","topic.472","utterance","Hvala lepa. Sedaj so prijavljeni še štirje. Nekaj moram povedati. Medtem smo zaradi usklajevanja dela z drugimi zbori malo spremenili načrt, da bi imeli odmor pred Zborom občin. V bistvu smo predlagali zamenjavo. Ali prekinemo razpravo in po odmoru nadaljujemo, ali bi bilo dobro? To pripovedujem zaradi dela v restavraciji."
"parl.DruzPolZb","seja",16,"1991-03-29","10:25:00","12:40:00","ToplakLudvik1942",1,"DruzPolZb.1991-03-29.s016-03.sp-600","DruzPolZb.1991-03-29.s016-03.sp-600.3",DruzPolZb.1991-03-29.s016-03.toc-item5,"taxonomy.4.3.3","topic.472","utterance","Prijavili so se: Rudi Šeligo, dr.Bučar, gospod Tomše, Roberto Battelli in še gospod Peterle. 5 x 5 = 25 minut. To nam spremeni plan. Po odmoru nadaljujemo ob 13.00. Prosim, gospod Peterle pravi, da ima druge obveznosti. Prosim, da sedaj spregovori."
"parl.DruzPolZb","seja",16,"1991-03-29","10:25:00","12:40:00","",0,"DruzPolZb.1991-03-29.s016-03.sp-601","DruzPolZb.1991-03-29.s016-03.sp-601.1",DruzPolZb.1991-03-29.s016-03.toc-item5,"","","speaker","LOJZE PETERLE:"
"parl.DruzPolZb","seja",16,"1991-03-29","10:25:00","12:40:00","PeterleAlojz1948",0,"DruzPolZb.1991-03-29.s016-03.sp-601","DruzPolZb.1991-03-29.s016-03.sp-601.2",DruzPolZb.1991-03-29.s016-03.toc-item5,"taxonomy.4.3.3","topic.472","utterance","Strinjam se, da mora biti v skupščini dinamika. Samo ta dinamika je lahko bolj ali manj poštena. Jaz se zavzemam za pošteno dinamiko."
"parl.DruzPolZb","seja",16,"1991-03-29","10:25:00","12:40:00","PeterleAlojz1948",0,"DruzPolZb.1991-03-29.s016-03.sp-601","DruzPolZb.1991-03-29.s016-03.sp-601.3",DruzPolZb.1991-03-29.s016-03.toc-item5,"taxonomy.4.3.3","topic.472","utterance","Drugič. Predlagam, kar sem rekel prej. Dajmo se o tem pogovarjati, lahko je to v nekako istem problemskem sklopu. Sem za to, kar je rekel gospod Smole. Dajmo pogledati, kaj se je godilo, pa bomo videli, do kdaj je bila ta politika razredna, kdaj je postala nacionalna in kdaj je bila taka ali drugačna.O tem se da pač razpravljati, če ocenjuje skupščina, da nam je ob vsem tem, kar imamo sedaj na dnevnem redu, potrebna ta čas prav ta razprava, potem nimam nič proti."
"parl.DruzPolZb","seja",16,"1991-03-29","10:25:00","12:40:00","PeterleAlojz1948",0,"DruzPolZb.1991-03-29.s016-03.sp-601","DruzPolZb.1991-03-29.s016-03.sp-601.4",DruzPolZb.1991-03-29.s016-03.toc-item5,"taxonomy.4.3.3","topic.472","utterance","Glede gospoda Školča bi rekel še to, da izjave, ki sem jih napol slišal ali ne slišal, ali pa eno dobro slišal; te zame niso osnova, da bi odstavljal ministre. To je pač zadeva interpretacij. Ministri so na nekaj reagirali. Seveda, poglejmo tudi to stran, ki je bila prej na vrsti in na kaj so ministri reagirali, pojdimo magnetograme pogledati, če bo treba."
"parl.DruzPolZb","seja",16,"1991-03-29","10:25:00","12:40:00","PeterleAlojz1948",0,"DruzPolZb.1991-03-29.s016-03.sp-601","DruzPolZb.1991-03-29.s016-03.sp-601.5",DruzPolZb.1991-03-29.s016-03.toc-item5,"taxonomy.4.3.3","topic.472","utterance","Kar pa zadeva gospoda Habsburga, on je vendar dlje prišel s svojim evropskim statusom. On je poslanec Evropskega parlamenta. Kaj pa je reakcionarno, bi pa rad slišal od gospoda Smoleta."
"parl.DruzPolZb","seja",16,"1991-03-29","10:25:00","12:40:00","",0,"DruzPolZb.1991-03-29.s016-03.sp-602","DruzPolZb.1991-03-29.s016-03.sp-602.1",DruzPolZb.1991-03-29.s016-03.toc-item5,"","","speaker","PREDSEDNIK DR. LUDVIK TOPLAK:"
"parl.DruzPolZb","seja",16,"1991-03-29","10:25:00","12:40:00","ToplakLudvik1942",1,"DruzPolZb.1991-03-29.s016-03.sp-602","DruzPolZb.1991-03-29.s016-03.sp-602.2",DruzPolZb.1991-03-29.s016-03.toc-item5,"taxonomy.4.3.3","topic.472","utterance","Prosim, gospod Roberto Battelli, pa potem Tomše."
"parl.DruzPolZb","seja",16,"1991-03-29","10:25:00","12:40:00","",0,"DruzPolZb.1991-03-29.s016-03.sp-603","DruzPolZb.1991-03-29.s016-03.sp-603.1",DruzPolZb.1991-03-29.s016-03.toc-item5,"","","speaker","ROBERTO BATTELLI:"
"parl.DruzPolZb","seja",16,"1991-03-29","10:25:00","12:40:00","BattelliRoberto1954",0,"DruzPolZb.1991-03-29.s016-03.sp-603","DruzPolZb.1991-03-29.s016-03.sp-603.2",DruzPolZb.1991-03-29.s016-03.toc-item5,"taxonomy.4.3.3","topic.472","utterance","Hvala lepa za besedo. Očitno postajajo konji, ki so sicer zelo plemenite živali, eden od elementov, ki se nekako veže na te narodnosti zadnje čase."
"parl.DruzPolZb","seja",16,"1991-03-29","10:25:00","12:40:00","BattelliRoberto1954",0,"DruzPolZb.1991-03-29.s016-03.sp-603","DruzPolZb.1991-03-29.s016-03.sp-603.3",DruzPolZb.1991-03-29.s016-03.toc-item5,"taxonomy.4.3.3","topic.472","utterance","Se pravi, ne gre samo za konjerejo, gre predvsem za trojanske konje. In jaz vem, da to ni samo prisotno v javnem mnenju od nekdaj. Vem, da je to prisotno - in vseskozi dobivam dokaze - v državnem vrhu Slovenije. Vem, da bo to težko razčistiti in da ljudje, ki si nekaj mislijo, potrebujejo precej časa, da spremenijo to mišljenje. Zagotovo pa nič ne pomaga, da ti ljudje še naprej tako mislijo in delajo, ampak so od določenega dne pač tiho in o tem več ne govorijo. To nič ne pomeni."
"parl.DruzPolZb","seja",16,"1991-03-29","10:25:00","12:40:00","BattelliRoberto1954",0,"DruzPolZb.1991-03-29.s016-03.sp-603","DruzPolZb.1991-03-29.s016-03.sp-603.4",DruzPolZb.1991-03-29.s016-03.toc-item5,"taxonomy.4.3.3","topic.472","utterance","Mi smo se s tem problemom že enkrat obrnili na Vas, kot na pametnega, uravnovešenega državnika in Vi ste se z njim ukvarjali z vso pametjo in uravnovešenostjo in Vi tudi veste, koliko smo to cenili in še zmeraj cenimo. Vendar se to vseskozi še naprej dogaja. Upam, da se dejansko ne bo več treba obračati na vas, da ta problem rešite. Res upam, da se s tem neha, ker to ustvarja veliko škodo v medsebojnem zaupanju, predvsem je pa to za narodnosti izjemno žaljivo. Dovolj je, če pogledamo zelo površno v zgodovino, ali če se sprehodimo po trgih naših mest in pogledamo napise, ki so tam, zato da se ugotovi, kako je to dejansko nekaj, kar se približuje tistemu, kar se ponavadi reče, da je podlost."
"parl.DruzPolZb","seja",16,"1991-03-29","10:25:00","12:40:00","",0,"DruzPolZb.1991-03-29.s016-03.sp-604","DruzPolZb.1991-03-29.s016-03.sp-604.1",DruzPolZb.1991-03-29.s016-03.toc-item5,"","","speaker","PREDSEDNIK DR. LUDVIK TOPLAK:"
"parl.DruzPolZb","seja",16,"1991-03-29","10:25:00","12:40:00","ToplakLudvik1942",1,"DruzPolZb.1991-03-29.s016-03.sp-604","DruzPolZb.1991-03-29.s016-03.sp-604.2",DruzPolZb.1991-03-29.s016-03.toc-item5,"taxonomy.4.3.3","topic.472","utterance","Hvala. Za besedo prosijo še gospod Tomše, predsednik Bučar in Pučnik."
"parl.DruzPolZb","seja",16,"1991-03-29","10:25:00","12:40:00","",0,"DruzPolZb.1991-03-29.s016-03.sp-605","DruzPolZb.1991-03-29.s016-03.sp-605.1",DruzPolZb.1991-03-29.s016-03.toc-item5,"","","speaker","IVAN TOMŠE:"
"parl.DruzPolZb","seja",16,"1991-03-29","10:25:00","12:40:00","TomseIvan1942",0,"DruzPolZb.1991-03-29.s016-03.sp-605","DruzPolZb.1991-03-29.s016-03.sp-605.2",DruzPolZb.1991-03-29.s016-03.toc-item5,"taxonomy.4.3.3","topic.472","utterance","Hvala lepa predsednik. Roko sem dvignil zaradi tega, ker mislim, da smo skrenili s točke dnevnega reda. Na dnevnem redu so pobude, predlogi in vprašanja delegatov. Mislim pa, da smo zašli v točko dnevnega reda, kot je predlagal kolega Školč: ljudje govorijo. In protestiram, da obravnavamo točko dnevnega reda ""ljudje govorijo"", kajti ljudje govorijo tisto, kar jim pokladamo v usta. Sprašujem se, kdo je nakladalec tega, kar ljudje govorijo. Zato protestiram, da se obravnava točka, ki je mimo dnevnega reda. Hvala."
"parl.DruzPolZb","seja",16,"1991-03-29","10:25:00","12:40:00","",0,"DruzPolZb.1991-03-29.s016-03.sp-606","DruzPolZb.1991-03-29.s016-03.sp-606.1",DruzPolZb.1991-03-29.s016-03.toc-item5,"","","speaker","PREDSEDNIK DR. LUDVIK TOPLAK:"
"parl.DruzPolZb","seja",16,"1991-03-29","10:25:00","12:40:00","ToplakLudvik1942",1,"DruzPolZb.1991-03-29.s016-03.sp-606","DruzPolZb.1991-03-29.s016-03.sp-606.2",DruzPolZb.1991-03-29.s016-03.toc-item5,"taxonomy.4.3.3","topic.472","utterance","Hvala lepa. Prosim najprej ima besedo gospod predsednik dr. Bučar, nato Rudi Šeligo, Franco Juri in Ivan Pučnik."
"parl.DruzPolZb","seja",16,"1991-03-29","10:25:00","12:40:00","",0,"DruzPolZb.1991-03-29.s016-03.sp-607","DruzPolZb.1991-03-29.s016-03.sp-607.1",DruzPolZb.1991-03-29.s016-03.toc-item5,"","","speaker","DR. FRANCE BUČAR:"
"parl.DruzPolZb","seja",16,"1991-03-29","10:25:00","12:40:00","BucarFrance1923",0,"DruzPolZb.1991-03-29.s016-03.sp-607","DruzPolZb.1991-03-29.s016-03.sp-607.2",DruzPolZb.1991-03-29.s016-03.toc-item5,"taxonomy.4.3.3","topic.472","utterance","Gospod predsednik, hvala za besedo. Moram reči, da me je gospod Jože Smole osvobodil dolžnosti, da bi resno o tej stvari razpravljal, ker je s svojim nastopom stvari vzel resnost, tako da mislim, da ni treba odgovarjati."
"parl.DruzPolZb","seja",16,"1991-03-29","10:25:00","12:40:00","BucarFrance1923",0,"DruzPolZb.1991-03-29.s016-03.sp-607","DruzPolZb.1991-03-29.s016-03.sp-607.3",DruzPolZb.1991-03-29.s016-03.toc-item5,"taxonomy.4.3.3","topic.472","utterance","Kaj si on interpretira, to je njegova privatna zadeva, ne. Samo nekaj drugega pa je. Če v javnosti razširja svoje interpretacije. To je pa nekaj drugega. In mislim, da je proti temu treba pa tudi javno protestirati."
"parl.DruzPolZb","seja",16,"1991-03-29","10:25:00","12:40:00","BucarFrance1923",0,"DruzPolZb.1991-03-29.s016-03.sp-607","DruzPolZb.1991-03-29.s016-03.sp-607.4",DruzPolZb.1991-03-29.s016-03.toc-item5,"taxonomy.4.3.3","topic.472","utterance","Potem bi ga moral še v nečem korigirati. Očita mi avstrofilstvo v zvezi s Habsburgom in tako naprej. Naj se gospod Jože Smole spomni, da sem izrecno zahteval, da se kakršno koli sodelovanje s Habsburgom, ker je dobil vabilo, obravnava na komisiji, kjer je tudi gospod Jože Smole sodeloval in je bila ta stvar odobrena. Res pa je, da je on glasoval proti. To moram priznati. Ampak vendarle, kljub temu je to še zmeraj sklep komisije, na katerega se on sklicuje in to moramo upoštevati."
"parl.DruzPolZb","seja",16,"1991-03-29","10:25:00","12:40:00","BucarFrance1923",0,"DruzPolZb.1991-03-29.s016-03.sp-607","DruzPolZb.1991-03-29.s016-03.sp-607.5",DruzPolZb.1991-03-29.s016-03.toc-item5,"taxonomy.4.3.3","topic.472","utterance","Na drugi strani bi pa prosil gospoda Jožeta Smoleta, da neha s tako kampanjo. On je že pred časom poskušal, da me ožigosa pred slovensko javnostjo kot narodnega izdajalca, ker sem govoril v Strasbourgu zadeve, ki so splošno sprejete. Prosim, naj ne nadaljuje te prakse, to je brez potrebe. Hvala lepa."
"parl.DruzPolZb","seja",16,"1991-03-29","10:25:00","12:40:00","",0,"DruzPolZb.1991-03-29.s016-03.sp-608","DruzPolZb.1991-03-29.s016-03.sp-608.1",DruzPolZb.1991-03-29.s016-03.toc-item5,"","","speaker","PREDSEDNIK DR. LUDVIK TOPLAK:"
"parl.DruzPolZb","seja",16,"1991-03-29","10:25:00","12:40:00","ToplakLudvik1942",1,"DruzPolZb.1991-03-29.s016-03.sp-608","DruzPolZb.1991-03-29.s016-03.sp-608.2",DruzPolZb.1991-03-29.s016-03.toc-item5,"taxonomy.4.3.3","topic.472","utterance","Hvala lepa. Prosim, gospod Šeligo."
"parl.DruzPolZb","seja",16,"1991-03-29","10:25:00","12:40:00","",0,"DruzPolZb.1991-03-29.s016-03.sp-609","DruzPolZb.1991-03-29.s016-03.sp-609.1",DruzPolZb.1991-03-29.s016-03.toc-item5,"","","speaker","MAG. RUDI ŠELIGO:"
"parl.DruzPolZb","seja",16,"1991-03-29","10:25:00","12:40:00","SeligoRudi1935",0,"DruzPolZb.1991-03-29.s016-03.sp-609","DruzPolZb.1991-03-29.s016-03.sp-609.2",DruzPolZb.1991-03-29.s016-03.toc-item5,"taxonomy.4.3.3","topic.472","utterance","To bo sedaj čisto druga zgodba, ne spada v kontekst, ampak vrstni red ste mi trikrat spremenili. Zato bom sedaj o nečem tretjem govoril."
"parl.DruzPolZb","seja",16,"1991-03-29","10:25:00","12:40:00","SeligoRudi1935",0,"DruzPolZb.1991-03-29.s016-03.sp-609","DruzPolZb.1991-03-29.s016-03.sp-609.3",DruzPolZb.1991-03-29.s016-03.toc-item5,"taxonomy.4.3.3","topic.472","utterance","Prvič. Kar se tiče skrbi politike do obeh narodnih skupnosti, moram reči, da sploh nisem slišal, kaj je rekel minister Capuder. Saj danes ni govoril, najbrž na to tukaj pa ne morem reagirati. Strinjam se z izpostavitvijo problema, kot ga je naredil Školč, seveda brez lastne interpretacije, ampak kot sam problem. Če je dobro poslušal, kar je govoril gospod Peterle - je zadeva dosti jasna. Šele potem, ko pride do kakršnega koli popuščanja o tej zaščiti - pa moram reči, da je tudi ne vidim, tudi v teh cifrah - šele potem lahko resno o tem odpremo razpravo."
"parl.DruzPolZb","seja",16,"1991-03-29","10:25:00","12:40:00","SeligoRudi1935",0,"DruzPolZb.1991-03-29.s016-03.sp-609","DruzPolZb.1991-03-29.s016-03.sp-609.4",DruzPolZb.1991-03-29.s016-03.toc-item5,"taxonomy.4.3.3","topic.472","utterance","Rad bi dodal k temu, da res mislim, da se problemi na nek način stopnjujejo. Kot n.pr. slišim v teh zadnjih dneh - najbrž je treba to kar javno povedati - italijansko uredništvo TV Kopra - Capodistria postavlja zahteve v svojem urednikovanju, ki jih doslej nismo poznali. Visoke zahteve. Najbrž je tudi treba malo razumeti v kontekstu skrbi ali v kontekstu nekih novih občutkov ogroženosti in zaradi tega bi bilo zelo dobro, da če je res to potrebno in z argumentirano pripravo, da se taka razprava sproži tudi v našem zboru, če je treba."
"parl.DruzPolZb","seja",16,"1991-03-29","10:25:00","12:40:00","SeligoRudi1935",0,"DruzPolZb.1991-03-29.s016-03.sp-609","DruzPolZb.1991-03-29.s016-03.sp-609.5",DruzPolZb.1991-03-29.s016-03.toc-item5,"taxonomy.4.3.3","topic.472","utterance","Drugo, kar sem mislil povedati, se ne tiče konjev, ampak ljudi, ki imajo devize v naših poslovnih bankah. Dajem klicaj res na ljudi, ne pa na same devize. Domnevam, ker se pač na to ne razumem preveč, pa tudi ne bi želel, da bi se kaj preveč razumel - da imajo poslovne banke pravico postavljati limite, koliko lahko občan, ki ima svoj žiro račun ali devizno knjižico, koliko sme dvigniti v določenem času. Najbrž je to neka zakonska regulacija in domnevam, da je. Tisto, kar se sedaj dogaja, je pa seveda nekaj drugega. Mislim, da poslovne banke, posebno Ljubljanska banka, nam pred našimi očmi krojijo na novo in skušajo ustrojiti socialno-političen svet na slovenskem z dobesedno romunizacijo, ki se kaže na ta način, da se začnejo zbirati čakajoči ob 21.00 zvečer. Do 5.00 zjutraj so strašne vrste potem se začne kupčkanje, preprodajanje mest in tako naprej. Če štiri ali pet varčevalcev nekaj dobi, kar pomeni, da so te devize še in še preplačane."
"parl.DruzPolZb","seja",16,"1991-03-29","10:25:00","12:40:00","SeligoRudi1935",0,"DruzPolZb.1991-03-29.s016-03.sp-609","DruzPolZb.1991-03-29.s016-03.sp-609.6",DruzPolZb.1991-03-29.s016-03.toc-item5,"taxonomy.4.3.3","topic.472","utterance","Kdor se le malo ozre po teh vrstah, vidi da to ni nedolžno in da najbrž to ni samo vprašanje poslovnih bank. Ker se godi točno na socialno političnem nivoju. Mogoče je to samo videz, mogoče pa kaj več, kar si vsi skupaj ne želimo. Konkretno bi dal pobudo Izvršnemu svetu, pa res ne vem, koliko so to njegove kompetence, da izda neka navodila, priporočila poslovnim bankam, naj uredijo te limite na nek drug način. Prepričan sem, da je mogoč drugačen način reševanja tega. Predvsem na tak način, ki nas ne bo spominjal na Romunijo in na vse tisto, kar lahko iz tega nastane. Hvala lepa."
"parl.DruzPolZb","seja",16,"1991-03-29","10:25:00","12:40:00","",0,"DruzPolZb.1991-03-29.s016-03.sp-610","DruzPolZb.1991-03-29.s016-03.sp-610.1",DruzPolZb.1991-03-29.s016-03.toc-item5,"","","speaker","PREDSEDNIK DR. LUDVIK TOPLAK:"
"parl.DruzPolZb","seja",16,"1991-03-29","10:25:00","12:40:00","ToplakLudvik1942",1,"DruzPolZb.1991-03-29.s016-03.sp-610","DruzPolZb.1991-03-29.s016-03.sp-610.2",DruzPolZb.1991-03-29.s016-03.toc-item5,"taxonomy.4.3.3","topic.472","utterance","Gospod Pučnik in Franco Juri bosta še dala pobudo ali postavila vprašanje."
"parl.DruzPolZb","seja",16,"1991-03-29","10:25:00","12:40:00","",0,"DruzPolZb.1991-03-29.s016-03.sp-611","DruzPolZb.1991-03-29.s016-03.sp-611.1",DruzPolZb.1991-03-29.s016-03.toc-item5,"","","speaker","IVAN PUČNIK:"
"parl.DruzPolZb","seja",16,"1991-03-29","10:25:00","12:40:00","PucnikIvan1927",0,"DruzPolZb.1991-03-29.s016-03.sp-611","DruzPolZb.1991-03-29.s016-03.sp-611.2",DruzPolZb.1991-03-29.s016-03.toc-item5,"taxonomy.4.3.3","topic.472","utterance","Spoštovani! V zvezi z mladinskim vprašanjem, za katerega sem tudi jaz glasoval, je gospod Pahor, ki je žal odsoten, postavil vprašanje kulture v politiki, ali kakor je on imenoval, kulturne politike."
"parl.DruzPolZb","seja",16,"1991-03-29","10:25:00","12:40:00","PucnikIvan1927",0,"DruzPolZb.1991-03-29.s016-03.sp-611","DruzPolZb.1991-03-29.s016-03.sp-611.3",DruzPolZb.1991-03-29.s016-03.toc-item5,"taxonomy.4.3.3","topic.472","utterance","Menim, da je to zelo umestno vprašanje, ki ves čas spremlja ta parlament in ocenjujem ravno kulturne odnose med nami, nevredne tega parlamenta. Če začnem pri prvih urah, ko še nismo dodobra zagreli vsak svojega stola, smo poželi očitek s strani mojstra novinarske besede, ki tudi sedi v tem zboru, o oblastniški pogoltnosti. In še marsikaj drugega. Poželi smo ogromno posmehovanja na račun vodenja prvih sej, tako da so se gledalci televizije zgražali nad tem, kar so naša sredstva prenašala. Poskušalo se je omalovaževati tiste ljudi, ki so prvič sedli na mesto, kjer je treba voditi tako pomembne seje, kot so recimo seje zborov. In posmehovanja je bilo toliko, da res moramo reči, da je ta parlament začel brez politične kulture. Skratka, demonstriralo se je skrajno nespoštovanje do drugače mislečih, čeprav smo si vsi skupaj več ali manj izbrali, da bomo spoštovali drug drugega, čeprav drugače mislimo."
"parl.DruzPolZb","seja",16,"1991-03-29","10:25:00","12:40:00","PucnikIvan1927",0,"DruzPolZb.1991-03-29.s016-03.sp-611","DruzPolZb.1991-03-29.s016-03.sp-611.4",DruzPolZb.1991-03-29.s016-03.toc-item5,"taxonomy.4.3.3","topic.472","utterance","Sledilo je poniževanje izvoljenih funkcionarjev. Kar začnimo pri gospodu Toplaku, ki ni prisoten. Da ne govorim o gospodu Bučarju, o katerem je včeraj rekel gospod Smole, da Habsburgu ""nekam leze"". Ali je to spoštovanje do predsednika slovenskega parlamenta?"
"parl.DruzPolZb","seja",16,"1991-03-29","10:25:00","12:40:00","",0,"DruzPolZb.1991-03-29.s016-03.sp-612","DruzPolZb.1991-03-29.s016-03.sp-612.1",DruzPolZb.1991-03-29.s016-03.toc-item5,"","","speaker","JOŽE SMOLE:"
"parl.DruzPolZb","seja",16,"1991-03-29","10:25:00","12:40:00","",0,"DruzPolZb.1991-03-29.s016-03.sp-612","DruzPolZb.1991-03-29.s016-03.sp-612.2",DruzPolZb.1991-03-29.s016-03.toc-item5,"","","location","iz klopi):"
"parl.DruzPolZb","seja",16,"1991-03-29","10:25:00","12:40:00","SmoleJoze1927",0,"DruzPolZb.1991-03-29.s016-03.sp-612","DruzPolZb.1991-03-29.s016-03.sp-612.3",DruzPolZb.1991-03-29.s016-03.toc-item5,"taxonomy.4.3.3","topic.472","utterance","Tega jaz nisem rekel."
"parl.DruzPolZb","seja",16,"1991-03-29","10:25:00","12:40:00","",0,"DruzPolZb.1991-03-29.s016-03.sp-613","DruzPolZb.1991-03-29.s016-03.sp-613.1",DruzPolZb.1991-03-29.s016-03.toc-item5,"","","speaker","IVAN PUČNIK:"
"parl.DruzPolZb","seja",16,"1991-03-29","10:25:00","12:40:00","PucnikIvan1927",0,"DruzPolZb.1991-03-29.s016-03.sp-613","DruzPolZb.1991-03-29.s016-03.sp-613.2",DruzPolZb.1991-03-29.s016-03.toc-item5,"taxonomy.4.3.3","topic.472","utterance","Vi ste to rekli, gospod Smole!"
"parl.DruzPolZb","seja",16,"1991-03-29","10:25:00","12:40:00","",0,"DruzPolZb.1991-03-29.s016-03.sp-614","DruzPolZb.1991-03-29.s016-03.sp-614.1",DruzPolZb.1991-03-29.s016-03.toc-item5,"","","speaker","JOŽE SMOLE:"
"parl.DruzPolZb","seja",16,"1991-03-29","10:25:00","12:40:00","",0,"DruzPolZb.1991-03-29.s016-03.sp-614","DruzPolZb.1991-03-29.s016-03.sp-614.2",DruzPolZb.1991-03-29.s016-03.toc-item5,"","","location","iz klopi):"
"parl.DruzPolZb","seja",16,"1991-03-29","10:25:00","12:40:00","SmoleJoze1927",0,"DruzPolZb.1991-03-29.s016-03.sp-614","DruzPolZb.1991-03-29.s016-03.sp-614.3",DruzPolZb.1991-03-29.s016-03.toc-item5,"taxonomy.4.3.3","topic.472","utterance","Rekel sem, da nekateri nekomu lezejo, nisem pa omenil Habsburge."
"parl.DruzPolZb","seja",16,"1991-03-29","10:25:00","12:40:00","",0,"DruzPolZb.1991-03-29.s016-03.sp-615","DruzPolZb.1991-03-29.s016-03.sp-615.1",DruzPolZb.1991-03-29.s016-03.toc-item5,"","","speaker","IVAN PUČNIK:"
"parl.DruzPolZb","seja",16,"1991-03-29","10:25:00","12:40:00","PucnikIvan1927",0,"DruzPolZb.1991-03-29.s016-03.sp-615","DruzPolZb.1991-03-29.s016-03.sp-615.2",DruzPolZb.1991-03-29.s016-03.toc-item5,"taxonomy.4.3.3","topic.472","utterance","No mislim, da to stvari nič ne spremeni, gospod Smole. Menim, da je to pristop skrajne diskvalifikacije izvoljenih funkcionarjev našega parlamenta in moram reči, da odločno protestiram proti takemu odnosu. Vsak človek, ki prihaja sem sedet, ga je določeno število volilcev izvolilo. Zagotovo je tudi pošten državljan, sicer ga ljudje ne bi izvolili in tudi zato tukaj zasluži svoje spoštovanje, ne glede na to, če se drugi z njegovim političnim mišljenjem ne ujemajo"
"parl.DruzPolZb","seja",16,"1991-03-29","10:25:00","12:40:00","",0,"DruzPolZb.1991-03-29.s016-03.sp-615","DruzPolZb.1991-03-29.s016-03.sp-615.3",DruzPolZb.1991-03-29.s016-03.toc-item5,"","","debate","strinjajo"
