"orgId","type of session","number","date","notBefore","notAfter","persId","chairman","spId","nodeId","titleId","taxonomyIds","topicIds","type","text string"
"parl.DruzPolZb","seja",33,"1992-03-05","10:10:00","13:15:00","",0,"DruzPolZb.1992-03-05.s033-02.sp-237","DruzPolZb.1992-03-05.s033-02.sp-237.1",DruzPolZb.1992-03-05.s033-02.toc-item1,"","","speaker","PREDSEDNIK DR. LUDVIK TOPLAK:"
"parl.DruzPolZb","seja",33,"1992-03-05","10:10:00","13:15:00","ToplakLudvik1942",1,"DruzPolZb.1992-03-05.s033-02.sp-237","DruzPolZb.1992-03-05.s033-02.sp-237.2",DruzPolZb.1992-03-05.s033-02.toc-item1,"taxonomy.2.8","topic.50","utterance","Navzočih je 46 poslank in poslancev. Kratka obvestila. Na nadaljevanju 33. seje bo zbor obravnaval še nedokončane zadeve iz prejšnjega dnevnega reda. Zboru predlagam, da bi danes delali do konca in da ne postavljamo omejitev, tudi z 19. uro ne. Družbenopolitični zbor bi imel pavzo ob 13. uri in 30 minut in bi trajala 45 minut."
"parl.DruzPolZb","seja",33,"1992-03-05","10:10:00","13:15:00","ToplakLudvik1942",1,"DruzPolZb.1992-03-05.s033-02.sp-237","DruzPolZb.1992-03-05.s033-02.sp-237.3",DruzPolZb.1992-03-05.s033-02.toc-item2,"taxonomy.3.6.1.2","topic.225","utterance","Zboru predlagam, da bi glede na to, da smo dobili obvestilo Zbora združenega dela, da so v celoti sprejeli sporazumni predlog skupne komisije k predlogu zakona o zadrugah, najprej glasovali o RAZŠIRITVI DNEVNEGA REDA S TOČKO: SPORAZUMNI PREDLOG SKUPNE KOMISIJE ZA USKLADITEV BESEDILA PREDLOGA ZAKONA O ZADRUGAH, nato usklajevanje zakona o zadrugah, nato bi opravili usklajevanje zakona o pokojninskem in invalidskem zavarovanju. Potem pa bi nadaljevali delo po sprejetem dnevnem redu."
"parl.DruzPolZb","seja",33,"1992-03-05","10:10:00","13:15:00","ToplakLudvik1942",1,"DruzPolZb.1992-03-05.s033-02.sp-237","DruzPolZb.1992-03-05.s033-02.sp-237.4",DruzPolZb.1992-03-05.s033-02.toc-item2,"taxonomy.3.6.1.2","topic.225","utterance","Delovna skupina za usklajevanje zakona o obrestni meri, zamudnih obrestih bi zasedala ob 10. uri in 30 minut v sobi 217 v drugem nadstropju. Člani delovne skupine so: Janko Halb, Mile Šetinc, Borut Šuklje, Milan Pintar in Slavko Kmetič."
"parl.DruzPolZb","seja",33,"1992-03-05","10:10:00","13:15:00","ToplakLudvik1942",1,"DruzPolZb.1992-03-05.s033-02.sp-237","DruzPolZb.1992-03-05.s033-02.sp-237.5",DruzPolZb.1992-03-05.s033-02.toc-item2,"taxonomy.3.6.1.2","topic.225","utterance","Delovna skupina za usklajevanje predloga zakona o plačah delavcev v vzgojno-izobraževalnih zavodih bo ob 12. uri v sobi 209 v drugem nadstropju. Člani te delovne skupine so: Franc Pivec, dr. Stanko Buser, Štefan Kociper, Bojan Vaupotič in Vane Gošnik."
"parl.DruzPolZb","seja",33,"1992-03-05","10:10:00","13:15:00","ToplakLudvik1942",1,"DruzPolZb.1992-03-05.s033-02.sp-237","DruzPolZb.1992-03-05.s033-02.sp-237.6",DruzPolZb.1992-03-05.s033-02.toc-item2,"taxonomy.3.6.1.2","topic.225","utterance","Preidimo na predlog za razširitev dnevnega reda. Med sejo smo prejeli obvestilo Zbora združenega dela, da je sprejel predlog skupne komisije k predlogu zakona o zadrugah. V skladu s sprejetim sklepom našega zbora predlagam zboru, da dnevni red seje razširimo še s točko: usklajevanje predloga zakona o zadrugah. Želi o predlagani razširitvi kdo razpravljati? Prosim, gospod Anderlič."
"parl.DruzPolZb","seja",33,"1992-03-05","10:10:00","13:15:00","",0,"DruzPolZb.1992-03-05.s033-02.sp-238","DruzPolZb.1992-03-05.s033-02.sp-238.1",DruzPolZb.1992-03-05.s033-02.toc-item2,"","","speaker","TONE ANDERLIČ:"
"parl.DruzPolZb","seja",33,"1992-03-05","10:10:00","13:15:00","AnderlicTone1956",0,"DruzPolZb.1992-03-05.s033-02.sp-238","DruzPolZb.1992-03-05.s033-02.sp-238.2",DruzPolZb.1992-03-05.s033-02.toc-item2,"taxonomy.3.6.1.2","topic.225","utterance","S sklicem te seje je bila predvidena tudi skupna seja vseh treh zborov za usklajevanje pokojninskega zakona. Ker očitno o tem sedaj ni govor in ker ni jasno, kdaj bo prišlo na dnevni red in velike možnosti obstajajo, da se to na današnji dan ne bo obravnavalo ali pa bo prišlo do nesklepčnosti ali karkoli drugega, predlagam da določimo uro tega skupnega zasedanja že sedaj, tako da bi vedeli."
"parl.DruzPolZb","seja",33,"1992-03-05","10:10:00","13:15:00","",0,"DruzPolZb.1992-03-05.s033-02.sp-239","DruzPolZb.1992-03-05.s033-02.sp-239.1",DruzPolZb.1992-03-05.s033-02.toc-item2,"","","speaker","PREDSEDNIK DR. LUDVIK TOPLAK:"
"parl.DruzPolZb","seja",33,"1992-03-05","10:10:00","13:15:00","ToplakLudvik1942",1,"DruzPolZb.1992-03-05.s033-02.sp-239","DruzPolZb.1992-03-05.s033-02.sp-239.2",DruzPolZb.1992-03-05.s033-02.toc-item2,"taxonomy.3.6.1.2","topic.225","utterance","Takoj povem. Po predlogu predsednika Zbora občin - predsednika Zbora združenega dela še nisem uspel dobiti - če bi končal Zbor združenega dela prej kot so nekateri predvidevali, potem prej, sicer pa je rečeno ob 14.uri in 30 minut, to pomeni takoj po naši pavzi."
"parl.DruzPolZb","seja",33,"1992-03-05","10:10:00","13:15:00","ToplakLudvik1942",1,"DruzPolZb.1992-03-05.s033-02.sp-239","DruzPolZb.1992-03-05.s033-02.sp-239.3",DruzPolZb.1992-03-05.s033-02.toc-item2,"taxonomy.3.6.1.2","topic.225","utterance","Besedo ima gospod Kopač. Samo še to. Moram pa dobiti potrdilo za to še od predsednika Zbora združenega dela in že vspostavljajo strokovne službe stik z njim. Prosim, Kopač Janez."
"parl.DruzPolZb","seja",33,"1992-03-05","10:10:00","13:15:00","",0,"DruzPolZb.1992-03-05.s033-02.sp-240","DruzPolZb.1992-03-05.s033-02.sp-240.1",DruzPolZb.1992-03-05.s033-02.toc-item2,"","","speaker","JANEZ KOPAČ:"
"parl.DruzPolZb","seja",33,"1992-03-05","10:10:00","13:15:00","KopacJanez1961",0,"DruzPolZb.1992-03-05.s033-02.sp-240","DruzPolZb.1992-03-05.s033-02.sp-240.2",DruzPolZb.1992-03-05.s033-02.toc-item2,"taxonomy.3.6.1.2","topic.225","utterance","Hvala za besedo. Predlagam, da ne razširimo dnevnega reda z odločanjem predloga zakona o zadrugah oziroma za odločanje o tako imenovanih usklajenih amandmajih oziroma sporazumno določenih, ker ti amandmaji pač niso bili sporazumno določeni. Nekoč, ko smo imeli tisto večerno mašo pri predsedniku Peterletu in smo se pogovarjali, kako naprej iz zagate o odločanju o posameznih zakonih, je bilo dogovorjeno, da se bodo predstavniki klubov dogovorili o kompromisni rešitvi, vendar je potem do oblikovanja kompromisne rešitve prišlo na sestanku med predstavniki Vlade in pa nekaj poslanci Slovenske kmečke zveze oziroma Slovenske ljudske stranke, ki so se takrat na listo prisotnosti napisali celo kot predstavniki Družbenopolitičnega zbora, kar seveda ni bilo res. Ampak, recimo da gre samo za tehnično podrobnost, medtem ko med predstavniki posameznih poslanskih klubov tisti sporazumni predlog potem ni bil usklajen. Res je, da ga je medzborovska usklajevalna komisija, ki je obstajala že od prej, nekako predlagala Zboru združenega dela in tudi drugima dvema zboroma, Zbor združenega dela ga je celo sprejel. Vendar trdim, da ne gre za sporazumno usklajen kompromisni predlog in predlagam, da se danes o njem ne glasuje, torej, da se ne razširi dnevni red z glasovanjem o tem zakonu. Hvala lepa."
"parl.DruzPolZb","seja",33,"1992-03-05","10:10:00","13:15:00","",0,"DruzPolZb.1992-03-05.s033-02.sp-241","DruzPolZb.1992-03-05.s033-02.sp-241.1",DruzPolZb.1992-03-05.s033-02.toc-item2,"","","speaker","PREDSEDNIK DR. LUDVIK TOPLAK:"
"parl.DruzPolZb","seja",33,"1992-03-05","10:10:00","13:15:00","ToplakLudvik1942",1,"DruzPolZb.1992-03-05.s033-02.sp-241","DruzPolZb.1992-03-05.s033-02.sp-241.2",DruzPolZb.1992-03-05.s033-02.toc-item2,"taxonomy.3.6.1.2","topic.225","utterance","Prosim, gospod Potočnik, imate besedo; Pučnik, Zagožen."
"parl.DruzPolZb","seja",33,"1992-03-05","10:10:00","13:15:00","",0,"DruzPolZb.1992-03-05.s033-02.sp-242","DruzPolZb.1992-03-05.s033-02.sp-242.1",DruzPolZb.1992-03-05.s033-02.toc-item2,"","","speaker","FRANC POTOČNIK:"
"parl.DruzPolZb","seja",33,"1992-03-05","10:10:00","13:15:00","PotočnikFranc1955",0,"DruzPolZb.1992-03-05.s033-02.sp-242","DruzPolZb.1992-03-05.s033-02.sp-242.2",DruzPolZb.1992-03-05.s033-02.toc-item2,"taxonomy.3.6.1.2","topic.225","utterance","Moram povedati, da sem bil na tem usklajevanju, na katerem so bili prisotni štirje poslanci iz Zbora združenega dela, potem iz Zbora občin kot predstavnik Združene zveze in seveda tudi predstavniki Slovenske kmečke zveze - Ljudske stranke in takrat smo se dogovorili. Ta predlog so podprli delegati Zbora združenega dela in seveda tam je pravzaprav bila do sedaj blokada okrog tega zakona, v vseh nadaljnjih usklajevanjih so ti predstavniki, ki so preje nasprotovali desetemu poglavju, pač ta kompromisni predlog zagovarjali. Tudi na Odboru za kmetijstvo in gozdarstvo smo ta usklajeni predlog obravnavali in ga z večino glasov tudi podprli. Tako da mislim, da ta stvar je zrela, da se danes dokončno razreši."
"parl.DruzPolZb","seja",33,"1992-03-05","10:10:00","13:15:00","",0,"DruzPolZb.1992-03-05.s033-02.sp-243","DruzPolZb.1992-03-05.s033-02.sp-243.1",DruzPolZb.1992-03-05.s033-02.toc-item2,"","","speaker","PREDSEDNIK DR. LUDVIK TOPLAK:"
"parl.DruzPolZb","seja",33,"1992-03-05","10:10:00","13:15:00","ToplakLudvik1942",1,"DruzPolZb.1992-03-05.s033-02.sp-243","DruzPolZb.1992-03-05.s033-02.sp-243.2",DruzPolZb.1992-03-05.s033-02.toc-item2,"taxonomy.3.6.1.2","topic.225","utterance","Hvala lepa. Gospod Pučnik."
"parl.DruzPolZb","seja",33,"1992-03-05","10:10:00","13:15:00","",0,"DruzPolZb.1992-03-05.s033-02.sp-244","DruzPolZb.1992-03-05.s033-02.sp-244.1",DruzPolZb.1992-03-05.s033-02.toc-item2,"","","speaker","IVAN PUČNIK:"
"parl.DruzPolZb","seja",33,"1992-03-05","10:10:00","13:15:00","PucnikIvan1927",0,"DruzPolZb.1992-03-05.s033-02.sp-244","DruzPolZb.1992-03-05.s033-02.sp-244.2",DruzPolZb.1992-03-05.s033-02.toc-item2,"taxonomy.3.6.1.2","topic.225","utterance","Spoštovani, da se zakonu mudi vemo, obtičal je v Zboru združenega dela, včeraj se je tam pokazalo razumevanje in je ta zakon šel skozi. Ne vem zakaj ga ne bi potem naš zbor obravnaval, če ga je že svoj čas sprejel z bolj problematično vsebino. To se pravi, odstotek je bil premajhen, Zbor združenega dela je to sprejel in predlagam, da ga danes obravnavamo na naši seji. Hvala."
"parl.DruzPolZb","seja",33,"1992-03-05","10:10:00","13:15:00","",0,"DruzPolZb.1992-03-05.s033-02.sp-245","DruzPolZb.1992-03-05.s033-02.sp-245.1",DruzPolZb.1992-03-05.s033-02.toc-item2,"","","speaker","PREDSEDNIK DR. LUDVIK TOPLAK:"
"parl.DruzPolZb","seja",33,"1992-03-05","10:10:00","13:15:00","ToplakLudvik1942",1,"DruzPolZb.1992-03-05.s033-02.sp-245","DruzPolZb.1992-03-05.s033-02.sp-245.2",DruzPolZb.1992-03-05.s033-02.toc-item2,"taxonomy.3.6.1.2","topic.225","utterance","Hvala lepa, gospod Zagožen."
"parl.DruzPolZb","seja",33,"1992-03-05","10:10:00","13:15:00","",0,"DruzPolZb.1992-03-05.s033-02.sp-246","DruzPolZb.1992-03-05.s033-02.sp-246.1",DruzPolZb.1992-03-05.s033-02.toc-item2,"","","speaker","DR. FRANC ZAGOŽEN:"
"parl.DruzPolZb","seja",33,"1992-03-05","10:10:00","13:15:00","ZagozenFrance1942",0,"DruzPolZb.1992-03-05.s033-02.sp-246","DruzPolZb.1992-03-05.s033-02.sp-246.2",DruzPolZb.1992-03-05.s033-02.toc-item2,"taxonomy.3.6.1.2","topic.225","utterance","Spoštovani, ne jaz ne verjamem, da je mogoče o vseh stvareh dobiti 100% konsenz, ampak gospoda Kopača bi popravil v toliko, da je Vlada sporazumevanje med Zborom združenega dela in predlagatelji amandmaja za 51% delež prenosa živilske industrije na zadruge organizirala in tako smo bili tam predstavniki Kmečke zveze in Zadružne zveze, ki smo predlagali ta amandma, ki je bil v vseh treh zborih sicer izglasovan, ampak sporn in je Zbor združenega dela zaradi tega zavračal 10. poglavje. Včeraj ga je sprejel. Oba amandmaja, ki naj bi ju danes dali na dnevni red, sta predloge skupne komisije vseh treh zborov. Mislim, da je v tem pogledu postopek korekten. Predlagam, da sprejmemo na dnevni red tudi ta zakon in da končno pridemo do njega."
"parl.DruzPolZb","seja",33,"1992-03-05","10:10:00","13:15:00","",0,"DruzPolZb.1992-03-05.s033-02.sp-247","DruzPolZb.1992-03-05.s033-02.sp-247.1",DruzPolZb.1992-03-05.s033-02.toc-item2,"","","speaker","PREDSEDNIK DR. LUDVIK TOPLAK:"
"parl.DruzPolZb","seja",33,"1992-03-05","10:10:00","13:15:00","ToplakLudvik1942",1,"DruzPolZb.1992-03-05.s033-02.sp-247","DruzPolZb.1992-03-05.s033-02.sp-247.2",DruzPolZb.1992-03-05.s033-02.toc-item2,"taxonomy.3.6.1.2","topic.225","utterance","Hvala lepa. Gospod Kopač."
"parl.DruzPolZb","seja",33,"1992-03-05","10:10:00","13:15:00","",0,"DruzPolZb.1992-03-05.s033-02.sp-248","DruzPolZb.1992-03-05.s033-02.sp-248.1",DruzPolZb.1992-03-05.s033-02.toc-item2,"","","speaker","JANEZ KOPAČ:"
"parl.DruzPolZb","seja",33,"1992-03-05","10:10:00","13:15:00","KopacJanez1961",0,"DruzPolZb.1992-03-05.s033-02.sp-248","DruzPolZb.1992-03-05.s033-02.sp-248.2",DruzPolZb.1992-03-05.s033-02.toc-item2,"taxonomy.3.6.1.2","topic.225","utterance","Hvala za besedo. Ne oporekam nobeni od teh reči, saj vsaka je samo še dodatneje pojasnila tiste stvari, ki sem jih že preje napovedal. Vztrajam pa, da ne gre za sporazumno oblikovan predlog, kakršen je bil pač medstrankarski dogovor na sestanku, ki ga je sklical predsednik Vlade Peterle nekega večera v skupščini, ne spomnim se točno datuma, in na katerem smo se pogovarjali o zakonu o privatizaciji, o proračunu in o zakonu o zadrugah. Takrat je bil dogovor in dogovori bi prispevali do nekega medsebojnega zaupanja. Dogovor je bil, bo oblikovan predlog, ki bo usklajen med poslanskimi klubi. Tega ni bilo, ker nihče ni sprožil tega procesa, je pa seveda prišlo do neke druge skupine. Omenjeno je bilo, da je Vlada sklicala predstavnike Kmečke zveze in Zadružne zveze in na tem sestanku so potem oblikovali predlog, ki je bil potem izglasovan na Zboru združenega dela. Torej moja argumentacija je šla v smer, da to ni predlog, ki bi bil narejen tako, kot smo se takrat dogovorili, zato se mi počutimo izigrane in zato predlagamo, da se o tem ne glasuje."
"parl.DruzPolZb","seja",33,"1992-03-05","10:10:00","13:15:00","",0,"DruzPolZb.1992-03-05.s033-02.sp-249","DruzPolZb.1992-03-05.s033-02.sp-249.1",DruzPolZb.1992-03-05.s033-02.toc-item2,"","","speaker","PREDSEDNIK DR. LUDVIK TOPLAK:"
"parl.DruzPolZb","seja",33,"1992-03-05","10:10:00","13:15:00","ToplakLudvik1942",1,"DruzPolZb.1992-03-05.s033-02.sp-249","DruzPolZb.1992-03-05.s033-02.sp-249.2",DruzPolZb.1992-03-05.s033-02.toc-item2,"taxonomy.3.6.1.2","topic.225","utterance","Še kdo? Prosim, gospod Potrč."
"parl.DruzPolZb","seja",33,"1992-03-05","10:10:00","13:15:00","",0,"DruzPolZb.1992-03-05.s033-02.sp-250","DruzPolZb.1992-03-05.s033-02.sp-250.1",DruzPolZb.1992-03-05.s033-02.toc-item2,"","","speaker","MIRAN POTRČ:"
"parl.DruzPolZb","seja",33,"1992-03-05","10:10:00","13:15:00","PotrcMiran1938",0,"DruzPolZb.1992-03-05.s033-02.sp-250","DruzPolZb.1992-03-05.s033-02.sp-250.2",DruzPolZb.1992-03-05.s033-02.toc-item2,"taxonomy.3.6.1.2","topic.225","utterance","Sem za to, da odločamo, ker vem, da bomo to storili. Osebno bom proti, da se uvrsti na dnevni red, ker predlog ni sporazumen. V našem poslanskem klubu smo skupini, ki naj bi oblikovala tako imenovani sporazumni predlog posredovali naša stališča, ki jih ima poslanski klub do tega zakona in tudi opozorili, da je osnovni problem samo navidezno usklajevanje z Zborom združenega dela in usklajevanje med Slovensko ljudsko stranko in Zadružno zvezo. Gre za to, da bi to morali uskladiti pač med poslanskimi klubi, ki imajo izrazito različna stališča. To ni bilo storjeno, mene to ne preseneča, pritiski na to, neprincipielni, z onemogočanjem tudi drugih zakonov, dokler se ta ne sprejme, so mi v parlamentu poznani. Jaz bom kasneje v razpravi o tem svoje mnenje povedal. Korektno stvari niso bile izvedene, ampak to se ne dogaja prvič. Naj pač prevlada tista večina in naj potem tudi nosi odgovornost za to, kar bo sprejeto. Hvala."
"parl.DruzPolZb","seja",33,"1992-03-05","10:10:00","13:15:00","",0,"DruzPolZb.1992-03-05.s033-02.sp-251","DruzPolZb.1992-03-05.s033-02.sp-251.1",DruzPolZb.1992-03-05.s033-02.toc-item2,"","","speaker","PREDSEDNIK DR. LUDVIK TOPLAK:"
"parl.DruzPolZb","seja",33,"1992-03-05","10:10:00","13:15:00","ToplakLudvik1942",1,"DruzPolZb.1992-03-05.s033-02.sp-251","DruzPolZb.1992-03-05.s033-02.sp-251.2",DruzPolZb.1992-03-05.s033-02.toc-item2,"taxonomy.3.6.1.2","topic.225","utterance","Hvala lepa. Še kdo? Če ni zaključujemo. Prehajamo na glasovanje glede predloga razširitve dnevnega reda. Najprej ugotovimo navzočnost."
"parl.DruzPolZb","seja",33,"1992-03-05","10:10:00","13:15:00","",0,"DruzPolZb.1992-03-05.s033-02.sp-251","DruzPolZb.1992-03-05.s033-02.sp-251.3",DruzPolZb.1992-03-05.s033-02.toc-item2,"","","quorum","52 prisotnih."
"parl.DruzPolZb","seja",33,"1992-03-05","10:10:00","13:15:00","ToplakLudvik1942",1,"DruzPolZb.1992-03-05.s033-02.sp-251","DruzPolZb.1992-03-05.s033-02.sp-251.4",DruzPolZb.1992-03-05.s033-02.toc-item2,"taxonomy.3.6.1.2","topic.225","utterance","Kdo je za razširitev dnevnega reda s točko usklajevanje predloga zakona o zadrugah?"
"parl.DruzPolZb","seja",33,"1992-03-05","10:10:00","13:15:00","",0,"DruzPolZb.1992-03-05.s033-02.sp-251","DruzPolZb.1992-03-05.s033-02.sp-251.5",DruzPolZb.1992-03-05.s033-02.toc-item2,"","","vote","25 poslancev."
"parl.DruzPolZb","seja",33,"1992-03-05","10:10:00","13:15:00","ToplakLudvik1942",1,"DruzPolZb.1992-03-05.s033-02.sp-251","DruzPolZb.1992-03-05.s033-02.sp-251.6",DruzPolZb.1992-03-05.s033-02.toc-item2,"taxonomy.3.6.1.2","topic.225","utterance","Je kdo proti?"
"parl.DruzPolZb","seja",33,"1992-03-05","10:10:00","13:15:00","",0,"DruzPolZb.1992-03-05.s033-02.sp-251","DruzPolZb.1992-03-05.s033-02.sp-251.7",DruzPolZb.1992-03-05.s033-02.toc-item2,"","","vote","18 poslancev."
"parl.DruzPolZb","seja",33,"1992-03-05","10:10:00","13:15:00","ToplakLudvik1942",1,"DruzPolZb.1992-03-05.s033-02.sp-251","DruzPolZb.1992-03-05.s033-02.sp-251.8",DruzPolZb.1992-03-05.s033-02.toc-item2,"taxonomy.3.6.1.2","topic.225","utterance","Se je kdo vzdržal?"
"parl.DruzPolZb","seja",33,"1992-03-05","10:10:00","13:15:00","",0,"DruzPolZb.1992-03-05.s033-02.sp-251","DruzPolZb.1992-03-05.s033-02.sp-251.9",DruzPolZb.1992-03-05.s033-02.toc-item2,"","","vote","10 poslancev."
"parl.DruzPolZb","seja",33,"1992-03-05","10:10:00","13:15:00","ToplakLudvik1942",1,"DruzPolZb.1992-03-05.s033-02.sp-251","DruzPolZb.1992-03-05.s033-02.sp-251.10",DruzPolZb.1992-03-05.s033-02.toc-item2,"taxonomy.3.6.1.2","topic.225","utterance","Ugotavljam, da predlog razširitve dnevnega reda ni izglasovan."
"parl.DruzPolZb","seja",33,"1992-03-05","10:10:00","13:15:00","ToplakLudvik1942",1,"DruzPolZb.1992-03-05.s033-02.sp-251","DruzPolZb.1992-03-05.s033-02.sp-251.11",DruzPolZb.1992-03-05.s033-02.toc-item3,"taxonomy.3.9.5.3.5","topic.425","utterance","Prehajamo na 15. razširjeno TOČKO DNEVNEGA REDA. Zboru predlagam, da bi nadaljevali USKLAJEVANJE PREDLOGA ZAKONA O POKOJNINSKEM IN INVALIDSKEM ZAVAROVANJU."
"parl.DruzPolZb","seja",33,"1992-03-05","10:10:00","13:15:00","ToplakLudvik1942",1,"DruzPolZb.1992-03-05.s033-02.sp-251","DruzPolZb.1992-03-05.s033-02.sp-251.12",DruzPolZb.1992-03-05.s033-02.toc-item3,"taxonomy.3.9.5.3.5","topic.425","utterance","Glasovanje in usklajevanje na zboru pri tem zakonu smo sicer že opravili, ker je bila predvidena uveljavitev tega zakona s 1.1.1992, po ponovnem glasovanju o amandmajih dne 31.1.1992, po drugem ponovnem glasovanju pa 1.3.1992. Zbori Skupščine Republike Slovenije pa tudi do tega datuma zakona niso sprejeli v usklajenem besedilu. Zato je Vlada predložila redakcijske amandmaje, ki se nanašajo na pričetek veljavnosti zakona in na datum, do katerega se usklajujejo prejšnji predpisi. Želi kdo razpravljati? Predlog amandmajev ste prejeli na klop. Če ni, predlagam glasovanje. Prosim, gospod Potrč."
"parl.DruzPolZb","seja",33,"1992-03-05","10:10:00","13:15:00","",0,"DruzPolZb.1992-03-05.s033-02.sp-252","DruzPolZb.1992-03-05.s033-02.sp-252.1",DruzPolZb.1992-03-05.s033-02.toc-item3,"","","speaker","MIRAN POTRČ:"
"parl.DruzPolZb","seja",33,"1992-03-05","10:10:00","13:15:00","PotrcMiran1938",0,"DruzPolZb.1992-03-05.s033-02.sp-252","DruzPolZb.1992-03-05.s033-02.sp-252.2",DruzPolZb.1992-03-05.s033-02.toc-item3,"taxonomy.3.9.5.3.5","topic.425","utterance","Morda se kdo spominja, da sem ob enakem predlogu Vlade, takrat ni šlo za 1. april ampak je šlo za 1. marec, opozoril na dejstvo, da ima zavlačevanje ali pa nesprejem tega zakona določene posledice in predlagal razmislek, da bi glede nekaterih vprašanj ta zakon veljal s 1.1. Utemeljil sem tudi, zakaj je to mogoče. Moram reči, da je takrat na podlagi mnenja, ki ga je Vlada korektno dala, zbor izglasoval drugače, tudi ob ugotovitvi Vlade, da gre za sistemski zakon, čemur jaz ne oporekam in sistem naj velja normalno od 1. aprila in hkrati z ugotovitvijo, da niso točna moja dejstva, da nesprejem zakona s 1.1. nima nobenih (ali s 1.4.) nima nobenih posledic. Imam sedaj podatke SPIZa, iz katerih je razvidno, da: ""ko novi zakon ni bil sprejet, niso bile izvedene celotne uskladitve z znanimi podatki v letu 1992, in sicer: upokojencem in uživalcem dodatka za pomoč in postrežbo in nadomestil za telesno okvaro ni bila izvršena še uskladitev v višini 11,5% za november 1991 in 13,1% za december 1991; kmečkim upokojencem pa ni bila izvršena uskladitev v višini 11,5% za november in december 1991 in 13.1% za december 1991 in januar 1992"". Torej želim povedati, da ugotovitev Vlade, da ni nobene razlike, ali zakon velja v nekaterih točkah - jaz pa že zadnjič nisem predlagal, da kot sistem za nazaj - od 1.1. ali 1.4. ni točna. So posledice. In ponovno predlagam, da zakon sicer velja s 1.4., da pa določbe, ki se nanašajo na vprašanje uživalcev dodatka za pomoč in postrežbo in nadomestil za telesno okvaro in kmečkim upokojencem velja od 1.1., da bi bile na ta način lahko izplačane tudi te razlike. Hvala."
"parl.DruzPolZb","seja",33,"1992-03-05","10:10:00","13:15:00","",0,"DruzPolZb.1992-03-05.s033-02.sp-253","DruzPolZb.1992-03-05.s033-02.sp-253.1",DruzPolZb.1992-03-05.s033-02.toc-item3,"","","speaker","PREDSEDNIK DR. LUDVIK TOPLAK:"
"parl.DruzPolZb","seja",33,"1992-03-05","10:10:00","13:15:00","ToplakLudvik1942",1,"DruzPolZb.1992-03-05.s033-02.sp-253","DruzPolZb.1992-03-05.s033-02.sp-253.2",DruzPolZb.1992-03-05.s033-02.toc-item3,"taxonomy.3.9.5.3.5","topic.425","utterance","Hvala lepa."
"parl.DruzPolZb","seja",33,"1992-03-05","10:10:00","13:15:00","",0,"DruzPolZb.1992-03-05.s033-02.sp-253","DruzPolZb.1992-03-05.s033-02.sp-253.3",DruzPolZb.1992-03-05.s033-02.toc-item3,"taxonomy.3.9.5.3.5","topic.425","gap","dogovarjanje v predsedstvu zbora."
"parl.DruzPolZb","seja",33,"1992-03-05","10:10:00","13:15:00","ToplakLudvik1942",1,"DruzPolZb.1992-03-05.s033-02.sp-253","DruzPolZb.1992-03-05.s033-02.sp-253.4",DruzPolZb.1992-03-05.s033-02.toc-item3,"taxonomy.3.9.5.3.5","topic.425","utterance","Na glasovanje dajem redakcijski amandma Vlade, ki se glasi: v 38., 39., 65., 291.,295., 295.a, 296., 298., 302., 307. in 323. členu predloga zakona o pokojninskem in invalidskem zavarovanju se datum 1.1.1992 nadomesti z datumom 1.4.1992."
"parl.DruzPolZb","seja",33,"1992-03-05","10:10:00","13:15:00","ToplakLudvik1942",1,"DruzPolZb.1992-03-05.s033-02.sp-253","DruzPolZb.1992-03-05.s033-02.sp-253.5",DruzPolZb.1992-03-05.s033-02.toc-item3,"taxonomy.3.9.5.3.5","topic.425","utterance","In še drugi amandma - lahko bomo glasovali skupaj - kjer se predlaga, da se v 201., 291., 292., 293., 294., 295. ter 295.a, 296., 298., in 300. ter 310. in 312. členu predloga zakona o pokojninskem in invalidskem zavarovanju se datum 31.12.1991 nadomesti z datumom 31.3.1992. Ugotovimo navzočnost, prosim! Besedo želi gospod Potrč."
"parl.DruzPolZb","seja",33,"1992-03-05","10:10:00","13:15:00","",0,"DruzPolZb.1992-03-05.s033-02.sp-254","DruzPolZb.1992-03-05.s033-02.sp-254.1",DruzPolZb.1992-03-05.s033-02.toc-item3,"","","speaker","MIRAN POTRČ:"
"parl.DruzPolZb","seja",33,"1992-03-05","10:10:00","13:15:00","PotrcMiran1938",0,"DruzPolZb.1992-03-05.s033-02.sp-254","DruzPolZb.1992-03-05.s033-02.sp-254.2",DruzPolZb.1992-03-05.s033-02.toc-item3,"taxonomy.3.9.5.3.5","topic.425","utterance","Gospod predsednik, vem, da imate vi prav, ker moja je bila razprava, nisem predlagal amandmaja in dejansko ne morete glasovati. Moram po pravici povedati, zakaj ga nisem predlagal. Ne znam ga! Gre za zelo komplicirano materijo in jaz ne morem reči, da naj sedaj vsi ti členi veljajo od 1.1.; in če bi bila volja, potem bi bilo prav, da bi sodelovali strokovnjaki in povedali, kateri od teh členov, kateri odstavek bi eventualno veljal od 1.1. Glede na to jaz predlagam, ali je mogoče, da zbor opravi predhodno glasovanje in pove, ali bi bil za to idejo, in potem pooblasti pač tudi predlagatelja, da z jasno vsebino in skupaj z mano pripravi strokovno utemeljen predlog, da ne bo diskusija, ali je ali ne. Če bo pa zbor v tem predhodnem glasovanju rekel ne, tega ne podpiramo - tako kot zadnjič, potem bo seveda tekst ostal takšen kot je. Hvala lepa."
"parl.DruzPolZb","seja",33,"1992-03-05","10:10:00","13:15:00","",0,"DruzPolZb.1992-03-05.s033-02.sp-255","DruzPolZb.1992-03-05.s033-02.sp-255.1",DruzPolZb.1992-03-05.s033-02.toc-item3,"","","speaker","PREDSEDNIK DR. LUDVIK TOPLAK:"
"parl.DruzPolZb","seja",33,"1992-03-05","10:10:00","13:15:00","ToplakLudvik1942",1,"DruzPolZb.1992-03-05.s033-02.sp-255","DruzPolZb.1992-03-05.s033-02.sp-255.2",DruzPolZb.1992-03-05.s033-02.toc-item3,"taxonomy.3.9.5.3.5","topic.425","utterance","Hvala lepa. Takole: o tem smo glasovali in Vlada je že zavzela negativno stališče do tega predloga; zadnjič. Jaz lahko samo dam predlog Vlade na glasovanje. Drugega amandmaja po proceduri nimamo vloženega, pa tudi ni možno. Zato je ta razprava sicer proceduralna, ampak pravno (kot se reče) irelevantna."
