"orgId","type of session","number","date","notBefore","notAfter","persId","chairman","spId","nodeId","titleId","taxonomyIds","topicIds","type","text string"
"parl.DruzPolZb","seja",33,"1992-03-05","10:10:00","13:15:00","",0,"DruzPolZb.1992-03-05.s033-02.sp-305","DruzPolZb.1992-03-05.s033-02.sp-305.172",DruzPolZb.1992-03-05.s033-02.toc-item7,"","","vote","34 poslancev."
"parl.DruzPolZb","seja",33,"1992-03-05","10:10:00","13:15:00","PersakAnton1947",0,"DruzPolZb.1992-03-05.s033-02.sp-305","DruzPolZb.1992-03-05.s033-02.sp-305.173",DruzPolZb.1992-03-05.s033-02.toc-item7,"taxonomy.3.5.3","topic.215","utterance","Je kdo proti?"
"parl.DruzPolZb","seja",33,"1992-03-05","10:10:00","13:15:00","",0,"DruzPolZb.1992-03-05.s033-02.sp-305","DruzPolZb.1992-03-05.s033-02.sp-305.174",DruzPolZb.1992-03-05.s033-02.toc-item7,"","","vote","3 poslanci."
"parl.DruzPolZb","seja",33,"1992-03-05","10:10:00","13:15:00","PersakAnton1947",0,"DruzPolZb.1992-03-05.s033-02.sp-305","DruzPolZb.1992-03-05.s033-02.sp-305.175",DruzPolZb.1992-03-05.s033-02.toc-item7,"taxonomy.3.5.3","topic.215","utterance","Se je kdo vzdržal?"
"parl.DruzPolZb","seja",33,"1992-03-05","10:10:00","13:15:00","",0,"DruzPolZb.1992-03-05.s033-02.sp-305","DruzPolZb.1992-03-05.s033-02.sp-305.176",DruzPolZb.1992-03-05.s033-02.toc-item7,"","","vote","1 poslanec."
"parl.DruzPolZb","seja",33,"1992-03-05","10:10:00","13:15:00","PersakAnton1947",0,"DruzPolZb.1992-03-05.s033-02.sp-305","DruzPolZb.1992-03-05.s033-02.sp-305.177",DruzPolZb.1992-03-05.s033-02.toc-item7,"taxonomy.3.5.3","topic.215","utterance","Ugotavljam, da je ta skupina pooblaščena za vsa usklajevanja in jo že čakajo za usklajevanje v sobi 209."
"parl.DruzPolZb","seja",33,"1992-03-05","10:10:00","13:15:00","PersakAnton1947",0,"DruzPolZb.1992-03-05.s033-02.sp-305","DruzPolZb.1992-03-05.s033-02.sp-305.178",DruzPolZb.1992-03-05.s033-02.toc-item7,"taxonomy.3.5.3","topic.215","utterance","Usklajevanje zakona o obrestni meri zamudnih obresti pa bo ob 13. uri v sobi 311. Za to usklajevanje smo že včeraj imenovali komisijo, ker je bila posebna; to ni ista. Upam, da se spominjate tisti, ki ste bili imenovani v komisijo."
"parl.DruzPolZb","seja",33,"1992-03-05","10:10:00","13:15:00","",0,"DruzPolZb.1992-03-05.s033-02.sp-305","DruzPolZb.1992-03-05.s033-02.sp-305.179",DruzPolZb.1992-03-05.s033-02.toc-item7,"","","debate","Se."
"parl.DruzPolZb","seja",33,"1992-03-05","10:10:00","13:15:00","PersakAnton1947",0,"DruzPolZb.1992-03-05.s033-02.sp-305","DruzPolZb.1992-03-05.s033-02.sp-305.180",DruzPolZb.1992-03-05.s033-02.toc-item8,"taxonomy.3.9.5.1.3","topic.407","utterance","Prehajam na 8. TOČKO DNEVNEGA REDA."
"parl.DruzPolZb","seja",33,"1992-03-05","10:10:00","13:15:00","PersakAnton1947",0,"DruzPolZb.1992-03-05.s033-02.sp-305","DruzPolZb.1992-03-05.s033-02.sp-305.181",DruzPolZb.1992-03-05.s033-02.toc-item8,"taxonomy.3.9.5.1.3","topic.407","utterance","Gre za točko, s katero smo razširili dnevni red, to je PREDLOG ZA IZDAJO ZAKONA O SPREMEMBAH IN DOPOLNITVAH ZAKONA O ZAPOSLOVANJU IN ZAVAROVANJU ZA PRIMER BREZPOSELNOSTI, S PREDLOGOM ZAKONA."
"parl.DruzPolZb","seja",33,"1992-03-05","10:10:00","13:15:00","PersakAnton1947",0,"DruzPolZb.1992-03-05.s033-02.sp-305","DruzPolZb.1992-03-05.s033-02.sp-305.182",DruzPolZb.1992-03-05.s033-02.toc-item8,"taxonomy.3.9.5.1.3","topic.407","utterance","Predlog za izdajo zakona, s predlogom zakona, je predložila v obravnavo Vlada Republike Slovenije. Obravnaval ga je Odbor za delo, zaposlovanje in socialno politiko, kot matično delovno telo, ki v celoti podpira predlagano spremembo zakona, kot jo predlaga Vlada Republike Slovenije. Obravnavala ga je tudi Zakonodajno-pravna komisija."
"parl.DruzPolZb","seja",33,"1992-03-05","10:10:00","13:15:00","PersakAnton1947",0,"DruzPolZb.1992-03-05.s033-02.sp-305","DruzPolZb.1992-03-05.s033-02.sp-305.183",DruzPolZb.1992-03-05.s033-02.toc-item8,"taxonomy.3.9.5.1.3","topic.407","utterance","Poslanci ste k tej točki s pošiljko 26.2.1992 prejeli: poročilo Odbora za delo, zaposlovanje in socialno politiko z dne 11.2.1992; dodatno poročilo Odbora za delo, zaposlovanje in socialno politiko z dne 25.2.1992 in poročilo Zakonodajno-pravne komisije. Na klop smo prejeli gradivo ""Opredelitve Vlade Republike Slovenije do ugotovitev in predlogov ob obravnavi analize štipendijske politike v Republiki Sloveniji""."
"parl.DruzPolZb","seja",33,"1992-03-05","10:10:00","13:15:00","PersakAnton1947",0,"DruzPolZb.1992-03-05.s033-02.sp-305","DruzPolZb.1992-03-05.s033-02.sp-305.184",DruzPolZb.1992-03-05.s033-02.toc-item8,"taxonomy.3.9.5.1.3","topic.407","utterance","K predlogu za izdajo zakona o spremembah in dopolnitvah zakona o zaposlovanju in zavarovanju za primer brezposelnosti, s predlogom zakona, so vloženi naslednji amandmaji: poslanskega kluba SDP, ki jih je v našem zboru vložil gospod Miran Potrč, k 56. in 57. členu in amandma za nov, 59.a člen in amandma za nov 48.a člen v IV. poglavju. Včeraj je vložila dva amandmaja v našem zboru tudi gospa Maria Pozsonec. O teh amandmajih ni treba, kot smo to doslej delali, posebej sklepati, ali jih bomo upoštevali ali ne, ker smo šele včeraj to točko uvrstili na dnevni red kot razširitev in seveda ni bilo mogoče v zahtevanem roku predložiti amandmajev."
"parl.DruzPolZb","seja",33,"1992-03-05","10:10:00","13:15:00","PersakAnton1947",0,"DruzPolZb.1992-03-05.s033-02.sp-305","DruzPolZb.1992-03-05.s033-02.sp-305.185",DruzPolZb.1992-03-05.s033-02.toc-item8,"taxonomy.3.9.5.1.3","topic.407","utterance","Želi besedo predstavnik Vlade Republike Slovenije? Prosim, gospa Belopavlovič, namestnica ministrice za delo."
"parl.DruzPolZb","seja",33,"1992-03-05","10:10:00","13:15:00","",0,"DruzPolZb.1992-03-05.s033-02.sp-306","DruzPolZb.1992-03-05.s033-02.sp-306.1",DruzPolZb.1992-03-05.s033-02.toc-item8,"","","speaker","NATAŠA BELOPAVLOVIČ:"
"parl.DruzPolZb","seja",33,"1992-03-05","10:10:00","13:15:00","BelopavlovicNatasa1949",0,"DruzPolZb.1992-03-05.s033-02.sp-306","DruzPolZb.1992-03-05.s033-02.sp-306.2",DruzPolZb.1992-03-05.s033-02.toc-item8,"taxonomy.3.9.5.1.3","topic.407","utterance","Hvala. O zakonu bom zelo kratka, ker je tudi predlog zakona zelo kratek, rada pa bi potem povedala nekaj besed na amandmaje."
"parl.DruzPolZb","seja",33,"1992-03-05","10:10:00","13:15:00","BelopavlovicNatasa1949",0,"DruzPolZb.1992-03-05.s033-02.sp-306","DruzPolZb.1992-03-05.s033-02.sp-306.3",DruzPolZb.1992-03-05.s033-02.toc-item8,"taxonomy.3.9.5.1.3","topic.407","utterance","Zakon je v osnovi predlagan zato, da bi se umilil ta vstopni cenzus za pridobitev republiške štipendije, in sicer za tiste študente in dijake, ki se šolajo zunaj kraja stalnega bivališča. Mi ugotavljamo, da je te populacije veliko: med dijaki približno 12% vseh šolajočih, med študenti pa kar 50%. Razlika, ki jo predlagamo za vstopni cenzus, je taka, da bi ostali tisti, ki se šolajo v kraju bivališča, na 80-tih procentih zajamčenega osebnega dohodka na družinskega člana. Skratka, to je tisti vstop, ko nekdo lahko že pridobi štipendijo. Tisti, ki se šolajo zunaj kraja stalnega bivališča, bi bil pa njihov vstopni cenzus 110%. Do te rešitve oziroma do tega predloga smo prišli praktično na podlagi celovite analize, ki jo je ta skupščina tudi obravnavala, o štipendijski politiki in smo ugotovili kar precej hude številke oziroma velike posledice, ki jih je sprememba zakonodaje v lanskem letu prinesla na to področje. Mi smo morali lani od vseh novo prijavljenih prosilcev štipendij odbiti kar čez 14.000 in od tistih, že bivših štipendistov jih je praktično 4.800 in nekaj čez izgubilo štipendije. Ta procent je bil zelo velik in ob pregledu finančnih možnosti na eni strani in že obstoječih prosilcev smo ugotovili, da bi te posledice s takim predlogom, ki je danes pred vami, lahko omilili."
"parl.DruzPolZb","seja",33,"1992-03-05","10:10:00","13:15:00","BelopavlovicNatasa1949",0,"DruzPolZb.1992-03-05.s033-02.sp-306","DruzPolZb.1992-03-05.s033-02.sp-306.4",DruzPolZb.1992-03-05.s033-02.toc-item8,"taxonomy.3.9.5.1.3","topic.407","utterance","Amandmaji, ki so bili vloženi, če se povrnem k amandmajem gospoda Potrča, tam je predlagano, naj bi bil vstopni cenzus ne 80% zajamčenega osebnega dohodka, ampak 80% povprečnega osebnega dohodka. Povedati moram, da je v prejšnjem obdobju po stari zakonodaji, po starih predpisih, znašal ta vstopni cenzus 55% povprečnega osebnega dohodka, pa je bil še vedno precej velik oziroma sredstev za to ni bilo dovolj."
"parl.DruzPolZb","seja",33,"1992-03-05","10:10:00","13:15:00","BelopavlovicNatasa1949",0,"DruzPolZb.1992-03-05.s033-02.sp-306","DruzPolZb.1992-03-05.s033-02.sp-306.5",DruzPolZb.1992-03-05.s033-02.toc-item8,"taxonomy.3.9.5.1.3","topic.407","utterance","Če gledamo naš predlog in predlog gospoda Potrča, je razlika velika. Ta, ki po našem predlogu lahko pridobi štipendijo mora na družinskega člana dosegati 9.920 SLT. Če bi šli na predlog gospoda Potrča bi pomenilo, da lahko to dobi vsak, ki presega 20.400 SLT. Skratka, razlika je taka, da dobimo zelo veliko število populacije v ta fond štipendij. Mi si tega ne moremo privoščiti. Če bi še tako želeli, bi to pomenilo razširjanje, več kot 50% celotne populacije študentov bi prišlo v nov cenzus. Zato temu amandmaju nasprotujemo."
"parl.DruzPolZb","seja",33,"1992-03-05","10:10:00","13:15:00","BelopavlovicNatasa1949",0,"DruzPolZb.1992-03-05.s033-02.sp-306","DruzPolZb.1992-03-05.s033-02.sp-306.6",DruzPolZb.1992-03-05.s033-02.toc-item8,"taxonomy.3.9.5.1.3","topic.407","utterance","Naslednji amandma je za popravo 57. člena. Gre za to, da naj bi se štipendija, v odvisnosti od dohodkov družine, zagotavljala učencu ali študentu v višini, ki zagotavlja najmanj uresničevanje vseh potreb na podlagi košarice življenjskih potrebščin in sredstva za potrebno literaturo. Tudi ta stvar ni takšna, da bi jo kazalo podpreti, in sicer iz dveh razlogov. Gre za večji obseg sredstev, drugič pa tudi za nekaj nejasnosti. Košarica življenjskih potrebščin, ki jo mi uporabljamo kot pojem, ko izračunavamo zajamčeni osebni dohodek, pomeni popolnoma drug izračun. Gre za košarico za tričlansko družino, za določeno vrsto dobrin in po teh koeficientih, ko se preračuna, je ta košarica sedaj 16.000 neto."
"parl.DruzPolZb","seja",33,"1992-03-05","10:10:00","13:15:00","BelopavlovicNatasa1949",0,"DruzPolZb.1992-03-05.s033-02.sp-306","DruzPolZb.1992-03-05.s033-02.sp-306.7",DruzPolZb.1992-03-05.s033-02.toc-item8,"taxonomy.3.9.5.1.3","topic.407","utterance","Mi vemo, da z zajamčenim osebnim dohodkom, žal, te košarice ne pokrijemo. Zajamčeni veste da je bruto 12.600. To pomeni, da bi bile take štipendije bistveno višje. Če bi šli na to pokrivanje bi ti študentje dobili bistveno več štipendije kot pa dobivajo delavci zajamčeni osebni dohodek oziroma kot dobivajo nadomestila tisti, ki so na zajamčenem nadomestilu."
"parl.DruzPolZb","seja",33,"1992-03-05","10:10:00","13:15:00","BelopavlovicNatasa1949",0,"DruzPolZb.1992-03-05.s033-02.sp-306","DruzPolZb.1992-03-05.s033-02.sp-306.8",DruzPolZb.1992-03-05.s033-02.toc-item8,"taxonomy.3.9.5.1.3","topic.407","utterance","Poleg tega je možno vzeti tudi drugo metodologijo. Mi imamo še eno metodologijo. Tisti, ki ste se s tem kaj več ukvarjali, tako imenovana ""šumijeva metodologija"", ki predvideva košarico za različne tipe potrošnikov. Tudi tam lahko najdemo tip potrošnika-študent, ampak ta metodologija je bila narejena v časih, ki so bili bistveno boljši kot so današnji časi in če pogledamo to, kar bi po tej košarici pokazal izračun, pomeni, da bi to bilo 20.000 SLT na tega študenta, kar pa še nekoliko presega tisto prvo, o kateri sem govorila."
"parl.DruzPolZb","seja",33,"1992-03-05","10:10:00","13:15:00","BelopavlovicNatasa1949",0,"DruzPolZb.1992-03-05.s033-02.sp-306","DruzPolZb.1992-03-05.s033-02.sp-306.9",DruzPolZb.1992-03-05.s033-02.toc-item8,"taxonomy.3.9.5.1.3","topic.407","utterance","So čisto finančni razlogi, hkrati pa tudi razlogi, da moramo delati primerjavo, ne samo kaj si lahko privoščimo, ampak tudi, kaj lahko zagotavljamo, da ne delamo teh velikih socialnih razlik med tistimi, ki delajo, med tistimi, ki so brezposelni, med tistimi, ki so na porodniškem dopustu in med tistimi, ki študirajo. Skratka, gre za primerjave, ki se morajo nekako ujeti na nekem nivoju."
"parl.DruzPolZb","seja",33,"1992-03-05","10:10:00","13:15:00","BelopavlovicNatasa1949",0,"DruzPolZb.1992-03-05.s033-02.sp-306","DruzPolZb.1992-03-05.s033-02.sp-306.10",DruzPolZb.1992-03-05.s033-02.toc-item8,"taxonomy.3.9.5.1.3","topic.407","utterance","Potem je bil predložen še en amandma, tudi gospoda Potrča, ki se nanaša na nov 40.a člen in gre na to, da naj bi tisti, ki zaposlijo osebo, pripravnika morali povrniti stroške za osebne dohodke tega pripravnika, in sicer, da bi moral zavod to narediti oziroma v kolikor se pripravnik po tem opravljenem izpitu zaposli pri eni ali drugi organizaciji, bi morala ta organizacija kot nov delodajalec povrniti sredstva, ki jih je izplačal zavod v času pripravniške dobe."
"parl.DruzPolZb","seja",33,"1992-03-05","10:10:00","13:15:00","BelopavlovicNatasa1949",0,"DruzPolZb.1992-03-05.s033-02.sp-306","DruzPolZb.1992-03-05.s033-02.sp-306.11",DruzPolZb.1992-03-05.s033-02.toc-item8,"taxonomy.3.9.5.1.3","topic.407","utterance","Temu amandmaju prav tako nasprotujemo iz dveh razlogov. Prvič presega okvir predloženih sprememb, ampak dejstvo je, to je pa bistveno, da je možnost zagotavljanja nadomestila pripravniške plače ali vsaj dela pripravniške plače že eden od obstoječih ukrepov aktivne politike zaposlovanja in je ta možnost že sedaj dana v zakonu o zaposlovanju. Skratka, že sedaj se lahko del pripravniških plač financira preko tega ukrepa s strani zavoda."
"parl.DruzPolZb","seja",33,"1992-03-05","10:10:00","13:15:00","BelopavlovicNatasa1949",0,"DruzPolZb.1992-03-05.s033-02.sp-306","DruzPolZb.1992-03-05.s033-02.sp-306.12",DruzPolZb.1992-03-05.s033-02.toc-item8,"taxonomy.3.9.5.1.3","topic.407","utterance","Drugo, kar je, da mi zavežemo novega delodajalca, da to plača, bi pa lahko pomenilo prej obratno. To bi bil lahko bumerang pri zaposlovanju mladih ljudi oziroma teh, ki so končali pripravništvo, kar bi lahko pomenilo, da bi se delodajalci izogibali zaposlovanju teh, ker bodo hkrati imeli obveznost vračila pripravniške plače."
"parl.DruzPolZb","seja",33,"1992-03-05","10:10:00","13:15:00","BelopavlovicNatasa1949",0,"DruzPolZb.1992-03-05.s033-02.sp-306","DruzPolZb.1992-03-05.s033-02.sp-306.13",DruzPolZb.1992-03-05.s033-02.toc-item8,"taxonomy.3.9.5.1.3","topic.407","utterance","Če dovolite, samo še ta amandma, ki ga je vložila gospa Pozsonec. Gre za dva amandmaja, ki se nanašata na učence in študente, ki prihajajo iz demografsko ogroženih območij. Prvi je v tem smislu, da bi bil njihov vstopni cenzus drugačen, ne 110 ampak 120% zajamčenega dohodka. Mislim, da je prav da so študentje izenačeni glede na socialno stanje v družini, ne glede od kod prihajajo, ali prihajajo iz bolj ali manj ogroženega območja. Mislim, da se nam več problemov pojavlja v območjih, ki niso dejansko ogrožena. Mi imamo cele regije, kjer se zaposlenost zmanjšuje, kjer starši ostajajo doma, ostajajo brez dela, so pa lahko v razvitih področjih. To je celo področje Maribora, na primer. To bi pomenilo, da ima tisti, ki z manjšim cenzusom sicer prihaja iz Maribora, slabše pogoje kot tisti, ki bi prihajal iz Lenarta ali iz občine, ki je iz bolj ogroženega območja. Gre za diferenciacijo, ki ni smiselna po našem mnenju."
"parl.DruzPolZb","seja",33,"1992-03-05","10:10:00","13:15:00","BelopavlovicNatasa1949",0,"DruzPolZb.1992-03-05.s033-02.sp-306","DruzPolZb.1992-03-05.s033-02.sp-306.14",DruzPolZb.1992-03-05.s033-02.toc-item8,"taxonomy.3.9.5.1.3","topic.407","utterance","In drug amandma je, da naj bi bila višina te osnovne štipendije za študente, ki se šolajo na tehničnih in ekonomskih fakultetah zunaj kraja stalnega bivališča, imajo pa stalno bivališče na demografsko ogroženem območju, večja za 50%. Tudi tu se zadeva nanaša na demografsko ogrožena območja in tu bi pomenilo to diskriminacijo ali diferenciacijo študentov po dveh kanalih. Prvo, glede na to iz katerega kraja, katerega območja prihajajo, kar verjetno nima smisla. In drugič še glede na to, na katero fakulteto se vpišejo, kaj študirajo."
"parl.DruzPolZb","seja",33,"1992-03-05","10:10:00","13:15:00","BelopavlovicNatasa1949",0,"DruzPolZb.1992-03-05.s033-02.sp-306","DruzPolZb.1992-03-05.s033-02.sp-306.15",DruzPolZb.1992-03-05.s033-02.toc-item8,"taxonomy.3.9.5.1.3","topic.407","utterance","Mi republiških štipendij, ki imajo v osnovi socialni karakter, nismo nikoli dodeljevali glede na to kaj kdo študira. Preko zavoda se skuša usmerjati študente in učence v deficitarne poklice, kjer jih bomo rabili. Pove se jim tudi, kakšne bodo bodoče možnosti njihovega zaposlovanja. Ampak kriterij potem, ko nekdo že izpolnjuje socialni vstopni cenzus pa ni bil nikoli ta, ali mu bomo dali štipendijo ali ne, odvisen od tega kaj bo študiral."
"parl.DruzPolZb","seja",33,"1992-03-05","10:10:00","13:15:00","BelopavlovicNatasa1949",0,"DruzPolZb.1992-03-05.s033-02.sp-306","DruzPolZb.1992-03-05.s033-02.sp-306.16",DruzPolZb.1992-03-05.s033-02.toc-item8,"taxonomy.3.9.5.1.3","topic.407","utterance","In še nekaj moram poudariti, da te, ki prihajajo iz demografsko ogroženih območij, že sedaj po našem pravilniku, kolikor imajo enake pogoje kot drugi, potem imajo prednost pred drugimi. Skratka, če gre za dva študenta, ki bi vstopni cenzus izpolnjevala, pa štipendij za vse ne bi bilo dovolj, potem bi imel tisti, ki prihaja iz demografsko ogroženega območja ob enakih pogojih prednost pred tistim, ki prihaja iz enega drugega okolja."
"parl.DruzPolZb","seja",33,"1992-03-05","10:10:00","13:15:00","BelopavlovicNatasa1949",0,"DruzPolZb.1992-03-05.s033-02.sp-306","DruzPolZb.1992-03-05.s033-02.sp-306.17",DruzPolZb.1992-03-05.s033-02.toc-item8,"taxonomy.3.9.5.1.3","topic.407","utterance","Oproščam se, da sem bila malo daljša, ampak rada bi povedala, zakaj v bistvu ne podpiramo nobenega amandmaja od teh."
"parl.DruzPolZb","seja",33,"1992-03-05","10:10:00","13:15:00","",0,"DruzPolZb.1992-03-05.s033-02.sp-307","DruzPolZb.1992-03-05.s033-02.sp-307.1",DruzPolZb.1992-03-05.s033-02.toc-item8,"","","speaker","PODPREDSEDNIK ANTON PERŠAK:"
"parl.DruzPolZb","seja",33,"1992-03-05","10:10:00","13:15:00","PersakAnton1947",0,"DruzPolZb.1992-03-05.s033-02.sp-307","DruzPolZb.1992-03-05.s033-02.sp-307.2",DruzPolZb.1992-03-05.s033-02.toc-item8,"taxonomy.3.9.5.1.3","topic.407","utterance","Hvala. Želijo besedo poročevalci delovnih teles? Če ne želijo, odpiram razpravo. Prosim, gospod Potrč."
"parl.DruzPolZb","seja",33,"1992-03-05","10:10:00","13:15:00","",0,"DruzPolZb.1992-03-05.s033-02.sp-308","DruzPolZb.1992-03-05.s033-02.sp-308.1",DruzPolZb.1992-03-05.s033-02.toc-item8,"","","speaker","MIRAN POTRČ:"
"parl.DruzPolZb","seja",33,"1992-03-05","10:10:00","13:15:00","PotrcMiran1938",0,"DruzPolZb.1992-03-05.s033-02.sp-308","DruzPolZb.1992-03-05.s033-02.sp-308.2",DruzPolZb.1992-03-05.s033-02.toc-item8,"taxonomy.3.9.5.1.3","topic.407","utterance","Spoštovani! Najbrž ni potrebno temu zboru razlagati, kaj pomeni znanje za naš razvoj. Najbrž vsi vemo, da je izobrazbena struktura v Republiki Sloveniji relativno nizka. Zadnje ankete kažejo, da tudi nivo znanja na nekaterih pomembnih področjih in pri nekaterih pomembnih predmetih ni zavidljivo visok. Najbrž se zavedamo, da je materialni položaj staršev, ki je gotovo vsak dan bistveno nižji, eden od pomembnih pogojev za to, da bi mladi ljudje lahko pridobivali potrebno izobrazbo in znanje. Da ne govorim o tem, da je motivacija za pridobivanje znanja ob takšnih možnostih za zaposlovanje, ki jih sedaj za novo generacijo praktično ni, že sama po sebi omejena."
"parl.DruzPolZb","seja",33,"1992-03-05","10:10:00","13:15:00","PotrcMiran1938",0,"DruzPolZb.1992-03-05.s033-02.sp-308","DruzPolZb.1992-03-05.s033-02.sp-308.3",DruzPolZb.1992-03-05.s033-02.toc-item8,"taxonomy.3.9.5.1.3","topic.407","utterance","Kljub vsem tem dejstvom in opozorilom, kaj se bo zgodilo, smo z lanskoletno zakonodajo grobo posegli v možnosti za študij tudi preko štipendijske politike. Pohvalno je, da smo ta problem vsaj relativno kmalu opazili, čeprav je treba reči, da je bil opažen predvsem na podlagi zahtev samih študentov in manj na podlagi neposredne aktivnosti v Vladi in v ustreznem ministrstvu."
"parl.DruzPolZb","seja",33,"1992-03-05","10:10:00","13:15:00","PotrcMiran1938",0,"DruzPolZb.1992-03-05.s033-02.sp-308","DruzPolZb.1992-03-05.s033-02.sp-308.4",DruzPolZb.1992-03-05.s033-02.toc-item8,"taxonomy.3.9.5.1.3","topic.407","utterance","Zato v osnovi podpiram predloge, ki so bili dani. Sam sem sodil, tudi na podlagi razgovorov, ki smo jih jaz in predstavniki večine poslanskih klubov imeli s študenti, da so ti predlogi nezadostni in da ne bodo mogli rešiti vse problematika, tako kot nam je bila prikazana. Poznam pa stališča Odbora za delo, zaposlovanje in socialno politiko in tudi mnenje študentov, ki so pač glede na oblast, ki v Vladi je in glede na obljube ali opozorila, ki jih lahko daje, pristali na to, da je boljše vrabec v roki kot golob na strehi, ker jim je bilo rečeno, če pač ne boste sprejeli tega popravka, potem v letošnjem letu ne bo nič, ker bodo vsi drugi popravki trajali dolgo časa. To oblast lahko naredi in v tem primeru je to tudi storila."
"parl.DruzPolZb","seja",33,"1992-03-05","10:10:00","13:15:00","PotrcMiran1938",0,"DruzPolZb.1992-03-05.s033-02.sp-308","DruzPolZb.1992-03-05.s033-02.sp-308.5",DruzPolZb.1992-03-05.s033-02.toc-item8,"taxonomy.3.9.5.1.3","topic.407","utterance","Mislim, da je to kljub temu bolje kot nič ali pa vsaj za del reševanja problemov boljše kot nič. Bilo bi mi žal in sodim, da enako mislite predstavniki vseh poslanskih klubov, saj smo skupno podpisali in sopodpisali zahtevo, ki so jo dale študentske organizacije za reševanje njihovih problemov, da bi se na tej točki za nekaj časa problematika ustavila."
"parl.DruzPolZb","seja",33,"1992-03-05","10:10:00","13:15:00","PotrcMiran1938",0,"DruzPolZb.1992-03-05.s033-02.sp-308","DruzPolZb.1992-03-05.s033-02.sp-308.6",DruzPolZb.1992-03-05.s033-02.toc-item8,"taxonomy.3.9.5.1.3","topic.407","utterance","Zato predlagam in izjavljam, da sem ob vsej tej situaciji pripravljen vse te amandmaje, ki sem jih dal, umakniti. Prosil bi pa, da zbori sprejmejo nek sklep, v katerem bi zadolžili Vlado in ustrezna delovna telesa, da takoj nadaljuje delo za reševanje študentske problematike, da takoj celovito preuči pobude študentskih organizacij, ki smo jo skupaj podpisali predstavniki v parlamentu zastopanih poslanskih klubov in poskuša poiskati rešitve za celovito reševanje ta problematike."
"parl.DruzPolZb","seja",33,"1992-03-05","10:10:00","13:15:00","PotrcMiran1938",0,"DruzPolZb.1992-03-05.s033-02.sp-308","DruzPolZb.1992-03-05.s033-02.sp-308.7",DruzPolZb.1992-03-05.s033-02.toc-item8,"taxonomy.3.9.5.1.3","topic.407","utterance","Prosil bi, da se o takšnem sklepu glasuje. Gospod predsedujoči, verjamem da bo sprejet in v tem primeru sem pripravljen umakniti vse predložene amandmaje, zato jih tukaj tudi ne bi širše razlagal, zakaj sem jih vložil. Hvala lepa."
"parl.DruzPolZb","seja",33,"1992-03-05","10:10:00","13:15:00","",0,"DruzPolZb.1992-03-05.s033-02.sp-309","DruzPolZb.1992-03-05.s033-02.sp-309.1",DruzPolZb.1992-03-05.s033-02.toc-item8,"","","speaker","PODPREDSEDNIK ANTON PERŠAK:"
"parl.DruzPolZb","seja",33,"1992-03-05","10:10:00","13:15:00","PersakAnton1947",0,"DruzPolZb.1992-03-05.s033-02.sp-309","DruzPolZb.1992-03-05.s033-02.sp-309.2",DruzPolZb.1992-03-05.s033-02.toc-item8,"taxonomy.3.9.5.1.3","topic.407","utterance","Hvala. Bi lahko prosil za predlog sklepa, da ne bi reproduciral po spominu. Želi še kdo razpravljati? Gospod Pučnik."
"parl.DruzPolZb","seja",33,"1992-03-05","10:10:00","13:15:00","",0,"DruzPolZb.1992-03-05.s033-02.sp-310","DruzPolZb.1992-03-05.s033-02.sp-310.1",DruzPolZb.1992-03-05.s033-02.toc-item8,"","","speaker","IVAN PUČNIK:"
"parl.DruzPolZb","seja",33,"1992-03-05","10:10:00","13:15:00","PucnikIvan1927",0,"DruzPolZb.1992-03-05.s033-02.sp-310","DruzPolZb.1992-03-05.s033-02.sp-310.2",DruzPolZb.1992-03-05.s033-02.toc-item8,"taxonomy.3.9.5.1.3","topic.407","utterance","Spoštovani! Moram oporekati predstavnici Vlade, ker poskuša izenačevati, češ da ni pomembno, kje bivajo tisti, ki naj bi se poklicno in tudi naprej šolali. To je zelo pomembno. Pri tako nizkih splošnih dohodkih in tudi cenzusih, ki so tu postavljeni, je zelo pomembno, ali mora družina za enega otroka odriniti 2 do 5.000 tolarjev samo za prevoz ali ji to ni potrebno, ker ima šolo bližje, do katere lahko pride peš ali s kolesom."
"parl.DruzPolZb","seja",33,"1992-03-05","10:10:00","13:15:00","PucnikIvan1927",0,"DruzPolZb.1992-03-05.s033-02.sp-310","DruzPolZb.1992-03-05.s033-02.sp-310.3",DruzPolZb.1992-03-05.s033-02.toc-item8,"taxonomy.3.9.5.1.3","topic.407","utterance","Namreč, takšno stališče Vlade povzroča nadaljnje poglabljanje razlik med tako imenovanimi razvitimi in nerazvitimi območji. In je nemogoče, da glede na raznolikost v Sloveniji, Vlada ne bi temu vprašanju prisluhnila. Mi se sedaj že mesece pogovarjamo o tem, zakaj nekateri otroci za poklicno šolanje ostajajo doma, ker preprosto nimajo sredstev za prevoz."
