"orgId","type of session","number","date","notBefore","notAfter","persId","chairman","spId","uId","titleId","taxonomyIds","topicIds","lemmata"
"parl.Skup","slavnostna seja",1,"1990-12-26","18:00:00","","BucarFrance1923",1,"VsiZbor.1990-12-26.sl001-01.sp-2","VsiZbor.1990-12-26.sl001-01.sp-2.2",VsiZbor.1990-12-26.sl001-01.toc-item1,"taxonomy.3.1","topic.55","spoštovan poslanka spoštovan poslanec cenjen gost začenjati skupen seja ves zbor skupščina republika Slovenija ki biti on sklicati v sklad z določba 10. člen zakon o plebiscit o samostojnost in neodvisnost republika Slovenija poleg poslanec ves zbor biti na seja navzoč tudi gost ki on ob ta prilika prisrčno pozdravljati posebej pozdravljati g. Milan Kučan predsednik predsedstvo republika Slovenija skupaj z član predsedstvo republika Slovenija gospoda dr. Janez Drnovšek član predsedstvo SFRJ iz republika Slovenija naj veljati v naprej tudi moj pozdrav tudi gospod Lojze Peterle predsednik izvršen svet ki biti zaenkrat še zadržan še biti moči iz Beograd ker nekoliko zamujati letalo torej pozdravljati ves skupaj z podpredsednik in član izvršen svet skupščina republika Slovenija dr. Alojzij Šuštar nadškof in metropolit ljubljanski v poseben veselje jaz biti da se biti ta naš seja udeležiti lahko tudi nekaj član slovenski narodno-osvobodilen svet Matija Maležič Jože Penca Bogdan Osolnik Mara Ropena-Osolnik ki on lepo pozdravljati v poseben čast jaz biti da lahko pozdraviti tudi delegacija sabor republika Hrvatska ki on voditi dr. Žarko Domljan predsednik sabor nadalje pozdravljati predstavnik parlamentaren političen stranka oz. zveza predstavnik pravosoden ustanova republika predstavnik SAZU univerza v Ljubljana in univerza v Maribor član zvezen izvršen svet in drug funkcionar v zvezen organ iz republika Slovenija g. Gabor Boghio generalen konzul republika Madžarska in predstavnik slovenski organizacija iz Avstrija in Italija na današnji seja biti povabiti tudi predsednik republika Hrvatska dr. Franja tu mana ki pa se povabilo biti moči odzvati pač pa se biti predsednik predsedstvo republika Slovenija Milan Kučan odzvati in poslati pozdraven pismo naslednji vsebina z zadovoljstvo biti prejeti vaš vabilo za seja ves zbor skupščina republika Slovenija z obžalovanje ti morati obvestiti da kljub velik želja zaradi prej načrtovan in neodložljiv obveznost ne moči prisostvovati slavnosten seja sklican za 26. december 1990. ob ta priložnost iskreno čestitati prebivalec Slovenija in ti osebno za rezultat plebiscit o samostojnost Slovenija velik udeležba prebivalec in rezultat plebiscit kazati visok političen zavest in odgovornost Slovenc ki biti z ta dejanje jasno pokazati da želeti o svoj bodočnost in sožitje narod na jugoslovanski prostor odločati kot prebivalec suveren in svoboden republika Slovenija"
"parl.Skup","slavnostna seja",1,"1990-12-26","18:00:00","","BucarFrance1923",1,"VsiZbor.1990-12-26.sl001-01.sp-2","VsiZbor.1990-12-26.sl001-01.sp-2.3",VsiZbor.1990-12-26.sl001-01.toc-item1,"taxonomy.3.1","topic.55","visok zbor spoštovan gost zakon o plebiscit o samostojnost in neodvisnost republika Slovenija določati da biti odločitev da republika Slovenija postati samostojen in neodvisen država sprejet če se biti zame izreči večina ves glasovalen upravičenec na temelj poročilo republiški volilen komisija ki biti ves poslanec pisno predložen ugotavljati da biti za samostojnost in neodvisnost republika Slovenija glasovati 88,5 ves glasovalen upravičenec z ta biti izpolnjen pogoj ki on postavljati 3. člen ta zakon ta glasovalen izid jaz omogočati da na temelj 10. člen ta zakon slovesno razglasiti pred ta visok zbor slovensko in jugoslovanski ter ves svetovan javnost da se biti slovenski narod na temelj trajna in neodtujljiv pravica do samoodločba odločiti da republika Slovenija postati samostojen in neodvisen država"
"parl.Skup","slavnostna seja",1,"1990-12-26","18:00:00","","BucarFrance1923",1,"VsiZbor.1990-12-26.sl001-01.sp-2","VsiZbor.1990-12-26.sl001-01.sp-2.6",VsiZbor.1990-12-26.sl001-01.toc-item1,"taxonomy.3.1","topic.55","visok zbor spoštovan gost"
"parl.Skup","slavnostna seja",1,"1990-12-26","18:00:00","","BucarFrance1923",1,"VsiZbor.1990-12-26.sl001-01.sp-2","VsiZbor.1990-12-26.sl001-01.sp-2.7",VsiZbor.1990-12-26.sl001-01.toc-item1,"taxonomy.3.1","topic.55","slovenski narod se biti z prepričljiv večina skoraj soglasno izreči za samostojen država ta biti dejanje njegov volja za kateri biti nihče odgovoren razen sam se in sam seveda prevzemati tudi ves posledica ta svoj odločitev ta biti akt ki biti nasledek njegov pojmovanje in razumevanje svoj položaj v dan družben okolje in zgodovinski trenutek biti akt ki on lahko sprejeti samo zrel narod ki se v polnost zavedati svoj lasten individualnost ki imeti odločen volja do življenje v zavest svoj življenjski zmogljivost narod ki biti sposoben in pripravljen soočiti se z izziv čas in okolje v kateri živeti ta sposobnost biti jaz v preteklost nemalokrat zanikati tudi v ime nekateri velik narod z kateri biti živeti v sosedstvo dokazovati biti jaz da biti zgodovinski narod da torej imeti ne možnost ne pravica do samostojen naroden življenje do samostojen država ta zanikovanje biti nekateri celo poskušati kvaz znanstveno utemeljevati in biti z prezir kazati na jaz češ da biti nesposoben živeti enakovredno v vrsta z drug civilizacijsko in gospodarsko razvit narod"
"parl.Skup","slavnostna seja",1,"1990-12-26","18:00:00","","BucarFrance1923",1,"VsiZbor.1990-12-26.sl001-01.sp-2","VsiZbor.1990-12-26.sl001-01.sp-2.8",VsiZbor.1990-12-26.sl001-01.toc-item1,"taxonomy.3.1","topic.55","res biti kot ljudstvo z svoj značilnost zgodovinsko preživeti od naselitev prek ves srednji vek do nov doba kar dokazovati naš življenjski moč vendar biti biti ta le preživetje ne pa zavesten življenje nacija ta biti se oblikovati šele po znanstven revolucija v 17. in naslednji stoletje ob ideologija nacionalen država"
"parl.Skup","slavnostna seja",1,"1990-12-26","18:00:00","","BucarFrance1923",1,"VsiZbor.1990-12-26.sl001-01.sp-2","VsiZbor.1990-12-26.sl001-01.sp-2.9",VsiZbor.1990-12-26.sl001-01.toc-item1,"taxonomy.3.1","topic.55","v avstrijski cesarstvo v okvir kateri biti biti kot ljudstvo vključen se biti ta proces začeti šele z konec 18. in doseči vrhunec v sredina pretekel stoletje vendar biti biti za jaz ta čas ki jaz z svoj tok družben odnos in vse obvladujoč pogled na svet biti biti naklonjen oziroma se biti obračati neposredno proti naš naroden stremljenje priti biti sicer do vznik naroden samozavest in kulturen vzpon dosti več od ta pa ne odnos med narod in država biti se namreč oblikovati na temelj kvantitativen pojmovanje svet na pozitivističen filozofija izkustven kar biti dajati velik količina nujno tudi vrednosten predznak visok kakovost na tak pojmovanje ne temeljiti samo kvantitativen demokracija ki biti prevladujoč oblika urejanje odnos v družba vse do današnji dan na tak pojmovanje biti utemeljen zlasti odnos med narod in država ne samo da se on zaradi velik teža morati podrejati manjšina velik imeti pravica do dominacija večina dobivati tudi vrednosten opravičilo in utemeljitev zanikanje možnost mali narod da biti izoblikovati svoj lasten država in se vzpostaviti kot nacija biti v tak okoliščina prerasti tako rekoč v moralen opravičilo nacionalizem kot izraz napadalnost nasproti drug zlasti majhen narod biti pripeljati ne samo do stalen vojna celo do dva svetoven pač pa biti dobiti celo visok etičen predznak kot sacro egoismo della patria v tak razmera oblikovanje nacionalen država se pojaviti tudi nesmiseln pojem in stvarnost naroden manjšina predvsem pa izginjati cel vrsta mali narod med on dosti tudi tak ki biti biti velik kot slovenski srečen naključje za Slovenc kot narod biti biti pač le v ta da biti tudi Avstrija kot nosilec in hkrati tudi sam plen germanizacija ostati v ta pogled zgodovinski zamudnik in biti prej razpasti kot pa biti moči izvesti ponemčenje svoj podložen narod"
"parl.Skup","slavnostna seja",1,"1990-12-26","18:00:00","","BucarFrance1923",1,"VsiZbor.1990-12-26.sl001-01.sp-2","VsiZbor.1990-12-26.sl001-01.sp-2.10",VsiZbor.1990-12-26.sl001-01.toc-item1,"taxonomy.3.1","topic.55","da tak okolnost biti biti posebej naklonjen slovenski narod biti več kot razumljiv"
"parl.Skup","slavnostna seja",1,"1990-12-26","18:00:00","","BucarFrance1923",1,"VsiZbor.1990-12-26.sl001-01.sp-2","VsiZbor.1990-12-26.sl001-01.sp-2.12",VsiZbor.1990-12-26.sl001-01.toc-item1,"taxonomy.3.1","topic.55","po 4. člen zakon o plebiscit o samostojnost in neodvisnost republika Slovenija na plebiscit sprejet odločitev da republika Slovenija postati samostojen in neodvisen država zavezovati skupščina republika Slovenija da sprejeti v 6 mesec od dan razglasitev odločitev ustaven in drug akt ter ukrep ki biti potrebiti da republika Slovenija prevzeti izvrševanje suveren pravica ki on biti prenesti na organ SFRJ ter začeti pogajanje z drug republika SFRJ o praven nasledstvo SFRJ in o bodoč ureditev medsebojen odnos po načelo mednaroden pravo vključno z ponudba konfederalen pogodba"
"parl.Skup","slavnostna seja",1,"1990-12-26","18:00:00","","BucarFrance1923",1,"VsiZbor.1990-12-26.sl001-01.sp-2","VsiZbor.1990-12-26.sl001-01.sp-2.13",VsiZbor.1990-12-26.sl001-01.toc-item1,"taxonomy.3.1","topic.55","po 10. člen isti zakon biti po slovesen razglasitev odločitev o rezultat skupščina dolžen da hkrati sprejeti program delo za uresničevanje ta odločitev izpolnjujoč ta zahteva biti predsednik predsedstvo skupščina republika Slovenija gospod Milan Kučan podati glaven obris ta usmeritev prositi gospod Kučan"
"parl.Skup","slavnostna seja",1,"1990-12-26","18:00:00","","KucanMilan1941",0,"VsiZbor.1990-12-26.sl001-01.sp-3","VsiZbor.1990-12-26.sl001-01.sp-3.2",VsiZbor.1990-12-26.sl001-01.toc-item2,"taxonomy.3.1","topic.55","spoštovan predsednik spoštovan poslanka in poslanec"
"parl.Skup","slavnostna seja",1,"1990-12-26","18:00:00","","KucanMilan1941",0,"VsiZbor.1990-12-26.sl001-01.sp-3","VsiZbor.1990-12-26.sl001-01.sp-3.3",VsiZbor.1990-12-26.sl001-01.toc-item2,"taxonomy.3.1","topic.55","izid plebiscitaren ugotavljanje volja Slovenc državljan naš republika in ves njen stalen prebivalec glede prihodnost Slovenija biti poznan in uradno sporočen Slovenija biti zdaj samostojen in neodvisen država"
"parl.Skup","slavnostna seja",1,"1990-12-26","18:00:00","","KucanMilan1941",0,"VsiZbor.1990-12-26.sl001-01.sp-3","VsiZbor.1990-12-26.sl001-01.sp-3.5",VsiZbor.1990-12-26.sl001-01.toc-item2,"taxonomy.3.1","topic.55","tretjič biti biti jaz Slovenc v nov zgodovina dan da odločati o ta vprašanje prvič tudi večina sedaj živeč rod odločitev ki jaz on biti naložiti splet zgodovinski okoliščina biti sprejeti razsodno in pogumno z čast in dostojanstvo izid glasovanje jaz moči utrditi samozavest in utemeljiti upanje tudi za naprej"
"parl.Skup","slavnostna seja",1,"1990-12-26","18:00:00","","KucanMilan1941",0,"VsiZbor.1990-12-26.sl001-01.sp-3","VsiZbor.1990-12-26.sl001-01.sp-3.6",VsiZbor.1990-12-26.sl001-01.toc-item2,"taxonomy.3.1","topic.55","v naš odločitev biti vtkan mnog časten dejanje ves pretekel upanje iskanje in sanja Slovenc legitimnost ta naš odločitev dajati med drug program zedinjen Slovenija majniški deklaracija in slovenski narodnoosvobodilen gibanje ta biti čas ko biti biti slovenski partizanski vojska z ustanova slovenski oblast del velik svetoven in evropski zmaga nad nacizem ta velik demokratičen dejanje človeštvo iz kateri biti zrasti današnji Evropa osvoboditi biti se sam in z ta dokazati da znati zrelo odločati o svoj obstoj ta ceniti in priznavati ves demokratičen svet neposreden zastopstvo zavezniški vojska pri vodstvo samostojen osvobodilen gibanje slovenski narod biti biti za ta prvi a dovolj zgovoren in prepričljiv dokaz"
"parl.Skup","slavnostna seja",1,"1990-12-26","18:00:00","","KucanMilan1941",0,"VsiZbor.1990-12-26.sl001-01.sp-3","VsiZbor.1990-12-26.sl001-01.sp-3.7",VsiZbor.1990-12-26.sl001-01.toc-item2,"taxonomy.3.1","topic.55","odločitev za samostojen in neodvisen država Slovenija biti sprejeti demokratično z svoj prepričljivost zavezovati sedanji in ves prihodnji slovenski oblast začenjati se nov obdobje v zgodovina naš narod odločitev biti jasen in zavezujoč moči in morati biti temelj za ustvarjanje poln naroden in državen suverenost Slovenija biti tisti temeljen na pravica do narodov samoodločba naslonjen državotvoren in političen odločitev na kateri slovenski narod graditi svoj dom svoboda in neodvisnost enak tisti kakršen biti se zgraditi ali se on še biti velik in mali narod svoboden Evropa da biti lahko v on živeti skupaj ustvarjalno demokratičen enakopravno in enako odgovorno"
"parl.Skup","slavnostna seja",1,"1990-12-26","18:00:00","","KucanMilan1941",0,"VsiZbor.1990-12-26.sl001-01.sp-3","VsiZbor.1990-12-26.sl001-01.sp-3.8",VsiZbor.1990-12-26.sl001-01.toc-item2,"taxonomy.3.1","topic.55","odločitev biti časten in zgodovinski njen prvi vrednost in pomen biti v celota pokazati prihodnost ta biti preizkusiti dokazati in utemeljiti nedeljski odločitev objektiven sodba o pomen ta dejanje biti nedvomno moči dati šele prihodnji rod jaz biti moči in biti z osvobojen misel in odprt srce pogumno in brez omahovanje v ta krizen in dramatično protisloven čas vzeti ta odločitev na svoj rame ta jaz zdaj zavezovati da ravnati zrelo odgovoren pogumno in razumno zdaj biti čas da biti se prepuščati opoj zmagoslavje in naroden vznesenost biti čas spoznanje narodov zrelost in samozavest ta jaz omogočati da določiti naš dolgoročen interes in odločiti o ta kako on biti uresničevati odgovorno do svoj življenje in svoj prihodnost do drug narod Jugoslavija in do demokratičen skupnost narod in država Evropa in svet ves ta naj zagotavljati trden osnova za nadaljevanje smiseln in ustvarjalen razvoj slovenski kulturen in civilizacijski samobitnost ki biti on zavezan tako z svoj zgodovina in svoj kulturen in naraven dediščina kot z pluralnost nov Evropa"
"parl.Skup","slavnostna seja",1,"1990-12-26","18:00:00","","KucanMilan1941",0,"VsiZbor.1990-12-26.sl001-01.sp-3","VsiZbor.1990-12-26.sl001-01.sp-3.9",VsiZbor.1990-12-26.sl001-01.toc-item2,"taxonomy.3.1","topic.55","dovoliti jaz spoštovan poslanka in poslanec da v ime predsedstvo republika Slovenija predlagati nekaj temeljen usmeritev za uresničevanje na plebiscit sprejet odločitev predlog biti naslonjen na izjava o dober namen ta biti z demokratičnost in jasnost svoj sporočilo naleteti na zelo ugoden odmev pri naš človek drugod po Jugoslavija in predvsem tudi v mednaroden javnost če biti ponujen usmeritev podpreti predlagati da naročiti izvršen svet naj čimprej pripraviti in predložiti skupščina njihov podroben razčlenitev pri predlog se predsedstvo opirati na političen soglasje slovenski političen stranka parlamentaren lok ki biti biti pomemben pogoj za uspeh plebiscit"
"parl.Skup","slavnostna seja",1,"1990-12-26","18:00:00","","KucanMilan1941",0,"VsiZbor.1990-12-26.sl001-01.sp-3","VsiZbor.1990-12-26.sl001-01.sp-3.10",VsiZbor.1990-12-26.sl001-01.toc-item2,"taxonomy.3.1","topic.55","predsedstvo predlagati da usmeriti pozornost predvsem v naslednji smer in dejanje"
"parl.Skup","slavnostna seja",1,"1990-12-26","18:00:00","","KucanMilan1941",0,"VsiZbor.1990-12-26.sl001-01.sp-3","VsiZbor.1990-12-26.sl001-01.sp-3.11",VsiZbor.1990-12-26.sl001-01.toc-item2,"taxonomy.3.1","topic.55","1. priprava in spomladi tudi sprejem ustava republika Slovenija kot samostojen država na izhodišče ki on biti na predlog predsedstvo že sprejeti ta visok in spoštovan dom"
"parl.Skup","slavnostna seja",1,"1990-12-26","18:00:00","","KucanMilan1941",0,"VsiZbor.1990-12-26.sl001-01.sp-3","VsiZbor.1990-12-26.sl001-01.sp-3.12",VsiZbor.1990-12-26.sl001-01.toc-item2,"taxonomy.3.1","topic.55","ta biti v temeljen rešitev že zajet v njen osnutek ki biti tačas v javen razprava na ta temelj jaz biti mogoč pripraviti in sprejeti tudi ves drug praven akt in opraviti dejanje ki biti potreben za oblikovanje celovit pravno političen in ekonomski sistem"
"parl.Skup","slavnostna seja",1,"1990-12-26","18:00:00","","KucanMilan1941",0,"VsiZbor.1990-12-26.sl001-01.sp-3","VsiZbor.1990-12-26.sl001-01.sp-3.13",VsiZbor.1990-12-26.sl001-01.toc-item2,"taxonomy.3.1","topic.55","hkrati morati potekati dejavnost da republika Slovenija prevzeti ves suveren pravica kateri izvrševanje biti prenesti na organ Jugoslavija"
"parl.Skup","slavnostna seja",1,"1990-12-26","18:00:00","","KucanMilan1941",0,"VsiZbor.1990-12-26.sl001-01.sp-3","VsiZbor.1990-12-26.sl001-01.sp-3.14",VsiZbor.1990-12-26.sl001-01.toc-item2,"taxonomy.3.1","topic.55","nedvomno zaslužiti dogovor o ta temeljen zakon družbeno praven ureditev v trenutek ko dobivati svoj nacionalen suverenost in državen samostojnost prvenstven mesto ustava morati biti le akt ki biti po mera ves Slovenc in državljan republika ne en sam stranka ali skupina stranka prav zato morati biti demokratičen tudi po nastajanje in sprejemanje in ne le po svoj vsebina veljati pripraviti ustava ki biti na raven praven zavest in standard sodoben Evropa misliti predvsem na uveljavitev vrednota in institucija evropski demokracija ter tisti praven tradicija ki se izražati predvsem v načelo o spoštovanje človekov pravica o parlamentaren pluralističen demokracija o vladavina pravo o delitev oblast socialen država in socialen pravičnost pluralizem lastnina svoboda podjetništvo in odgovornost do okolje takšen ustava biti dati tisti potreben in trden pravno političen osnova za celovit ustvarjalen demokratičen državno in družben preobrazba ki biti omogočati da biti Slovenija postati svoboden in demokratičen suveren država pa tudi družba pravičnost in blaginja na temelj takšen ustava biti nujno ustvariti celovit praven red ki biti v vsak posamičen akt ne le slovenski ampak tudi evropski skladen z pravo in standard ki se razvijati v evropski skupnost brez takšen praven ureditev ki biti veljati za ves človek brez razlika glede na narodnost vera političen prepričanje in spol in brez ta ureditev ustrezen obnašanje ne moči upati da jaz biti odprt vrata v evropski institucija"
"parl.Skup","slavnostna seja",1,"1990-12-26","18:00:00","","KucanMilan1941",0,"VsiZbor.1990-12-26.sl001-01.sp-3","VsiZbor.1990-12-26.sl001-01.sp-3.15",VsiZbor.1990-12-26.sl001-01.toc-item2,"taxonomy.3.1","topic.55","ustaviti morati nameniti prednost morati imeti nadstrankarski pristop in medstrankarski soglasje"
"parl.Skup","slavnostna seja",1,"1990-12-26","18:00:00","","KucanMilan1941",0,"VsiZbor.1990-12-26.sl001-01.sp-3","VsiZbor.1990-12-26.sl001-01.sp-3.16",VsiZbor.1990-12-26.sl001-01.toc-item2,"taxonomy.3.1","topic.55","o zadeva ki biti ključen nacionalen pomen biti mogoč odločati zgolj z navaden večina ali z mehaničen preglasovanje ampak samo na podlaga vsesplošen soglasje ves političen sila ki biti zastopan v parlament tudi zato da biti zavezan za uresničevanje odločitev pogoj za tak soglasje biti zrel in odgovoren demokratičen parlament in tudi zunaj parlamentaren dialog zahteva po soglasje nalagati izvršen oblast da predlog odločitev temeljito pripraviti argumentirati in predstaviti njihov posledica"
"parl.Skup","slavnostna seja",1,"1990-12-26","18:00:00","","KucanMilan1941",0,"VsiZbor.1990-12-26.sl001-01.sp-3","VsiZbor.1990-12-26.sl001-01.sp-3.17",VsiZbor.1990-12-26.sl001-01.toc-item2,"taxonomy.3.1","topic.55","slovenski država biti torej temeljiti na visok spoštovanje človekov pravica in svoboščina uveljavljanje političen pravica biti zahteva političen kultura političen demokracija brez upoštevanje človekov pravica in še posebej uveljavljanje socialno-ekonomski pravica imeti pravi vsebina ta omogočati človek udeležba na družben blaginja v sklad z njegov del in ustvarjalnost ob zagotovljen socialen varnost ki temeljiti na vzajemnost in solidarnost zagotovljen morati biti tudi pravica do zdrav življenjski okolje in pravica do mir tudi pravica do sodelovanje pri upravljanje podjetje morati biti ustavno zagotovljen posameznik naj imeti pravica da se potem ko biti biti izčrpan ves domač praven sredstvo obrniti v sklad z evropski konvencija o človekov pravica na evropski komisija za človekov pravica tudi zato želeti postati Slovenija članica svet Evropa"
"parl.Skup","slavnostna seja",1,"1990-12-26","18:00:00","","KucanMilan1941",0,"VsiZbor.1990-12-26.sl001-01.sp-3","VsiZbor.1990-12-26.sl001-01.sp-3.18",VsiZbor.1990-12-26.sl001-01.toc-item2,"taxonomy.3.1","topic.55","spoštovanje človekov pravica pa tudi lasten demokratičen drža ter interes in odgovornost za položaj slovenski manjšina jaz določno zavezovati tako v razmerje do italijanski in madžarski narodnost kot tudi v razmerje do pripadnik ves drug narod in narodnost ki živeti v Slovenija ustava in kasen zakonodaja on biti zagotoviti ves državljanski in nacionalen pravica tisti ki biti dosežek naš dosedanji demokratičen razvoj in tisti ki biti zagotovljen z meddržaven pogodba in drug mednaroden akt demokratičnost oblast in družba se razkrivati med drug posebej tudi v praven in dejanski položaj manjšina nacionalen in drug izjava o dober namen poleg ta nedvoumno zagotavljati ves pripadnik drug narod in narodnost Jugoslavija z stalen bivališče v Slovenija da lahko pridobiti državljanstvo Slovenija če ta želeti možen omejitev in dodaten pogoj priti zaradi dan izjava in spoštovanje veljaven praven ureditev v poštev samo za tisti ki do sedaj biti imeti stalen bivališče v Slovenija njihov položaj biti urejen in zavarovan kot biti v demokratičen država zavarovan položaj in priznan pravica tuj in dvojen državljan"
"parl.Skup","slavnostna seja",1,"1990-12-26","18:00:00","","KucanMilan1941",0,"VsiZbor.1990-12-26.sl001-01.sp-3","VsiZbor.1990-12-26.sl001-01.sp-3.19",VsiZbor.1990-12-26.sl001-01.toc-item2,"taxonomy.3.1","topic.55","posebej želeti poudariti da morati postati sestavina novo nastajajoč samostojen in neodvisen slovenski država ves tisti demokratičen vrednota zlasti samostojnost in neodvisnost sodišče depolitizacija državen uprava in še posebej njen represiven mehanizem ki biti vsebina praven država tak država služiti človek zato biti podrejen civilen družba in biti gospodar nad on"
"parl.Skup","slavnostna seja",1,"1990-12-26","18:00:00","","KucanMilan1941",0,"VsiZbor.1990-12-26.sl001-01.sp-3","VsiZbor.1990-12-26.sl001-01.sp-3.20",VsiZbor.1990-12-26.sl001-01.toc-item2,"taxonomy.3.1","topic.55","socialen država in vsebina socialen blaginja nasploh morati biti en od bistven osnova družben soglasje izražati on morati že vsebina in način sprejemanje lastninski stanovanjski pokojninski in drug zakon z ta področje celovito biti ta vsebina morati uresničiti ves splet zakon za uveljavitev gospodarski socialen in kulturen pravica da biti tako Slovenija v resnica postati država z podjetniški tržno in ustvarjalno kulturen in duhoven svoboda kot temelj svoj gospodarski razvoj in blaginja pa tudi socialen pravičnost država ki biti znati zagotoviti na raven evropski standard ekološko uravnovešen raba naraven vir Slovenija prilagajanje bodoč poseg v okolje občutljiv ekološki sistem Slovenija in zmanjševanje visok stopnja degradacija okolje kajti preživetje jaz dolgoročno zagotavljati le ohranjanje biološki pogoj življenje in usklajen delovanje ves naš ekološki sistem"
"parl.Skup","slavnostna seja",1,"1990-12-26","18:00:00","","KucanMilan1941",0,"VsiZbor.1990-12-26.sl001-01.sp-3","VsiZbor.1990-12-26.sl001-01.sp-3.21",VsiZbor.1990-12-26.sl001-01.toc-item2,"taxonomy.3.1","topic.55","2. oblikovanje lasten gospodarski sistem ta jaz biti skupaj z ustrezen nabor ekonomsko-političen instrument omogočiti samosvoj ekonomski razvoj krepitev gospodarski temelj suverenost in lasten socialen politika hkrati pa jaz biti narediti prožen in bolj sposoben za ves potreben prilagajanje z ta biti prevzeti odgovornost za lasten gospodarski usoda v svoj roka kolikor biti ta seveda mogoč v majhen in odprt gospodarstvo za kateri veljati da njegov usoda biti v vsak trenutek odvisen samo od njegov lasten odločitev"
"parl.Skup","slavnostna seja",1,"1990-12-26","18:00:00","","KucanMilan1941",0,"VsiZbor.1990-12-26.sl001-01.sp-3","VsiZbor.1990-12-26.sl001-01.sp-3.22",VsiZbor.1990-12-26.sl001-01.toc-item2,"taxonomy.3.1","topic.55","gospodarski sistem naj temeljiti na načelo primerljivost in prilagodljivost sistem evropski država prožnost delovanje in postopnost uvajanje zaokrožen naj biti z lasten zaščiten ter denaren in krediten sistem ki biti varovati gospodarstvo pred intervencionističen ukrep drug država in on hkrati stati ob stran pri ves potreben makroekonomski in strukturen prilagajanje odgovoriti morati na zahteva po sprememba lastniški struktura in oblikovati mehanizem za razreševanje konflikt do kateri biti priti zaradi spreminjanje lastniški struktura in zahteva po socialen varnost človek"
"parl.Skup","slavnostna seja",1,"1990-12-26","18:00:00","","KucanMilan1941",0,"VsiZbor.1990-12-26.sl001-01.sp-3","VsiZbor.1990-12-26.sl001-01.sp-3.23",VsiZbor.1990-12-26.sl001-01.toc-item2,"taxonomy.3.1","topic.55","proces lastninjenje morati upoštevati tudi načelo socialen pravičnost zlasti glede tisti in ta večinski delo prebivalstvo ki živeti samo od svoj delo in biti ustvariti velik del naroden bogastvo opredmeten v družben lastnina načelo pravičnost zahtevati da nihče ne smeti biti prikrajšan za možnost vključevanje v oblikovanje trden jedro nov lastnik da biti lahko vplivati na učinkovitost podjetniški odločitev razvit in socialno pravičen družba v kateri se uveljavljati posameznik kot svoboden političen bitje on morati omogočati soodločanje o ustvarjanje in delitev družben proizvod"
