"orgId","type of session","number","date","notBefore","notAfter","persId","chairman","spId","uId","titleId","taxonomyIds","topicIds","lemmata"
"parl.Skup","slavnostna seja",1,"1990-12-26","18:00:00","","KucanMilan1941",0,"VsiZbor.1990-12-26.sl001-01.sp-3","VsiZbor.1990-12-26.sl001-01.sp-3.53",VsiZbor.1990-12-26.sl001-01.toc-item2,"taxonomy.3.1","topic.55","političen osnova za ves ta dejavnost predstavljati strankarski soglasje sposobnost stranka da v nacionalen interes v ta občutljiv čas uskladiti svoj pogled in dejavnost na temelj sporazum ki biti on podpisati pred plebiscit potekati morati na temelj dober priprava in morati biti usklajen po strokoven političen in izvedben stran v izvedba naloga ki biti pred jaz kazati pritegniti ves ustvarjalen strokoven sila tako doma kot pri naš človek na začasen ali stalen delo in bivanje v tujina zdaj ne moči biti poglaviten strankarski pripadnost človek ampak njihov strokovnost in znanje če jaz biti ta uspeti potem biti odveč tudi razprava o vlada nacionalen enotnost jaz vlada imeti biti rezultat in izraz demokratičen volitev on morati nositi ves odgovornost do nov volitev ki on biti potrebno razpisati po sprejetje nov ustava pri opravljanje svoj naloga morati imeti parlamentaren podpora ali pa morati biti postavljen vprašanje njen sposobnost in odgovornost v parlament na način in z sredstvo ki on poznati parlamentaren demokracija in seveda z ves odgovornost za ta političen korak"
"parl.Skup","slavnostna seja",1,"1990-12-26","18:00:00","","KucanMilan1941",0,"VsiZbor.1990-12-26.sl001-01.sp-3","VsiZbor.1990-12-26.sl001-01.sp-3.54",VsiZbor.1990-12-26.sl001-01.toc-item2,"taxonomy.3.1","topic.55","zdaj biti brez dvom na tisti točka naš prihodnji zgodovina ko biti vsak pomemben odločitev lahko tudi usoden čas biti veliko razmera v kateri živeti in cilj ki biti se on zastaviti zahtevati sprememba toda kakor že biti pomemben hitrost ta sprememba biti še odločilen njihov kakovost zgodovinski spomin in življenjski izkušnja naš narod povedati da biti pri uresničevanje tako daljnosežen cilj potrebno računati z ves tudi surov realnost življenje da se ne biti neupoštevanje zgodovinski okoliščina in razmerje političen sila pokazati kot poglaviten dejavnik njihov preprečitev ta dejstvo lahko spregledati samo političen sila ki biti pripravljen pristati na vloga naključen sopotnik v svetoven proces ustvarjanje prihodnji zgodovina človeštvo z kateri se brez njihov vpliv in volja poigravati zgodovinski silnica ta zdaj biti težek prepoznati tako v Evropa kot znotraj Jugoslavija zato biti ta čas dolžnost demokratičen političen sila v slovenski narod da se prepoznati na stran tisti demokrtično in napreden sila človeštvo ki on za prihodnji utirjati na tirnica nastajajoč civilizacija preživetje in prihodnost ta biti pogoj da ne biti žrtvovati svoj ideal ki biti zdaj po plebiscit dovolj razpoznaven mir svoboda blaginja materialen napredek in razvoj odgovornost za okolje socialen pravičnost odgovornost in zavarovanje človeški dostojanstvo"
"parl.Skup","slavnostna seja",1,"1990-12-26","18:00:00","","KucanMilan1941",0,"VsiZbor.1990-12-26.sl001-01.sp-3","VsiZbor.1990-12-26.sl001-01.sp-3.55",VsiZbor.1990-12-26.sl001-01.toc-item2,"taxonomy.3.1","topic.55","spoštovan poslanka in poslanec"
"parl.Skup","slavnostna seja",1,"1990-12-26","18:00:00","","KucanMilan1941",0,"VsiZbor.1990-12-26.sl001-01.sp-3","VsiZbor.1990-12-26.sl001-01.sp-3.56",VsiZbor.1990-12-26.sl001-01.toc-item2,"taxonomy.3.1","topic.55","z plebiscit biti se naložiti odgovornost za obstoj in prihodnost slovenstvo ne moči in ne želeti biti zdaj odložiti niti prenesti na kdo drug naložiti se on želeti pošteno zavedajoč se da biti zgodovina postavljati vprašanje kako biti on izpolniti ostajati jaz upanje naslonjen na naš prepričanje in pripravljenost da ta naloga nesebično žrtvovati ves svoj znanje ustvarjalnost in ugled da jaz biti prihodnji rod Slovenc in naš zgodovina izreči naklonjen sodba kajti sprememba ki biti omogočiti da se danes sploh moči postavljati takšen vprašanje skupaj z tisti ki jaz biti v mnog preizkušnja še naložen biti omogočiti pokop in prepuščanje zgodovina ves pretekel spor in delitev Slovenc povzročen z spopad velik sila in ideologija ta stoletje na naš prostor in z ta dati tudi nov spodbuda za celoten prenova slovenski naroden značaj tako kot biti ta po volja e. Kocbek biti zapisan v temeljen točka OF slovenski narod v ta bleščeč dejanje svobodoljuben in demokratičen misel pri Slovenc kajti edin pravi nevarnost ki jaz ta čas groziti prihajati od jaz sam zato ne dovoliti nihče da biti se odločitev ljudstvo sebično prilaščati ali on z svoj nesposobnost onemogočati"
"parl.Skup","slavnostna seja",1,"1990-12-26","18:00:00","","KucanMilan1941",0,"VsiZbor.1990-12-26.sl001-01.sp-3","VsiZbor.1990-12-26.sl001-01.sp-3.57",VsiZbor.1990-12-26.sl001-01.toc-item2,"taxonomy.3.1","topic.55","verjeti spoštovan poslanec in poslanka da misel vsakdo od jaz ta slovesen večer begati po mnog obzorje da se gibati med strogo razumski premislek in čustven opredelitev a na konec o ta ne dvomiti se biti na ključen stvar poenotiti saj jaz navsezadnje nič drug tudi ne ostati Slovenc jaz biti kolikor jaz biti in biti takšen kot biti drug biti zdaj iti za ta kako biti odgovarjati zanamec ko jaz biti spraševati kaj biti početi in kje biti biti ko se biti rojevati nov Evropa in biti nastajati nov zgodovina človeštvo verjeti da se vsakdo od jaz želeti čist srce in jasen pogled pošten in časten odgovor preprosto biti biti zraven"
"parl.Skup","slavnostna seja",1,"1990-12-26","18:00:00","","KucanMilan1941",0,"VsiZbor.1990-12-26.sl001-01.sp-3","VsiZbor.1990-12-26.sl001-01.sp-3.58",VsiZbor.1990-12-26.sl001-01.toc-item2,"taxonomy.3.1","topic.55","čestitati ti z ta misel spoštovan poslanka in poslanec in se ti zahvaljevati za ves kar biti narediti da biti celoten plebiscitaren dejanje potekati tako demokratičen prepričljiv in dostojanstveno seveda pa iti zahvala in čestitka tudi ves Slovenka in Slovenc pa tudi ves drug prebivalec Slovenija ki biti z svoj visok udeležba v nedelja še enkrat pokazati velik zrelost odgovornost in zavzetost za svoj dober prihodnost in za prihodnost nov slovenski država verjeti da biti tako tudi v prihodnji"
"parl.Skup","slavnostna seja",1,"1990-12-26","18:00:00","","KucanMilan1941",0,"VsiZbor.1990-12-26.sl001-01.sp-3","VsiZbor.1990-12-26.sl001-01.sp-3.59",VsiZbor.1990-12-26.sl001-01.toc-item2,"taxonomy.3.1","topic.55","predsedstvo Slovenija in tudi jaz sam biti pri ta pripravljen prevzeti svoj del odgovornost hvala"
"parl.Skup","slavnostna seja",1,"1990-12-26","18:00:00","","BucarFrance1923",1,"VsiZbor.1990-12-26.sl001-01.sp-4","VsiZbor.1990-12-26.sl001-01.sp-4.2",VsiZbor.1990-12-26.sl001-01.toc-item2,"taxonomy.3.1","topic.55","spoštovan zbor aplavz z kateri biti pospremiti izvajanje predsednik predsedstvo jaz dokazovati da ta izhodišče sprejemati kot primeren za nadaljnji izdelava program za izvajanje naročilo mandat ki on jaz biti dati plebiscit in zato ta seja zaključevati hvala lep"
