"orgId","type of session","number","date","notBefore","notAfter","persId","chairman","spId","uId","titleId","taxonomyIds","topicIds","lemmata"
"parl.ZbZdruDel","seja",28,"1991-08-29","10:25:00","12:15:00","LippaiMartina",0,"ZbZdruDel.1991-08-29.s028-02.sp-123","ZbZdruDel.1991-08-29.s028-02.sp-123.8",ZbZdruDel.1991-08-29.s028-02.toc-item4,"taxonomy.3.8.7","topic.349","ta biti ves vprašanje ki biti biti proučevan ob priprava ta zakon seveda biti pa na skupščina da se odločati hvala"
"parl.ZbZdruDel","seja",28,"1991-08-29","10:25:00","12:15:00","PucVlado1941",0,"ZbZdruDel.1991-08-29.s028-02.sp-124","ZbZdruDel.1991-08-29.s028-02.sp-124.2",ZbZdruDel.1991-08-29.s028-02.toc-item4,"taxonomy.3.8.7","topic.349","jaz biti gospa vprašati kdo jamčiti da tudi če biti ta biti sprejet da ta kršitev ne biti namreč jaz misliti da narobe biti ta da nihče pravzaprav ta stvar ne preganjati drugače biti pa povedati kako ministrstvo za kmetijstvo delo jaz imeti pravzaprav biti reči ne vedeti ali biti biti dopis ali kaj da lahko občina kupovati zemlja ki se prodajati kmetijski zemlja no in v naš občina kupiti ves kar se prodajati torej za ta kmetijski sklad republiški in sicer ki biti zdaj občinski ki on petnajst leto ne moči prodajati samo dejstvo biti ta da ta človek ko prodaja obljubiti da biti denar takoj medtem ko pa naš republika ki imeti dosti denar pa tudi že pet mesec nič ne plačati in jaz praviti pravzaprav biti ta razmerje potem ostati ker se biti ves centralizirati in ta biti narobe"
"parl.ZbZdruDel","seja",28,"1991-08-29","10:25:00","12:15:00","LippaiMartina",0,"ZbZdruDel.1991-08-29.s028-02.sp-125","ZbZdruDel.1991-08-29.s028-02.sp-125.2",ZbZdruDel.1991-08-29.s028-02.toc-item4,"taxonomy.3.8.7","topic.349","seveda biti noben garancija da biti potem dobro slabo biti pač odvisen od človek jaz lahko napisati idealen zakon in ne vedeti kakšen še pa on potem ne izvajati zaradi ta ker biti pripravljenost za ta in ker imeti mehanizem ali pa on hoteti uporabiti zato da biti človek disciplinirati in da biti dejansko predpis tudi upoštevati tako da tukaj ne iti za ta ta garancija ti nihče ne moči dati tako kot tudi občina ne moči dati garancija da biti zato ker on biti zemljišče eventualno ostati potem dobro gospodariti biti obojestranski zadeva kar se tikati dajanje sredstvo še ta biti rad povedati"
"parl.ZbZdruDel","seja",28,"1991-08-29","10:25:00","12:15:00","LippaiMartina",0,"ZbZdruDel.1991-08-29.s028-02.sp-125","ZbZdruDel.1991-08-29.s028-02.sp-125.3",ZbZdruDel.1991-08-29.s028-02.toc-item4,"taxonomy.3.8.7","topic.349","odbor izvršen svet biti v torek obravnavati osnutek zakon o gozd v osnutek zakon o gozd biti predviden javen lastnina ki biti državen ta se praviti republika Slovenija ali občina ta podržavljanje ki biti v ta sklad predviden biti trajen rešitev biti trajen zadeva zaradi ta ker biti želeti imeti določen čas za pregled in vzpostavitev evedenca nad ves ta zemljišče ne biti ti obremenjevati z ta kakšen težava imeti kadar hoteti dobiti kakšen podatek koliko biti pravzaprav zemljišče v zemljiški sklad pri organizacija itd. niti ta evidenca ne voditi pa tisti družben lastnik on tudi biti voditi torej iti za ta da biti potem tako kot biti v zakon o gozd predviden da se po izveden denacionalizacija in ves ta urediti dokončen lastninski stanje se praviti da se tudi občina dati tisti gozd ki naj biti on eventualno imeti in da se ta odločiti z akt izvršen svet ali pa skupščina republika Slovenija nameravati ta tudi predlagati v zakon o kmetijski zemljišče"
"parl.ZbZdruDel","seja",28,"1991-08-29","10:25:00","12:15:00","LippaiMartina",0,"ZbZdruDel.1991-08-29.s028-02.sp-125","ZbZdruDel.1991-08-29.s028-02.sp-125.4",ZbZdruDel.1991-08-29.s028-02.toc-item4,"taxonomy.3.8.7","topic.349","torej ne iti za ta reč iti za nek začasen obdobje ki biti po naš mnenje upravičeno in biti ves razlog za ta daniti z ta da sklad zemljišče z ta zemljišče ne biti delati nič drug kot da on biti dajati dober ponudnik kar ne pomeniti tisti ki biti dati največ denar ampak tisti ki biti dokazati dober obdelava pravzaprav v zakup in obdelava z ta da se določen obdobje garantirati sedanji obdelovalec obdelava ta zemljišče torej biti rešitev niti naperjen zoper podjetje biti naperjen zoper občina biti naperjen zoper nihče da se ne biti narobe razumeti"
"parl.ZbZdruDel","seja",28,"1991-08-29","10:25:00","12:15:00","LippaiMartina",0,"ZbZdruDel.1991-08-29.s028-02.sp-125","ZbZdruDel.1991-08-29.s028-02.sp-125.5",ZbZdruDel.1991-08-29.s028-02.toc-item4,"taxonomy.3.8.7","topic.349","kar se tikati pa odkup kmetijski zemljišče za kar se dajati kar precejšnji sredstvo iz republiški proračun pa žal res jaz biti kriv če republiški proračun imeti denar in jaz ne moči za program zagotoviti denar da biti jaz lahko sproti odplačevati ta zemljišče vprašati se pa zakaj pa občina denar ki on dobiti iz naslov kmetijski zemljišče ne uporabiti za odkup ampak iz republika zahtevati 100 procenten refundacija ta biti vprašanje samo ti ampak ves hvala"
"parl.ZbZdruDel","seja",28,"1991-08-29","10:25:00","12:15:00","GradisarFranc1945",0,"ZbZdruDel.1991-08-29.s028-02.sp-126","ZbZdruDel.1991-08-29.s028-02.sp-126.2",ZbZdruDel.1991-08-29.s028-02.toc-item4,"taxonomy.3.8.7","topic.349","z ta razlaga gospa biti zadovoljen ker on praviti da biti garancija do sedaj v ta sistem v kateri biti živeti se zakon biti spoštovati zato ker biti biti neživljenjski jaz pa če hoteti v Evropa morati sprejeti kvaliteten zakon ki on biti lahko v življenje sprovedli in spoštovati ta biti ta praven država hvala"
"parl.ZbZdruDel","seja",28,"1991-08-29","10:25:00","12:15:00","ZupancicJoze1936",1,"ZbZdruDel.1991-08-29.s028-02.sp-127","ZbZdruDel.1991-08-29.s028-02.sp-127.2",ZbZdruDel.1991-08-29.s028-02.toc-item4,"taxonomy.3.8.7","topic.349","če biti več biti zaključiti nekako izgledati razmerje 6 proti 2. kaj biti pa dejati z glasovanje biti pa kmalu razviden"
"parl.ZbZdruDel","seja",28,"1991-08-29","10:25:00","12:15:00","ZupancicJoze1936",1,"ZbZdruDel.1991-08-29.s028-02.sp-127","ZbZdruDel.1991-08-29.s028-02.sp-127.3",ZbZdruDel.1991-08-29.s028-02.toc-item4,"taxonomy.3.8.7","topic.349","prisotnost"
"parl.ZbZdruDel","seja",28,"1991-08-29","10:25:00","12:15:00","ZupancicJoze1936",1,"ZbZdruDel.1991-08-29.s028-02.sp-127","ZbZdruDel.1991-08-29.s028-02.sp-127.5",ZbZdruDel.1991-08-29.s028-02.toc-item4,"taxonomy.3.8.7","topic.349","še enkrat"
"parl.ZbZdruDel","seja",28,"1991-08-29","10:25:00","12:15:00","ZupancicJoze1936",1,"ZbZdruDel.1991-08-29.s028-02.sp-127","ZbZdruDel.1991-08-29.s028-02.sp-127.7",ZbZdruDel.1991-08-29.s028-02.toc-item4,"taxonomy.3.8.7","topic.349","kdo biti za ta da ne sprejeti predlog skupen komisija za uskladitev dneven red seja zbor da obravnavati predlog za izdaja zakon o sklad kmetijski zemljišče in gozd republika Slovenija hkrati z osnutek"
"parl.ZbZdruDel","seja",28,"1991-08-29","10:25:00","12:15:00","ZupancicJoze1936",1,"ZbZdruDel.1991-08-29.s028-02.sp-127","ZbZdruDel.1991-08-29.s028-02.sp-127.8",ZbZdruDel.1991-08-29.s028-02.toc-item4,"taxonomy.3.8.7","topic.349","kdo biti za ta da ne sprejeti trifazen postopek"
"parl.ZbZdruDel","seja",28,"1991-08-29","10:25:00","12:15:00","ZupancicJoze1936",1,"ZbZdruDel.1991-08-29.s028-02.sp-127","ZbZdruDel.1991-08-29.s028-02.sp-127.10",ZbZdruDel.1991-08-29.s028-02.toc-item4,"taxonomy.3.8.7","topic.349","proti"
"parl.ZbZdruDel","seja",28,"1991-08-29","10:25:00","12:15:00","ZupancicJoze1936",1,"ZbZdruDel.1991-08-29.s028-02.sp-127","ZbZdruDel.1991-08-29.s028-02.sp-127.12",ZbZdruDel.1991-08-29.s028-02.toc-item4,"taxonomy.3.8.7","topic.349","vzdržan"
"parl.ZbZdruDel","seja",28,"1991-08-29","10:25:00","12:15:00","ZupancicJoze1936",1,"ZbZdruDel.1991-08-29.s028-02.sp-127","ZbZdruDel.1991-08-29.s028-02.sp-127.14",ZbZdruDel.1991-08-29.s028-02.toc-item4,"taxonomy.3.8.7","topic.349","ugotavljati da biti ostati pri svoj stališče in biti obravnavati ta zakon po normalen postopek"
"parl.ZbZdruDel","seja",28,"1991-08-29","10:25:00","12:15:00","ZupancicJoze1936",1,"ZbZdruDel.1991-08-29.s028-02.sp-127","ZbZdruDel.1991-08-29.s028-02.sp-127.15",ZbZdruDel.1991-08-29.s028-02.toc-item5,"taxonomy.3.1.4.1 taxonomy.3.6.1.2","topic.126 topic.225","zdaj pa še glede oba zakon o denacionalizacija in o zadruga"
"parl.ZbZdruDel","seja",28,"1991-08-29","10:25:00","12:15:00","ZupancicJoze1936",1,"ZbZdruDel.1991-08-29.s028-02.sp-127","ZbZdruDel.1991-08-29.s028-02.sp-127.16",ZbZdruDel.1991-08-29.s028-02.toc-item5,"taxonomy.3.1.4.1 taxonomy.3.6.1.2","topic.126 topic.225","slišati biti predlog vedeti tudi kako biti se včeraj o on pogovarjati in da biti se potem odločiti da biti on preložiti na naslednji seja z ta da biti najprej imeti na dneven red zakon o lastninjenje potem pa ta dva zakon kar biti biti nekje normalen tu biti zdaj predlog da on prvič uvrstiti na dneven red seja zbor in drugič če se uvrstiti na dneven red da se voditi samo razprava jaz biti celo omeniti da biti predlagati da tudi ali voditi razprava ali ne da biti vsaj oddati ves tisti ki imeti amandma že pripravljen k ta dec zakon da on lahko dati naprej v izvršen svet in matičen deloven telo da zavzeti svoj stališče in da ne biti čakati če biti oba ostati zbor delo opravilo še na naš teoretično biti pa tako verjetno možen da biti veliko podoben amandma ker biti se dogovarjati tudi za določen amandma v okvir stranka in biti pač npr. če biti če lahko na pamet reči z ta hoteti nič prejudicirati npr. v zbor občina zaključiti razprava in z sprejemanje amandma biti tam verjetno vključen ves amandma liberalno demokratski stranka ali pa SDP ali pa mogoč tudi kmečki stranka in na tak način biti pač naš biti potem post festum o kateri biti se pač morati formalno izreči še v izvršen svet in matičen deloven telo kar biti seveda zopet potem premakniti celoten sprejemanje paket tako da biti verjetno ta kar biti gospod Zabukovec predlagati ta vmesten predlog da sprejeti da uvrstiti ta na dneven red in potem voditi razprava nič pa še ne sklepati z ta ko voditi razprava potem tudi vlagati amandma ne biti več preseči in ostati pri ta kar biti biti dogovorjen včeraj da o ta sklepati po opravljen 1. točka dneven red 11. september kaj meniti jaz meniti da biti ta nek vrsta kompromis ta biti se že pogovarjati da biti tudi politika da biti zgolj sam delitev pa grabljenje kaj meniti malo pretuhtati potem pa dati gospod Perko"
"parl.ZbZdruDel","seja",28,"1991-08-29","10:25:00","12:15:00","PerkoFranc1942",0,"ZbZdruDel.1991-08-29.s028-02.sp-128","ZbZdruDel.1991-08-29.s028-02.sp-128.2",ZbZdruDel.1991-08-29.s028-02.toc-item5,"taxonomy.3.1.4.1 taxonomy.3.6.1.2","topic.126 topic.225","ocenjevati da biti morati obravnavati ves ta trije zakon prej biti biti govor še o tisti četrti ta biti zakon o sklad o kmetijski zemljišče in gozd skupaj zakon o zadruga predvsem zaradi tisti 10. poglavje ne tisti prvi del sploh biti sporen ali problematičen ves ta trije zakon biti sistemski in izredno pomemben za nadaljni razvoj kljub ta da se dejansko muditi ali pa biti želja da se hitro sprejeti se pa ne muditi tako da on ne biti sprejemati po normalen pot če se potruditi biti v začetek oktober lahko ta zakon sprejeti kljub ta da se ta obravnava voditi zdaj bolj normalen od osnutek ki biti biti tule v skupščina pa do predlog biti doživeti velik sprememba o ta slišati poslušati ali brati vsak dan o ta zakon zdaj v javnost teči razprava v strokoven krog v gospodarstvo tudi tule v telo skupščina biti teči razprava cel vrsta amandma biti biti predložen tako da biti že ves skupaj pravzaprav nepregledno nujno biti biti potreben da na osnova dosedanji javen razprava ta strokovnjak amandma deloven telo pripraviti vladati nov osnutek in on predložiti parlament zato predlagati da ostati naš zbor pri svoj stališče tisti ki on biti včeraj sprejeti in biti tudi glasovati proti ta da danes razpravljati ampak biti za ta da ne vključiti v dneven red in da iti po normalen postopek da naslednjič vlada pripraviti osnutek in potem kot naslednji faza predlog ves ta biti lahko narejen do sredina oktober"
"parl.ZbZdruDel","seja",28,"1991-08-29","10:25:00","12:15:00","ZupancicJoze1936",1,"ZbZdruDel.1991-08-29.s028-02.sp-129","ZbZdruDel.1991-08-29.s028-02.sp-129.2",ZbZdruDel.1991-08-29.s028-02.toc-item5,"taxonomy.3.1.4.1 taxonomy.3.6.1.2","topic.126 topic.225","gospod Perko majčkeno počakati tu imeti obvestilo da priti osnutek oziroma teza ta biti videti zdaj točno kako se biti opredeliti ves ta kar biti zdaj ti tu povedati 10.9. še z stran izvršen svet tako da ta biti imeti takrat"
"parl.ZbZdruDel","seja",28,"1991-08-29","10:25:00","12:15:00","PerkoFranc1942",0,"ZbZdruDel.1991-08-29.s028-02.sp-130","ZbZdruDel.1991-08-29.s028-02.sp-130.2",ZbZdruDel.1991-08-29.s028-02.toc-item5,"taxonomy.3.1.4.1 taxonomy.3.6.1.2","topic.126 topic.225","kdo jaz lahko zagotoviti če danes dati na dneven red da ne biti priti enajsti predlog"
"parl.ZbZdruDel","seja",28,"1991-08-29","10:25:00","12:15:00","ZupancicJoze1936",1,"ZbZdruDel.1991-08-29.s028-02.sp-131","ZbZdruDel.1991-08-29.s028-02.sp-131.2",ZbZdruDel.1991-08-29.s028-02.toc-item5,"taxonomy.3.1.4.1 taxonomy.3.6.1.2","topic.126 topic.225","ne ne ne moči priti"
"parl.ZbZdruDel","seja",28,"1991-08-29","10:25:00","12:15:00","PerkoFranc1942",0,"ZbZdruDel.1991-08-29.s028-02.sp-132","ZbZdruDel.1991-08-29.s028-02.sp-132.2",ZbZdruDel.1991-08-29.s028-02.toc-item5,"taxonomy.3.1.4.1 taxonomy.3.6.1.2","topic.126 topic.225","lahko priti"
"parl.ZbZdruDel","seja",28,"1991-08-29","10:25:00","12:15:00","ZupancicJoze1936",1,"ZbZdruDel.1991-08-29.s028-02.sp-133","ZbZdruDel.1991-08-29.s028-02.sp-133.1",ZbZdruDel.1991-08-29.s028-02.toc-item5,"taxonomy.3.1.4.1 taxonomy.3.6.1.2","topic.126 topic.225","ta ne moči niti jaz ne biti dovoliti kot predlagatelj dneven red toliko nezaupanje pa verjetno le biti ostati v jaz gospod Gradišar"
"parl.ZbZdruDel","seja",28,"1991-08-29","10:25:00","12:15:00","GradisarFranc1945",0,"ZbZdruDel.1991-08-29.s028-02.sp-134","ZbZdruDel.1991-08-29.s028-02.sp-134.2",ZbZdruDel.1991-08-29.s028-02.toc-item5,"taxonomy.3.1.4.1 taxonomy.3.6.1.2","topic.126 topic.225","najprej biti povedati da se biti hoteti oglasiti prej pri oni zakon pri plača šolnik zdaj kolikor biti iz neuraden vir obveščen če biti tako jaz takoj povedati predlagatelj biti na naš zbor predlagati trifazen postopek baje pa biti na ostal dva predlagati dvofazen postopek se praviti ta debata ki biti on prej imeti petnajst ali dvajset minuta biti biti povzročen zaradi ta čuden interpretacija če imeti prav jaz demantirati ampak uradno po sistem kar se tikati klub neodvisen delegat ostajati pri včerajšnji stališče ki biti on pač povedati on biti še enkrat ponoviti se praviti umaknitev z dneven red sprejem lastninski zakon v paket vrnitev zakon o lastninjenje podjetje zaradi vsebinski sprememba v faza osnutek ta pa praktično pomeniti da naj biti tu imeti sklic za 29. seja zbor združen delo ki naj biti biti v sreda 11.9. dneven red osnutek zakon o lastninski preoblikovanje podjetje drug točka naj biti biti osnutek zakon o denacionalizacija tretji točka osnutek zakon o zadruga potem pa še ves ostal zakon podzakon ki biti vezan na ta dva glaven zakon predlagati biti da danes tako kot biti reči razprava ne opraviti da predlagatelj se pravi izvršen svet lahko ta amandma ki biti biti dosedaj dan in ki biti še daniti na ostal dva zbor upoštevati kot pripomba in jaz do naslednji seja pripraviti ta zahtevan osnutek z upoštevanje ta pripomba oziroma kot on imenovati amandma če biti tako delati kot biti sedaj interpretirati biti dobiti v en mesec mogoč v mesec in deset dan kvaliteten zakon o lastninjenje in kvaliteten zakon o vrnitev premoženje bivši lastnik in ta tako kvaliteten da biti večina se praviti 80 Slovenc v osnova zadovoljen hvala"
"parl.ZbZdruDel","seja",28,"1991-08-29","10:25:00","12:15:00","ZupancicJoze1936",1,"ZbZdruDel.1991-08-29.s028-02.sp-135","ZbZdruDel.1991-08-29.s028-02.sp-135.2",ZbZdruDel.1991-08-29.s028-02.toc-item5,"taxonomy.3.1.4.1 taxonomy.3.6.1.2","topic.126 topic.225","Franci morati ti popraviti jaz biti včeraj potem sprejeti sklep da uvrstiti ta dva zakon na naslednji seja kot biti tu biti kot predlog jaz se o osnutek ne pogovarjati več jaz biti včeraj ta izglasovati in naj biti ta tudi jasen"
"parl.ZbZdruDel","seja",28,"1991-08-29","10:25:00","12:15:00","GradisarFranc1945",0,"ZbZdruDel.1991-08-29.s028-02.sp-136","ZbZdruDel.1991-08-29.s028-02.sp-136.2",ZbZdruDel.1991-08-29.s028-02.toc-item5,"taxonomy.3.1.4.1 taxonomy.3.6.1.2","topic.126 topic.225","biti pač tisti kar biti včeraj povedati danes ponoviti kar se tikati predloga osnutek"
"parl.ZbZdruDel","seja",28,"1991-08-29","10:25:00","12:15:00","ZupancicJoze1936",1,"ZbZdruDel.1991-08-29.s028-02.sp-137","ZbZdruDel.1991-08-29.s028-02.sp-137.2",ZbZdruDel.1991-08-29.s028-02.toc-item5,"taxonomy.3.1.4.1 taxonomy.3.6.1.2","topic.126 topic.225","ja nič hud samo toliko da ne biti biti nesporazum prositi gospod Šter še prej"
"parl.ZbZdruDel","seja",28,"1991-08-29","10:25:00","12:15:00","SterAndrej1958",0,"ZbZdruDel.1991-08-29.s028-02.sp-138","ZbZdruDel.1991-08-29.s028-02.sp-138.2",ZbZdruDel.1991-08-29.s028-02.toc-item5,"taxonomy.3.1.4.1 taxonomy.3.6.1.2","topic.126 topic.225","zdaj jaz biti rad razjasniti en dilema tale postopek ki teči z zakon o denacionalizacija in o zadruga biti normalen postopek in predlog da se ta ali vrniti v faza osnutek ali obravnavati amandma kot pripomba biti nenormalen postopek ta biti treba resnica na ljubo povedati"
"parl.ZbZdruDel","seja",28,"1991-08-29","10:25:00","12:15:00","SterAndrej1958",0,"ZbZdruDel.1991-08-29.s028-02.sp-138","ZbZdruDel.1991-08-29.s028-02.sp-138.3",ZbZdruDel.1991-08-29.s028-02.toc-item5,"taxonomy.3.1.4.1 taxonomy.3.6.1.2","topic.126 topic.225","k ta kar biti pa gospod Gradišar reči imeti pa jaz samo en pomislek če brati jaz pa imeti tukaj sklic ta seja in tudi trije listek ta pomeniti da biti predvidoma trije dan in na ta seja naj biti obravnavati zakon o gospodarski javen služba o socialen varstvo o stanovanjski zakon in o reprezentativnost sindikat mnogo in zdaj biti pa povedati razlog ki biti usklajevalen komisija voditi k rešitev ki on biti predlagati tale zakonodaja biti iti ali po pot kot da biti požirati kremenec da se malo slikovito izraziti torej zelo težko skozi skupščina če ne priti do približevanje stališče in odpreti razprava o predlog z izrecen sklep da razprava danes ne zapirati ta biti tudi gospod Zabukovec povedati zame pomeniti pot k približevanje stališče naj se stališče vsaj konfrontirati"
"parl.ZbZdruDel","seja",28,"1991-08-29","10:25:00","12:15:00","SterAndrej1958",0,"ZbZdruDel.1991-08-29.s028-02.sp-138","ZbZdruDel.1991-08-29.s028-02.sp-138.4",ZbZdruDel.1991-08-29.s028-02.toc-item5,"taxonomy.3.1.4.1 taxonomy.3.6.1.2","topic.126 topic.225","biti nujen da pasti odločitev kmalu ampak pasti biti morati razen seveda če biti spet pri tisti paradoks o želva in zajec"
"parl.ZbZdruDel","seja",28,"1991-08-29","10:25:00","12:15:00","ZupancicJoze1936",1,"ZbZdruDel.1991-08-29.s028-02.sp-139","ZbZdruDel.1991-08-29.s028-02.sp-139.2",ZbZdruDel.1991-08-29.s028-02.toc-item5,"taxonomy.3.1.4.1 taxonomy.3.6.1.2","topic.126 topic.225","hvala gospod Arzenšek"
"parl.ZbZdruDel","seja",28,"1991-08-29","10:25:00","12:15:00","ArzensekJoze1942",0,"ZbZdruDel.1991-08-29.s028-02.sp-140","ZbZdruDel.1991-08-29.s028-02.sp-140.2",ZbZdruDel.1991-08-29.s028-02.toc-item5,"taxonomy.3.1.4.1 taxonomy.3.6.1.2","topic.126 topic.225","spoštovan predsedstvo spoštovan zbor kar pogrešati biti da se ne biti nič oglasiti v dva dan pa biti reči da biti se zdaj"
"parl.ZbZdruDel","seja",28,"1991-08-29","10:25:00","12:15:00","ArzensekJoze1942",0,"ZbZdruDel.1991-08-29.s028-02.sp-140","ZbZdruDel.1991-08-29.s028-02.sp-140.3",ZbZdruDel.1991-08-29.s028-02.toc-item5,"taxonomy.3.1.4.1 taxonomy.3.6.1.2","topic.126 topic.225","morati reči dva trije stvar da biti se lahko odločiti pri glasovanje o ta ali se ta uvrstiti ali ne v karšnikol oblika tudi o ta kakor biti predlagati spoštovan kolega Zabukovec vprašati biti trije štirje stvar pogledati po moj skromen presoja biti ta zakonodaja en od pomemben ali pa če ne pomemben v ta naš faza poleg ustava pa biti vprašati biti dobiti včeraj vtis da biti jaz kdo odgovoriti na ta ali biti ta zakon kakorkoli vezan na ustava in če biti sestaven del vsebina v ustava tudi lastnina poleg ta človek itd. potem biti vprašati ali ne prejudicirati stvar ta se praviti da potem spraševati da delati po dosedanji ustava nov zakonodaja ta biti prvi stvar res biti rad vprašati in ta ne zelonamerno pošteno in pameten"
"parl.ZbZdruDel","seja",28,"1991-08-29","10:25:00","12:15:00","ArzensekJoze1942",0,"ZbZdruDel.1991-08-29.s028-02.sp-140","ZbZdruDel.1991-08-29.s028-02.sp-140.4",ZbZdruDel.1991-08-29.s028-02.toc-item5,"taxonomy.3.1.4.1 taxonomy.3.6.1.2","topic.126 topic.225","drug stvar ko biti dobiti delegatov poročevalec ali kako se ta imenovati čeprav še tule pisati pa biti imeti predlog da se ta spremeniti ker pisati poročevalec skupščina republika Slovenija in skupščina SFRJ biti dati predlog da se ta spodnji del črta ker biti biti kar skupščina republika Slovenija ta dati vmes kot predlog pa biti ta dati tudi potem pod pobuda vprašati tale pogledati jaz biti se predstavljati čisto logično prvi zakon biti privatizacija pa pisati predlog zakon o lastninski preoblikovanje potem pa denacionalizacija zadruga itn. ta pomeniti da biti le tisti ki biti tale napisati tudi po ta nekako takrat ko se biti odločiti da ta objaviti smiselno ravnati včeraj na danes ko biti zvedeti naj biti ostati tu pa biti se malo bolj podrobno ker se na ta kaj veliko ne razumeti pogledati predlog zakon o denacionalizacija in o zadruga no in danes vmes ko biti obravnavati tudi o predlog ali kaj biti že oz. predloga zakon za izdaja zakon o ta sklad in reči tam videti da se praktično ves ozirati in pa omenjati večkrat zakon o lastninski preoblikovanje podjetje"
"parl.ZbZdruDel","seja",28,"1991-08-29","10:25:00","12:15:00","ArzensekJoze1942",0,"ZbZdruDel.1991-08-29.s028-02.sp-140","ZbZdruDel.1991-08-29.s028-02.sp-140.5",ZbZdruDel.1991-08-29.s028-02.toc-item5,"taxonomy.3.1.4.1 taxonomy.3.6.1.2","topic.126 topic.225","jaz ta sploh biti nekako jasen pa biti vprašati IS ker včeraj ta odgovor biti biti vedeti pa iz izkušnja kako delati kaj on biti navesti na ta da biti dati ta dva zakon najprej in zakaj danes ne obravnavati lastninski zakon predlog zakon pa potem prihodnjič on dva ker jaz biti nelogičen in kdor pravilno in zdravo razmišljati neobremenjen z čimerkolo biti morati ta isti vprašati in se jaz zdeti prav smešno da imeti sam se za norec jaz misliti da jaz imeti nekdo za norec če se biti pa slučajno zmotiti pa naj ta priznati in naj sam ta popraviti ob ta morati takole reči od osnutek zakon do zdaj biti miniti 6 mesec in jaz ti morati reči da se jaz zdeti skrajno neresno da nihče od jaz ne vprašati ali biti lahko da biti miniti 6 mesec jaz upoštevati vojen agresija ampak ta biti biti junij in upoštevati tudi ta da takrat biti biti razlog in čas da biti se z ta ukvarjati da pa biti pospešen tempo biti po ta kaj pa biti biti pred ta pa ne vedeti in morati se priznati da se menjati tudi določen vsebinski koncept pa ne biti nič prejudicirati če biti reči da se lahko o ta predlog pogovarjati samo najprej o lastninski zakon"
"parl.ZbZdruDel","seja",28,"1991-08-29","10:25:00","12:15:00","ArzensekJoze1942",0,"ZbZdruDel.1991-08-29.s028-02.sp-140","ZbZdruDel.1991-08-29.s028-02.sp-140.6",ZbZdruDel.1991-08-29.s028-02.toc-item5,"taxonomy.3.1.4.1 taxonomy.3.6.1.2","topic.126 topic.225","jaz drugače ta ne moči razumeti in včeraj z stran predstavnik IS biti biti niti en odgovor misliti da se on pa jaz zaslužiti in on lahko tudi zahtevati ne pa da biti jaz volilen organ glasovalen stroj za ta da biti nekdo lahko delati kar biti hoteti mena ne zanimati drug vsebina ker biti z nič obremenjen samo vprašati biti pa dejansko ta ker če biti kdo operativa ta kar morati biti IS potem morati dati najprej ta lastninski zakon da ne govoriti o ta da biti delež ki on obravnavati in zajemati zakon o lastninski preoblikovanje podjetje da biti tam 90 tisti o kar se sploh ne pogovarjati in spoštovan kolega ki ti iskreno ceniti biti dejansko vprašati dati se vprašati po vsebina rad biti imeti odgovor da biti se lahko odločiti predstavnikov IS kako in kaj o ta zakaj pa ne biti enkrat postaviti vprašanje ker vedeti kaj imeti občutek da biti zdaj izpasti glede na ta da biti nekateri poslanec kdorkoli se že zdaj kriviti da biti pač pol mesec kasno ta zakon"
"parl.ZbZdruDel","seja",28,"1991-08-29","10:25:00","12:15:00","ArzensekJoze1942",0,"ZbZdruDel.1991-08-29.s028-02.sp-140","ZbZdruDel.1991-08-29.s028-02.sp-140.7",ZbZdruDel.1991-08-29.s028-02.toc-item5,"taxonomy.3.1.4.1 taxonomy.3.6.1.2","topic.126 topic.225","jaz biti pa vprašati ali lahko postaviti krivda in odgovornost IS zakaj on biti dati prej na svetlo in pogledati vmes jaz misliti da biti treba rešpektirati tisti ki se na ta posebej spoznati reči brati ves sorta in ko biti ta prebrati morati reči da zakon biti ne po en ne po drug ne po tretji ne po četrti in ko tam pisati teoretik ne vedeti če se ta lahko sprovesti v praksa in če biti ta tako biti za ta da se ta čimprej urediti samo vsebinsko da se ne biti kasno soočati pa se posuti sam z pepel ampak krivec biti pa poslanec v skupščina ja malo biti on polomiti prehitro biti odločati zdaj biti pa popraviti ker tisti praksa da zakon ki on sprejeti reči npr. februar pa on potem menjati maj morati reči ta se ne smeti zgoditi ta biti tako vsebinski zakon da biti pisan na vrsta leto in verjeti jaz da imeti prav biti pa v nič zlonameren upoštevati ves kategorija in prizadet in drug in zanimati jaz le vsebina in če kateri zakonodaja morati biti skrajno po možnost kvaliteten biti ta ta hvala lep"
