"orgId","type of session","number","date","notBefore","notAfter","persId","chairman","spId","uId","titleId","taxonomyIds","topicIds","lemmata"
"parl.ZbZdruDel","seja",28,"1991-08-29","14:10:00","16:45:00","ZupancicJoze1936",1,"ZbZdruDel.1991-08-29.s028-02.sp-173","ZbZdruDel.1991-08-29.s028-02.sp-173.30",ZbZdruDel.1991-08-29.s028-02.toc-item6,"taxonomy.3.9.5.3.3","topic.417","status in pravica po ta zakon se zagotavljati ob izpolnjevanje v zakon predpisan pogoj tudi oseba in družinski član oseba iz 1. in 4. člen ta zakon ki biti postati žrtev zaradi sovražen delovanje JLA v republika Slovenija v leto 1991 v čas pred 27.6.1991 in po 18.7.1991. sedanji 12. člen postati 13. člen ta biti amandma IS"
"parl.ZbZdruDel","seja",28,"1991-08-29","14:10:00","16:45:00","ZupancicJoze1936",1,"ZbZdruDel.1991-08-29.s028-02.sp-173","ZbZdruDel.1991-08-29.s028-02.sp-173.31",ZbZdruDel.1991-08-29.s028-02.toc-item6,"taxonomy.3.9.5.3.3","topic.417","kdo biti za ta amandma ki biti tudi urediti amandma Anka Ostermanov"
"parl.ZbZdruDel","seja",28,"1991-08-29","14:10:00","16:45:00","ZupancicJoze1936",1,"ZbZdruDel.1991-08-29.s028-02.sp-173","ZbZdruDel.1991-08-29.s028-02.sp-173.33",ZbZdruDel.1991-08-29.s028-02.toc-item6,"taxonomy.3.9.5.3.3","topic.417","proti"
"parl.ZbZdruDel","seja",28,"1991-08-29","14:10:00","16:45:00","ZupancicJoze1936",1,"ZbZdruDel.1991-08-29.s028-02.sp-173","ZbZdruDel.1991-08-29.s028-02.sp-173.35",ZbZdruDel.1991-08-29.s028-02.toc-item6,"taxonomy.3.9.5.3.3","topic.417","vzdržan"
"parl.ZbZdruDel","seja",28,"1991-08-29","14:10:00","16:45:00","ZupancicJoze1936",1,"ZbZdruDel.1991-08-29.s028-02.sp-173","ZbZdruDel.1991-08-29.s028-02.sp-173.37",ZbZdruDel.1991-08-29.s028-02.toc-item6,"taxonomy.3.9.5.3.3","topic.417","ugotavljati da biti tudi ta amandma v naš zbor sprejeti ta biti pa tudi ves amandma ki biti biti vložen z ta da biti Anka Osterman svoj amandma lahko umakniti sedaj pa še zakon v celota skupaj z amandma"
"parl.ZbZdruDel","seja",28,"1991-08-29","14:10:00","16:45:00","ZupancicJoze1936",1,"ZbZdruDel.1991-08-29.s028-02.sp-173","ZbZdruDel.1991-08-29.s028-02.sp-173.38",ZbZdruDel.1991-08-29.s028-02.toc-item6,"taxonomy.3.9.5.3.3","topic.417","kdo biti za sprejem zakon skupaj z amandma"
"parl.ZbZdruDel","seja",28,"1991-08-29","14:10:00","16:45:00","ZupancicJoze1936",1,"ZbZdruDel.1991-08-29.s028-02.sp-173","ZbZdruDel.1991-08-29.s028-02.sp-173.40",ZbZdruDel.1991-08-29.s028-02.toc-item6,"taxonomy.3.9.5.3.3","topic.417","proti"
"parl.ZbZdruDel","seja",28,"1991-08-29","14:10:00","16:45:00","ZupancicJoze1936",1,"ZbZdruDel.1991-08-29.s028-02.sp-173","ZbZdruDel.1991-08-29.s028-02.sp-173.42",ZbZdruDel.1991-08-29.s028-02.toc-item6,"taxonomy.3.9.5.3.3","topic.417","vzdržan"
"parl.ZbZdruDel","seja",28,"1991-08-29","14:10:00","16:45:00","ZupancicJoze1936",1,"ZbZdruDel.1991-08-29.s028-02.sp-173","ZbZdruDel.1991-08-29.s028-02.sp-173.44",ZbZdruDel.1991-08-29.s028-02.toc-item6,"taxonomy.3.9.5.3.3","topic.417","ugotavljati da biti zbor predlog zakon z amandma sprejeti soglasno ta točka biti zaključen predlagati biti zdaj mogoč tako da sprejeti sklep da zbor umakniti iz dneven red točka obravnavati agresija na republika Hrvaška in nudenje pomoč republika Hrvaška ker biti ta obravnavati že včeraj ampak tudi ta morati formalno napraviti"
"parl.ZbZdruDel","seja",28,"1991-08-29","14:10:00","16:45:00","ZupancicJoze1936",1,"ZbZdruDel.1991-08-29.s028-02.sp-173","ZbZdruDel.1991-08-29.s028-02.sp-173.45",ZbZdruDel.1991-08-29.s028-02.toc-item6,"taxonomy.3.9.5.3.3","topic.417","kdo biti za umik ta točka"
"parl.ZbZdruDel","seja",28,"1991-08-29","14:10:00","16:45:00","ZupancicJoze1936",1,"ZbZdruDel.1991-08-29.s028-02.sp-173","ZbZdruDel.1991-08-29.s028-02.sp-173.47",ZbZdruDel.1991-08-29.s028-02.toc-item6,"taxonomy.3.9.5.3.3","topic.417","proti"
"parl.ZbZdruDel","seja",28,"1991-08-29","14:10:00","16:45:00","ZupancicJoze1936",1,"ZbZdruDel.1991-08-29.s028-02.sp-173","ZbZdruDel.1991-08-29.s028-02.sp-173.49",ZbZdruDel.1991-08-29.s028-02.toc-item6,"taxonomy.3.9.5.3.3","topic.417","vzdržan"
"parl.ZbZdruDel","seja",28,"1991-08-29","14:10:00","16:45:00","ZupancicJoze1936",1,"ZbZdruDel.1991-08-29.s028-02.sp-173","ZbZdruDel.1991-08-29.s028-02.sp-173.51",ZbZdruDel.1991-08-29.s028-02.toc-item6,"taxonomy.3.9.5.3.3","topic.417","ugotavljati da biti umakniti predzadnji točka dneven red"
"parl.ZbZdruDel","seja",28,"1991-08-29","14:10:00","16:45:00","ZupancicJoze1936",1,"ZbZdruDel.1991-08-29.s028-02.sp-173","ZbZdruDel.1991-08-29.s028-02.sp-173.52",ZbZdruDel.1991-08-29.s028-02.toc-item7,"taxonomy.3.10.1.3","topic.442","sedaj biti pa še obravnavati predlog za izdaja zakon o sklad kmetijski zemljišče in gozd republika Slovenija oprostiti jaz biti raje da imeti še voda prej in sicer predlog za izdaja zakon o sprememba i n dopolnitev zakon o voda z predlog zakon"
"parl.ZbZdruDel","seja",28,"1991-08-29","14:10:00","16:45:00","ZupancicJoze1936",1,"ZbZdruDel.1991-08-29.s028-02.sp-173","ZbZdruDel.1991-08-29.s028-02.sp-173.53",ZbZdruDel.1991-08-29.s028-02.toc-item7,"taxonomy.3.10.1.3","topic.442","predlog za izdaja zakon z predlog zakon biti v obravnava predložiti IS skupščina republika Slovenija objavljen biti biti tudi v poročevalec št. 21. predlog za izdaja zakon z predlog zakon biti obravnavati zakonodajno-pravn komisija ter odbor za pravosodje in uprava in odbor zato predlagati zbor skupščina republika Slovenija da predlagan zakon tudi sprejeti medtem ko imeti zakonodajno-praven komisija kratek amandma ki biti pa predvsem redakcijski značaj želeti mogoče predstavnica IS v zveza z amandma prositi"
"parl.ZbZdruDel","seja",28,"1991-08-29","14:10:00","16:45:00","KovacicAdriana",0,"ZbZdruDel.1991-08-29.s028-02.sp-174","ZbZdruDel.1991-08-29.s028-02.sp-174.2",ZbZdruDel.1991-08-29.s028-02.toc-item7,"taxonomy.3.10.1.3","topic.442","spoštovan poslanka spoštovan poslanec ves dobro vedeti kaj jaz voda v vsakdanji življenje pomeniti prav tako biti ves znan kako zelo biti onesnažen vedeti pa tudi da biti eden izmed način preprečevanje tak onesnaževanje predpisovanje denaren kazen za vsakršen kršitev zakon o voda"
"parl.ZbZdruDel","seja",28,"1991-08-29","14:10:00","16:45:00","KovacicAdriana",0,"ZbZdruDel.1991-08-29.s028-02.sp-174","ZbZdruDel.1991-08-29.s028-02.sp-174.3",ZbZdruDel.1991-08-29.s028-02.toc-item7,"taxonomy.3.10.1.3","topic.442","osnoven namen predložen zakon in njegov uskladitev z obstoječ sistemski predpis tako zakon o gospodarski postopek kakor zakon o prekršek tu iti za valorizacija oz. dvig dosedanji predpisan kazen ki biti po veljaven zakonodaja kar smešno nizek kar izhajati iz dejstvo da biti biti večinoma ta nespremenjen že od 1986. za ilustracija lahko povedati da biti trenutno visoko predviden denaren kazen za povzročitev nenaden onesnaževanje voda kakor tudi za obratovanje brezvoden gospodarski dovoljenje za podjetje le 1.000 dinar za odgovoren praven oseba pa 50 din zato poudarjati da biti takojšen sprejem omenjen zakon nujen saj biti na ta način nadoknaditi zamujen ter kvalitetativno vplivati na kaznovalen politika na področje voda z nov zakon biti določen nizek možen denaren kazen ki glede na dosedanji ureditev ostajati nekje nespremenjen drugje pa se povečati od dva od tisočkrat visok možen kazen biti konkretno določen pač pa se po splošen praven načelo kot poseben maksumum uporabljati splošen Maksim ki biti trenutno za gospodarski prestopek 450.000 dinar za prekršek pa 500.000 dinar predlagan zakon zapolnjevati nekateri praven vrzel ki biti se pojaviti v praksa saj biti nekateri normativno določen ravnanje ostati nekaznovan z novela zakon se uvajati tudi kaznovanje odgovoren oseba praven oseba za prekršek kar biti biti do sedaj neopravičen obrtnik biti kot storilec prekršek odslej enako kaznovan kakor podjetje oz. drug praven oseba glede na pripomba ki on biti podati zakonodajno-praven komisija ki biti redakcijski narava misliti da biti popolnoma upravičen"
"parl.ZbZdruDel","seja",28,"1991-08-29","14:10:00","16:45:00","ZupancicJoze1936",1,"ZbZdruDel.1991-08-29.s028-02.sp-175","ZbZdruDel.1991-08-29.s028-02.sp-175.2",ZbZdruDel.1991-08-29.s028-02.toc-item7,"taxonomy.3.10.1.3","topic.442","želeti kdo razpravljati jaz biti se domeniti da imeti zakon kot predlog"
"parl.ZbZdruDel","seja",28,"1991-08-29","14:10:00","16:45:00","KrajecMirko1954",0,"ZbZdruDel.1991-08-29.s028-02.sp-176","ZbZdruDel.1991-08-29.s028-02.sp-176.2",ZbZdruDel.1991-08-29.s028-02.toc-item7,"taxonomy.3.10.1.3","topic.442","jaz se zdeti tukaj nekaj povsem pomemben ker vedeti kako biti dosedaj reševati ta stvar se praviti plačevati biti kazen raje kakor da biti kašen gospodarski objekt iti renovirati oz. on sanirati zato se jaz tak zakon ki on sprejemati na tak način zdeti neživljenjski in biti reči čisto tako policaj naj ti ustaviti na cesta in reči da imeti luč a imeti kje kupiti žarnica k vrag tak država če ti ne moči zagotoviti žarnica znati pa predpisati visok kazen zato biti jaz reči da za tisti kazen ki biti tam po 100.000 din da se na nivo komite za razvoj v posamezen občina odrediti seveda skupina ker za tak denar se le morati nekaj najti odgovornost in da poskusiti pripraviti gospodarski oziroma sanacijski načrt za kaznovan objekt in na ta način potem odrejati ali se ta splačati ali ne takrat biti videti kaj biti prav in kaj biti prav kar videti da biti v slovenski prostor nekateri stvar postaviti ob zid in ne vedeti kdo biti danes pripravljen iz svoj žep nekaj plačati iti biti delavec na cesta ker se biti morati objekt zapirati itn. se praviti dati ta zakon pripraviti da biti vsebovati tudi ta člen da se za tisti kazen ki biti tam od 100.000 dinar napraviti sanacijski načrt in da se potem videti ali biti ta sanacija upravičen ali biti ne pa samo odrejati in delati nemogoč stvar ki zopet ne biti mogoč hvala"
"parl.ZbZdruDel","seja",28,"1991-08-29","14:10:00","16:45:00","KovacicAdriana",0,"ZbZdruDel.1991-08-29.s028-02.sp-177","ZbZdruDel.1991-08-29.s028-02.sp-177.2",ZbZdruDel.1991-08-29.s028-02.toc-item7,"taxonomy.3.10.1.3","topic.442","morati povedati da biti ta zakon ki on trenutno sprejemati mašilo biti samo dvig tisti kazen ki biti kakor biti ti povedati zelo nizek uskladitev z obstoječ kazen ki veljati za ves drug področje pripravljati pa na naš ministrstvo mogoč že vedeti celovit zakon o varstvo okolje ki naj biti globalno urejati celoten področje urejanje varstvo okolje torej ne samo voda tudi zrak tudi tla ves skupaj ves ta biti tam tudi urejen poleg ta pripravljati tudi nov zakon o voda ki naj biti biti predvidoma že lanski leto na tapeta vendar vedeti da se biti ves skupaj zavleči zato biti v tisti nov zakon o voda dosti širok razprava teči o ta stvar biti drugače postavljen in mogoče se biti tam tudi ta vprašanje reševati hvala lep"
"parl.ZbZdruDel","seja",28,"1991-08-29","14:10:00","16:45:00","ZupancicJoze1936",1,"ZbZdruDel.1991-08-29.s028-02.sp-178","ZbZdruDel.1991-08-29.s028-02.sp-178.2",ZbZdruDel.1991-08-29.s028-02.toc-item7,"taxonomy.3.10.1.3","topic.442","če biti več razprava biti on zaključiti in predlagati naslednji ker biti amandma da glasovati o zakon v celota skupaj z redakcijski pripomba ki on ZPK z kateri pa se IS tudi strinjati prisotnost"
"parl.ZbZdruDel","seja",28,"1991-08-29","14:10:00","16:45:00","ZupancicJoze1936",1,"ZbZdruDel.1991-08-29.s028-02.sp-178","ZbZdruDel.1991-08-29.s028-02.sp-178.4",ZbZdruDel.1991-08-29.s028-02.toc-item7,"taxonomy.3.10.1.3","topic.442","še enkrat"
"parl.ZbZdruDel","seja",28,"1991-08-29","14:10:00","16:45:00","ZupancicJoze1936",1,"ZbZdruDel.1991-08-29.s028-02.sp-178","ZbZdruDel.1991-08-29.s028-02.sp-178.6",ZbZdruDel.1991-08-29.s028-02.toc-item7,"taxonomy.3.10.1.3","topic.442","koliko jaz biti za zakon z dopolnitev zakon o voda z amandma ki imeti redakcijski značaj"
"parl.ZbZdruDel","seja",28,"1991-08-29","14:10:00","16:45:00","ZupancicJoze1936",1,"ZbZdruDel.1991-08-29.s028-02.sp-178","ZbZdruDel.1991-08-29.s028-02.sp-178.7",ZbZdruDel.1991-08-29.s028-02.toc-item7,"taxonomy.3.10.1.3","topic.442","kdo biti za"
"parl.ZbZdruDel","seja",28,"1991-08-29","14:10:00","16:45:00","ZupancicJoze1936",1,"ZbZdruDel.1991-08-29.s028-02.sp-178","ZbZdruDel.1991-08-29.s028-02.sp-178.9",ZbZdruDel.1991-08-29.s028-02.toc-item7,"taxonomy.3.10.1.3","topic.442","proti"
"parl.ZbZdruDel","seja",28,"1991-08-29","14:10:00","16:45:00","ZupancicJoze1936",1,"ZbZdruDel.1991-08-29.s028-02.sp-178","ZbZdruDel.1991-08-29.s028-02.sp-178.11",ZbZdruDel.1991-08-29.s028-02.toc-item7,"taxonomy.3.10.1.3","topic.442","vzdržan"
"parl.ZbZdruDel","seja",28,"1991-08-29","14:10:00","16:45:00","ZupancicJoze1936",1,"ZbZdruDel.1991-08-29.s028-02.sp-178","ZbZdruDel.1991-08-29.s028-02.sp-178.13",ZbZdruDel.1991-08-29.s028-02.toc-item7,"taxonomy.3.10.1.3","topic.442","zakon biti z večina glas z redakcijski amandma sprejet"
"parl.ZbZdruDel","seja",28,"1991-08-29","14:10:00","16:45:00","ZupancicJoze1936",1,"ZbZdruDel.1991-08-29.s028-02.sp-178","ZbZdruDel.1991-08-29.s028-02.sp-178.14",ZbZdruDel.1991-08-29.s028-02.toc-item8,"taxonomy.3.8.7","topic.349","sedaj pa prehajati na 4. točka dneven red t. j. predlog za izdaja zakon o sklad kmetijski zemljišče in gozd republika Slovenija"
"parl.ZbZdruDel","seja",28,"1991-08-29","14:10:00","16:45:00","ZupancicJoze1936",1,"ZbZdruDel.1991-08-29.s028-02.sp-178","ZbZdruDel.1991-08-29.s028-02.sp-178.15",ZbZdruDel.1991-08-29.s028-02.toc-item8,"taxonomy.3.8.7","topic.349","jaz biti se opredeliti za trifazen postopek in na tak način razpravljati o prvi faza predlog za izdaja zakon biti predložiti v obravnava IS skupščina republika Slovenija objavljen biti biti tudi v poročevalec št. 22. predlog za izdaja zakon biti obravnavati odbor za kmetijstvo in gozdarstvo ki biti razpravljati tudi o zemljišče ki naj biti on zadruga po zakon o denacionalizacija dati v sklad kmetijski zemljišče iz razprava biti biti razumeti da iti za neodplačan zemlja iz ta sklad naj biti se potem tudi vračati zemlja bivši lastnik član odbor biti meniti da biti biti potreben zagotoviti da biti po opravljen denacionalizacija zadruga imeti prednosten pravica do ta zemljišče v razprava biti biti tudi pripomba ki biti razviden iz poročilo ki biti on tudi sprejeti zakonodajno-praven komisija biti imeti tudi precej pripomba v celota in potem v posamezen člen in tudi ta poročilo imeti v svoj gradivo predstavnica IS g. Lippai biti povedati nekaj uvoden misel"
"parl.ZbZdruDel","seja",28,"1991-08-29","14:10:00","16:45:00","LippaiMartina",0,"ZbZdruDel.1991-08-29.s028-02.sp-179","ZbZdruDel.1991-08-29.s028-02.sp-179.2",ZbZdruDel.1991-08-29.s028-02.toc-item8,"taxonomy.3.8.7","topic.349","glede na ta da biti že ob dneven red nekateri stvar pravzaprav o vsebina tudi spregovoriti biti jaz želeti v ta uvoden beseda v bistvo poudariti samo nekateri stvar glede na opozorilo zakonodajno-praven komisija da biti vprašljiv tudi ustaven podlaga za tak zakon biti jaz ponovno preveriti ustaven podlaga in ugotoviti da ves tisti ustaven podlaga ki biti v predlog za izdaja zakon naveden tudi držati poleg ta ustaven podlaga biti podan tudi v amandma 99. k ustava republika Slovenija in sicer v drug odstavek prvi točka in v tretji točka po kateri se razveljavljati ves določba ustava republika Slovenija ki biti določati lastninski maksimum na kmetijski in gozden zeljiščiha in v kateri biti dan tudi podlagati da se z zakon urejati preoblikovanje družben lastnina v javen in drug oblika lastnina ter lastninski omejitev en od vrsta javen lastnina biti tudi državen lastnina torej meniti da biti ustaven podlaga podan"
"parl.ZbZdruDel","seja",28,"1991-08-29","14:10:00","16:45:00","LippaiMartina",0,"ZbZdruDel.1991-08-29.s028-02.sp-179","ZbZdruDel.1991-08-29.s028-02.sp-179.3",ZbZdruDel.1991-08-29.s028-02.toc-item8,"taxonomy.3.8.7","topic.349","razlog ki biti jaz navajati k takšen zakon biti tudi naveden v predlog za izdaja zakon v predlog zakon o denacionalizacija v predlog zakon o zadruga in predlog zakon o lastninski preoblikovanje podjetje biti že omenjen sklad kmetijski zemljišče in gozd kot tisti upravljalec kmetijski zemljišče v ime in za račun republika Slovenija ki biti potem zadolžen poskrbeti za vračilo zemljišče prejšnji lastnik na podlaga pravnomočen odločba v sklad z zakon o denacionalizacija torej po iztek ves tisti rok ki biti predviden za vračilo zemljišče v narava obenem pa biti iz sredstvo ki biti se v ta sklad natekati iz promet z kmetijski zemljišče in iz drug vir zagotavljati tudi sredstvo za odškodnina za tisti prejšnji lastnik ki on zemljišče v narava ali gozd v narava ne biti moči biti vrnjen oz. on ne biti želeti"
"parl.ZbZdruDel","seja",28,"1991-08-29","14:10:00","16:45:00","LippaiMartina",0,"ZbZdruDel.1991-08-29.s028-02.sp-179","ZbZdruDel.1991-08-29.s028-02.sp-179.4",ZbZdruDel.1991-08-29.s028-02.toc-item8,"taxonomy.3.8.7","topic.349","v prvi del se ta zakon pravzaprav nanašati zgolj na ustanovitev sklad za kateri biti veljati predpis o javen zavod urejati se organ sklad in naloga sklad v prehoden določba biti za prehoden obdobje torej do izvršitev ves denacionalizacijski odločba še poseben naloga sklad naveden torej izvajanje ves ta določba sodelovanje z prejšnji lastnik in z drug organ ki biti v ves ta postopek sodelovati in delovati predviden pa biti tudi podržavljanje ves kmetijski zemljišče in gozd in tudi premoženje bivši kmetijski zemljiški skupnost ki on imeti sedaj občina v upravljanje kot praven začasen naslednica praven naslednica pravzaprav kmetijski zemljiški skupnost k ta podržavljanje kot biti že prej povedati jaz biti v bistvo voditi več razlog zagotoviti enotno usklajen upravljanje z kmetijski zemljišče in z gozd in z sredstvo ki se biti iz ta vir natekati in se namensko porabljati za namen po ta zakon preprečiti olastninjenje skozi lastništvo podjetje tudi na zemljišče in gozd z stran zlasti tujec potem izvedba uspešen izvedba do nacionalizacija in enoten politika kar se tikati kmetijski zemljišče in gozd torej ta biti biti razlog ki biti jaz voditi k tak predlog"
"parl.ZbZdruDel","seja",28,"1991-08-29","14:10:00","16:45:00","LippaiMartina",0,"ZbZdruDel.1991-08-29.s028-02.sp-179","ZbZdruDel.1991-08-29.s028-02.sp-179.5",ZbZdruDel.1991-08-29.s028-02.toc-item8,"taxonomy.3.8.7","topic.349","z ta pa če se zemljišče podržavljati in prenesti v ta sklad sedanji obdelovalec tisti ki dejansko obdelovati ta zemljišče ne biti biti z nič v bistvo prizadeti ker on pravica do obdelava ostati v sklad z predpis o denacionalizacija toliko čas dokler pač ne biti treba tisti zemljišče predati oz. dokler v kolikor se biti sporazumeti z prejšnji lastnik če biti se za dolg ali kratek obdobje sporazumeti poleg ta kako biti pa kriterij za pridobivanje ta zemljišče kasno biti pa določati zakon o kmetijski zemljišče ki on tudi pripravljati vendar glede na obsežen zakonodajen program ki on imeti ta skupščina in IS biti nemogoč ves zakon hkrati imeti pripravljen in on hkrati predlagati v obravnava tako da se iz ta zakon dejansko ne videti usoda po kakšen kriterij kako biti ta zemljišče kdo biti potem kasno dodeljevana kdo biti imeti prednost do nakup kdo biti imeti v zakon o kmetijski zemljišče pri kar pa biti stremeti za ta da biti dejansko dobiti zemljišče v obdelava tisti ki biti dokazati pravzaprav tako strokoven usposobljenost in pa siceršnji možnost materialen in drug da biti ta zemljišče res obdelan v sklad z njihov namen"
"parl.ZbZdruDel","seja",28,"1991-08-29","14:10:00","16:45:00","LippaiMartina",0,"ZbZdruDel.1991-08-29.s028-02.sp-179","ZbZdruDel.1991-08-29.s028-02.sp-179.6",ZbZdruDel.1991-08-29.s028-02.toc-item8,"taxonomy.3.8.7","topic.349","glede na ta pač predlagati da predlog za izdaja zakon sprejeti jaz biti pa pripomba ki biti pač dan na ves ta podrobno proučiti in pripraviti osnutek zakon hvala lep"
"parl.ZbZdruDel","seja",28,"1991-08-29","14:10:00","16:45:00","ZupancicJoze1936",1,"ZbZdruDel.1991-08-29.s028-02.sp-180","ZbZdruDel.1991-08-29.s028-02.sp-180.2",ZbZdruDel.1991-08-29.s028-02.toc-item8,"taxonomy.3.8.7","topic.349","hvala lep slišati biti jaz biti predlagati da upoštevati tudi ves 8 razpravljalec pri ta točka ko biti razpravljati o dneven red in biti biti tudi vsebinsko naravnan tako da biti nekaj že biti takrat opravljen tako da ne biti biti tisti čisto zaman prositi gospod krajec"
"parl.ZbZdruDel","seja",28,"1991-08-29","14:10:00","16:45:00","KrajecMirko1954",0,"ZbZdruDel.1991-08-29.s028-02.sp-181","ZbZdruDel.1991-08-29.s028-02.sp-181.2",ZbZdruDel.1991-08-29.s028-02.toc-item8,"taxonomy.3.8.7","topic.349","no kljub uvod biti moči mogoče še kakšen stvar pojasniti namreč ta zakon podpirati iz en razlog ker želeti da biti potem iz ta stanje v kakršen se biti najdla ta imovina lahko skladno razvijati zemljiški fond in tako kmetijstvo v Slovenija samo ne vedeti rad biti še en obrazložitev tukaj po kateri zakon se biti potem lahko vzdrževati ta kmetija lahko povečevati itn. ali biti vsebovati ta ta zakon ali biti kaj drug še"
"parl.ZbZdruDel","seja",28,"1991-08-29","14:10:00","16:45:00","KrajecMirko1954",0,"ZbZdruDel.1991-08-29.s028-02.sp-181","ZbZdruDel.1991-08-29.s028-02.sp-181.3",ZbZdruDel.1991-08-29.s028-02.toc-item8,"taxonomy.3.8.7","topic.349","2. tukaj se razvijati dilema že celiti 6 mesec ali gozd republiški ali gozd občinski seveda jaz biti razumljivo zaradi skladen razvoj da se ta podržaviti vendar misliti da biti moči dati ta zakon potem v predlog malo bolj točen opredelitev kaj republika zahtevati od ta gozd in zemljišče kakšen davek ali kakšen drug zadeva na vsak način pa biti želeti da ta gozd potem materialno vplivati na dohodek občina kajti ne moči se dovoliti ta kar se biti 40 leto dogajati na Kočevsko da če biti z vsak kamion samo en hlod dol pasti biti biti ves cesta lahko v Kočevje asfaltiran danes imeti nič in tudi imeti od kdo kaj zahtevati industrija propad gozd biti dati v republika človek ki tam živeti na ta območje biti ostati velik delavec misliti najbolj siromašen delavec tisti ki delati z cepin in motorka"
"parl.ZbZdruDel","seja",28,"1991-08-29","14:10:00","16:45:00","KrajecMirko1954",0,"ZbZdruDel.1991-08-29.s028-02.sp-181","ZbZdruDel.1991-08-29.s028-02.sp-181.4",ZbZdruDel.1991-08-29.s028-02.toc-item8,"taxonomy.3.8.7","topic.349","misliti da biti jaz razumeti biti povedati ta v drug oblika tisti občina ki imeti v zaseben last gozd se praviti biti ta last njihov občan in on potem razpolagati z ta les biti preko zadruga ali preko GG ali kakorkoli ta les odprodajati skrbeti za gozd itn. se praviti ves ta dohodek biti ostati v občina kako se biti ta delati z nacionalen gozd misliti ta biti en zelo veliko in zelo kompleksen vprašanje za kateri biti rad videti da biti v predlog zakon izvršen svet ta opredelitev nakazati kajti imeti občina ki imeti 85 gozd v družben last imeti pa samo tisti ki imeti 5 ali skoraj nič tukaj biti morati zavzeti bolj skladen razvoj npr. takole človek ki živeti ob morje živeti od morje ta on pripadati ne vedeti od koprski občina imeti dosti kaj v Kočevje kot samo tisti riba se praviti ta dohodek se tam prelivati itn. on on voziti okrog tukaj biti treba ta definirati drugače pa zakon kot celota podpirati hvala"
"parl.ZbZdruDel","seja",28,"1991-08-29","14:10:00","16:45:00","ZupancicJoze1936",1,"ZbZdruDel.1991-08-29.s028-02.sp-182","ZbZdruDel.1991-08-29.s028-02.sp-182.2",ZbZdruDel.1991-08-29.s028-02.toc-item8,"taxonomy.3.8.7","topic.349","hvala gospod Perko"
"parl.ZbZdruDel","seja",28,"1991-08-29","14:10:00","16:45:00","PerkoFranc1942",0,"ZbZdruDel.1991-08-29.s028-02.sp-183","ZbZdruDel.1991-08-29.s028-02.sp-183.2",ZbZdruDel.1991-08-29.s028-02.toc-item8,"taxonomy.3.8.7","topic.349","hvala lep v osnova podpirati predlog za izdaja zakon o sklad ta zemljišče imeti pa nekaj dilema ki on biti že gospa Lippai sprožiti predvsem iti za ta da se tale zakon zopet povezovati z nek zakon ki on še biti zakon o gozd biti že na pot v skupščina reči biti da pri sam gozd biti tako velik problem velik vprašanje se porajati tudi gospod Kranjec on biti navesti pri kmetijski zemljišče kjer biti pomemben del izvedba ta zakon o sklad kmetijski zemljišče prepuščen zakon o kmetijski zemljišče zato biti želeti da biti se poskušati vsaj v nek faza osnutek pripraviti tudi ta zakon o kmetijski zemljišče da biti biti že ta čas ko tale zakon sprejemati tudi že v procedura v skupščina kazati da biti biti potrebno usklajen pošiljanje ta zakon v skupščina kot biti biti že tudi pri drug danes govor"
"parl.ZbZdruDel","seja",28,"1991-08-29","14:10:00","16:45:00","PerkoFranc1942",0,"ZbZdruDel.1991-08-29.s028-02.sp-183","ZbZdruDel.1991-08-29.s028-02.sp-183.3",ZbZdruDel.1991-08-29.s028-02.toc-item8,"taxonomy.3.8.7","topic.349","pri gozd se pa postavljati nekaj vprašanje ali biti ta republiški ali občinski sam osebno se zavzemati da biti republiški z ta da biti potreben rešiti da del renta pripadati tudi občina kjer gozd ležati kjer biti praktično lahko edin naraven bogastvo seveda biti pa treba pri ta upoštevati da dobiti občina del dohodek tudi preko ta ker biti tam praviloma delati doma zaposlen človek tudi doma se biti če biti le predelava kolikor toliko racionalno organiziran les predelovati tako da biti del dohodek ostati doma misliti pa da biti biti le še potrebno del renta vključiti občina kjer ta gozd ležati seveda biti pa gozd nek nacionalen bogastvo in biti del denar zaradi ta ker biti ta gozd zelo različen po območje ali pa posamezen področje poskušati se država zadržati za izravnava da biti ta gozd tudi drugje usposobiti samo misliti da imeti gozd tak pomen da biti tisti področje ki biti na gozd reven morati tudi iz kakšen drug vir kakšen dinar zbrati v namen za tisti gozd na njihov območje ta stvar ki biti on sedaj pripovedovati verjetno ne biti možen v ta zakon rešiti ampak v nek drug zakon biti pa potrebno razrešiti ta dilema ali občinski ali republiški hvala"
