"orgId","type of session","number","date","notBefore","notAfter","persId","chairman","spId","uId","titleId","taxonomyIds","topicIds","lemmata"
"parl.DruzPolZb","seja",18,"1991-05-22","19:00:00","19:20:00","PersakAnton1947",1,"DruzPolZb.1991-05-22.s018-04.sp-208","DruzPolZb.1991-05-22.s018-04.sp-208.2",DruzPolZb.1991-05-22.s018-04.toc-item1,"taxonomy.4.3.3","topic.472","lepo prositi da biti vseeno počakati izkazati se biti da tisti vseeno držati kar biti reči v poročilo namreč ta odbor biti vseeno obravnavati naš sklep in predlog samo on biti podpreti"
"parl.DruzPolZb","seja",18,"1991-05-22","19:00:00","19:20:00","ToplakLudvik1942",1,"DruzPolZb.1991-05-22.s018-04.sp-209","DruzPolZb.1991-05-22.s018-04.sp-209.2",DruzPolZb.1991-05-22.s018-04.toc-item2,"taxonomy.3.9.1.1","topic.368","nadaljevati 18. seja družbenopolitičen zbor gospod Bojan Dolenc pomočnik republiški sekretariat za vzgoja in izobraževanje ter telesen kultura imeti beseda"
"parl.DruzPolZb","seja",18,"1991-05-22","19:00:00","19:20:00","DolencBojan",0,"DruzPolZb.1991-05-22.s018-04.sp-210","DruzPolZb.1991-05-22.s018-04.sp-210.2",DruzPolZb.1991-05-22.s018-04.toc-item2,"taxonomy.3.9.1.1","topic.368","gospod predsednik hoteti biti ti samo opozoriti spoštovan poslanec hoteti biti opozoriti oziroma dati informacija kateri biti dobiti tudi na klop da biti stavka srednješolec oziroma četrtošolec zaključen da biti biti sprejet dogovor in sicer tak kot on imeti napisan da biti zaključen izpit iz dva predmet ki biti naveden v ta pisen informacija in da biti obljubiti dijak da se biti vrniti v šola meniti da se ta točka lahko zaključiti hvala lep"
"parl.DruzPolZb","seja",18,"1991-05-22","19:00:00","19:20:00","ToplakLudvik1942",1,"DruzPolZb.1991-05-22.s018-04.sp-211","DruzPolZb.1991-05-22.s018-04.sp-211.2",DruzPolZb.1991-05-22.s018-04.toc-item2,"taxonomy.3.9.1.1","topic.368","hvala lep prositi prositi zadnjič biti biti tukaj podan različen predlog ki biti zdaj praktično brezpredmeten ali kdo vztrajati pri ta predlog prositi gospod Potrč"
"parl.DruzPolZb","seja",18,"1991-05-22","19:00:00","19:20:00","PotrcMiran1938",0,"DruzPolZb.1991-05-22.s018-04.sp-212","DruzPolZb.1991-05-22.s018-04.sp-212.2",DruzPolZb.1991-05-22.s018-04.toc-item2,"taxonomy.3.9.1.1","topic.368","jaz imeti samo en vprašanje ali biti za takšen sklep potreben kakšen formalizacija"
"parl.DruzPolZb","seja",18,"1991-05-22","19:00:00","19:20:00","PotrcMiran1938",0,"DruzPolZb.1991-05-22.s018-04.sp-212","DruzPolZb.1991-05-22.s018-04.sp-212.4",DruzPolZb.1991-05-22.s018-04.toc-item2,"taxonomy.3.9.1.1","topic.368","ne biti potreben jaz lahko samo družben predlog sklep kakor biti jaz formulirati ne saj zaradi ta ker biti biti pač različen razlaga o zakonodaja in sklicevanje izvršen svet da ne moči da samo na podlaga zakon da zakon veljati da veljati toliko in toliko leto da morati skupščina zakon spremeniti zato spraševati ali biti potreben kakšen formulizacija ali biti ponovno sprejeti nek odločitev po domače brez zamera da tako reči kar ne biti prvič in jaz ocenjevati da seveda tak velik možnost obstajati drugače biti pa reči samo ta najbrž biti biti nesmotrn da zdaj kakorkoli končno in hvala bog dosežen kompromis postavljati pod vprašaj misliti pa da biti biti vsekakor koristen da biti o ta vprašanje razpravljati v skupščina ker biti z ta vsaj prisiliti da se biti vlada odzvati na ustrezen način če biti se že zdavnaj prej potem ne biti dijak morati tako dolgo biti na cesta hvala"
"parl.DruzPolZb","seja",18,"1991-05-22","19:00:00","19:20:00","ToplakLudvik1942",1,"DruzPolZb.1991-05-22.s018-04.sp-213","DruzPolZb.1991-05-22.s018-04.sp-213.2",DruzPolZb.1991-05-22.s018-04.toc-item2,"taxonomy.3.9.1.1","topic.368","vprašanje biti še kdo razpravljati o ta točka prositi"
"parl.DruzPolZb","seja",18,"1991-05-22","19:00:00","19:20:00","VaupoticBogomir1963",0,"DruzPolZb.1991-05-22.s018-04.sp-214","DruzPolZb.1991-05-22.s018-04.sp-214.2",DruzPolZb.1991-05-22.s018-04.toc-item2,"taxonomy.3.9.1.1","topic.368","hvala lep jaz biti želeti samo še zagotovilo da biti torej ta dogovor sklenjen tudi z dijak in da se dijak strinjati z takšen odločitev glede na ta da biti biti tudi nekoliko različen predlog v zadnji čas če biti ta tako seveda biti razlog za nadaljnji razprava o ta problem vendarle biti pa poudariti da seveda biti lep da biti sklenjen kompromis ampak ta kompromis biti pač pokazati da biti vendarle biti problem tudi nekoliko drugačen narava kot se biti poskušati ves čas samo prikazati in da pravzaprav ta samo dejstvo da biti ta šolski oblast biti pripravljen popustiti od svoj zahteva oziroma od svoj načelo ki biti ves čas veljati da biti ta dijak imeti prav in seveda da biti biti problem drugačen narava kot torej pravno formalen o kar se biti ves čas govoriti in da organizacijsko zadeva vendarle biti biti tako pripravljen kot se biti trditi da biti"
"parl.DruzPolZb","seja",18,"1991-05-22","19:00:00","19:20:00","ToplakLudvik1942",1,"DruzPolZb.1991-05-22.s018-04.sp-215","DruzPolZb.1991-05-22.s018-04.sp-215.2",DruzPolZb.1991-05-22.s018-04.toc-item2,"taxonomy.3.9.1.1","topic.368","hvala gospod Viktor Žakelj"
"parl.DruzPolZb","seja",18,"1991-05-22","19:00:00","19:20:00","ToplakLudvik1942",1,"DruzPolZb.1991-05-22.s018-04.sp-216","DruzPolZb.1991-05-22.s018-04.sp-216.2",DruzPolZb.1991-05-22.s018-04.toc-item2,"taxonomy.3.9.1.1","topic.368","samo omejiti se na bistvo stvar prositi dazaključimo ta točka"
"parl.DruzPolZb","seja",18,"1991-05-22","19:00:00","19:20:00","ZakeljViktor",0,"DruzPolZb.1991-05-22.s018-04.sp-217","DruzPolZb.1991-05-22.s018-04.sp-217.2",DruzPolZb.1991-05-22.s018-04.toc-item2,"taxonomy.3.9.1.1","topic.368","ura biti pozen in jaz dovoliti športen komentar ta neljub tekma ki pa ne biti nič manj resen in ne brez pelin"
"parl.DruzPolZb","seja",18,"1991-05-22","19:00:00","19:20:00","ZakeljViktor",0,"DruzPolZb.1991-05-22.s018-04.sp-217","DruzPolZb.1991-05-22.s018-04.sp-217.3",DruzPolZb.1991-05-22.s018-04.toc-item2,"taxonomy.3.9.1.1","topic.368","izražati nezadovoljstvo z strokoven svet kot z zavod za šolstvo in ves strokoven in drug inštitucija ki biti dopustiti da biti biti potrošen toliko energija nevolja in nejevolja in ne nazadnje denar da biti priti do ta kompromis ki biti po moj sodba biti mogoč že na začetek hvala"
"parl.DruzPolZb","seja",18,"1991-05-22","19:00:00","19:20:00","ToplakLudvik1942",1,"DruzPolZb.1991-05-22.s018-04.sp-218","DruzPolZb.1991-05-22.s018-04.sp-218.2",DruzPolZb.1991-05-22.s018-04.toc-item2,"taxonomy.3.9.1.1","topic.368","prositi gospod Dular član strokoven svet za šolstvo"
"parl.DruzPolZb","seja",18,"1991-05-22","19:00:00","19:20:00","DularJanez1943",0,"DruzPolZb.1991-05-22.s018-04.sp-219","DruzPolZb.1991-05-22.s018-04.sp-219.2",DruzPolZb.1991-05-22.s018-04.toc-item2,"taxonomy.3.9.1.1","topic.368","še enkrat lep hvala ker biti poslanec za tale oglašati se zato ker hkrati biti tudi član strokoven svet in se čutiti prvič soodgovoren ali biti se morati čutiti soodgovoren zgoditi pa se biti da biti pripotovati včeraj ob 7. ura zvečer iz Stockholm in biti zamuditi včerajšnji seja strokoven svet tako da biti in se ne čutiti odgovoren za tale kompromisen predlog kakršen biti včeraj strokoven svet sprejeti in kakršen biti danes izvršen svet potem v bistvo potrditi"
"parl.DruzPolZb","seja",18,"1991-05-22","19:00:00","19:20:00","DularJanez1943",0,"DruzPolZb.1991-05-22.s018-04.sp-219","DruzPolZb.1991-05-22.s018-04.sp-219.3",DruzPolZb.1991-05-22.s018-04.toc-item2,"taxonomy.3.9.1.1","topic.368","pred deset dan biti kot član izvršen svet podpreti vztrajanje strokoven svet zavod za šolstvo in sekretariat za šolstvo in skupščinski komisija da ostajati zaključen izpit kakor biti biti oziroma z nek minimalen ugodnost ki biti se vendarle nakazovati v okvir zakon že sam"
"parl.DruzPolZb","seja",18,"1991-05-22","19:00:00","19:20:00","DularJanez1943",0,"DruzPolZb.1991-05-22.s018-04.sp-219","DruzPolZb.1991-05-22.s018-04.sp-219.4",DruzPolZb.1991-05-22.s018-04.toc-item2,"taxonomy.3.9.1.1","topic.368","v bistvo ta kar se biti zgoditi vendarle po moj mnenje pomeniti poraz praven država pred pritisk ulica poteptan biti tako stroka kot zakonitost deloma ker biti član noben stranka se počutiti toliko bolj dolžen obsoditi izrazit politizacija ta zadeva in manipulacija z mlad človek ves ta v bistvo v funkcija zelo cenen pridobivanje političen točka oziroma pridobivanje volilen glas za nekateri stranka ta kar biti ta ki biti podpihovati in zakuhati biti morati vlada danes v bistvo požreti zato ker se sklicevati na 14 dan zamuda ta nedolžen mlad človek biti 14 dan biti manipuliran zamuditi čas in zaradi ta biti vlada sprejeti ta kompromis da ne biti on v resnica žrtev nek drug interes"
"parl.DruzPolZb","seja",18,"1991-05-22","19:00:00","19:20:00","DularJanez1943",0,"DruzPolZb.1991-05-22.s018-04.sp-219","DruzPolZb.1991-05-22.s018-04.sp-219.5",DruzPolZb.1991-05-22.s018-04.toc-item2,"taxonomy.3.9.1.1","topic.368","o sam besedilo kompromis kakršen imeti na miza biti pa reči dvoj misliti da biti primer v Evropa in najbrž nikjer na svet da v zaključen izpit za srednji šola ne biti biti absolutno obvezen predmet materinščina tukaj niti ta minimum biti doseči tako daleč biti iti ta kompromis poleg ta ta tekst ne vsebovati izrecen določilo da se biti prihodnji leto zaključen izpit res opravljati tako kakor se morati zato biti prepričan da biti maj leto 1992 naleteti na sprenevedanje da biti vedeti in tako naprej da če biti biti lani tako da biti letos zopet in tako naprej skratka pred jaz biti plaz podoben zahteva tudi v trileten šola in sploh misliti da ta biti pot ne v pravno družabno niti v Evropa hvala lep"
"parl.DruzPolZb","seja",18,"1991-05-22","19:00:00","19:20:00","ToplakLudvik1942",1,"DruzPolZb.1991-05-22.s018-04.sp-220","DruzPolZb.1991-05-22.s018-04.sp-220.2",DruzPolZb.1991-05-22.s018-04.toc-item2,"taxonomy.3.9.1.1","topic.368","hvala lep prositi Peter Bekeš"
"parl.DruzPolZb","seja",18,"1991-05-22","19:00:00","19:20:00","BekesPeter1946",0,"DruzPolZb.1991-05-22.s018-04.sp-221","DruzPolZb.1991-05-22.s018-04.sp-221.2",DruzPolZb.1991-05-22.s018-04.toc-item2,"taxonomy.3.9.1.1","topic.368","ta biti nek vrsta replika spoštovan kolegica in kolega in tudi credo hkrati"
"parl.DruzPolZb","seja",18,"1991-05-22","19:00:00","19:20:00","BekesPeter1946",0,"DruzPolZb.1991-05-22.s018-04.sp-221","DruzPolZb.1991-05-22.s018-04.sp-221.3",DruzPolZb.1991-05-22.s018-04.toc-item2,"taxonomy.3.9.1.1","topic.368","jaz v praven država ki temeljiti na znan latinski rek fiat justicia pereat mundus ne verjeti tisti član strokoven svet in enako predstavnik dijaški organizacija ki biti pokazati ta modrost ki on danes v Slovenija manjkati modrost sklepati kompromis čestitati za uspeh ta biti prispevek k demokratičen praven država ta biti moj pogled hvala"
"parl.DruzPolZb","seja",18,"1991-05-22","19:00:00","19:20:00","ToplakLudvik1942",1,"DruzPolZb.1991-05-22.s018-04.sp-222","DruzPolZb.1991-05-22.s018-04.sp-222.2",DruzPolZb.1991-05-22.s018-04.toc-item2,"taxonomy.3.9.1.1","topic.368","hvala gospod Smole"
"parl.DruzPolZb","seja",18,"1991-05-22","19:00:00","19:20:00","SmoleJoze1927",0,"DruzPolZb.1991-05-22.s018-04.sp-223","DruzPolZb.1991-05-22.s018-04.sp-223.2",DruzPolZb.1991-05-22.s018-04.toc-item2,"taxonomy.3.9.1.1","topic.368","gospod Dular biti prej reči da naj povedati minister ki biti dobiti nalog tam tako delovati in tako naprej jaz biti hoteti reči da biti vlada vršiti obstrukcija kateri član biti tudi gospod Dular zdajle biti pa Dular omeniti da biti nekateri stranka spodbujati dijaški demonstracija prositi naj gospod Dular tukaj povedati ime in priimek tisti stranka ki biti spodbujati dijaški demonstracija"
"parl.DruzPolZb","seja",18,"1991-05-22","19:00:00","19:20:00","ToplakLudvik1942",1,"DruzPolZb.1991-05-22.s018-04.sp-224","DruzPolZb.1991-05-22.s018-04.sp-224.2",DruzPolZb.1991-05-22.s018-04.toc-item2,"taxonomy.3.9.1.1","topic.368","prositi dr. Dular"
"parl.DruzPolZb","seja",18,"1991-05-22","19:00:00","19:20:00","DularJanez1943",0,"DruzPolZb.1991-05-22.s018-04.sp-225","DruzPolZb.1991-05-22.s018-04.sp-225.2",DruzPolZb.1991-05-22.s018-04.toc-item2,"taxonomy.3.9.1.1","topic.368","misliti da ta navsezadnje biti noben skrivnost saj biti v dneven časopisje izhajati deklaracija posamezen stranka jasno podpisan da podpirati ta pravično in ne vedeti kako utemeljen prizadevanje dijak in jasno da biti ta biti volja narod kot se ta reči"
"parl.DruzPolZb","seja",18,"1991-05-22","19:00:00","19:20:00","ToplakLudvik1942",1,"DruzPolZb.1991-05-22.s018-04.sp-226","DruzPolZb.1991-05-22.s018-04.sp-226.2",DruzPolZb.1991-05-22.s018-04.toc-item2,"taxonomy.3.9.1.1","topic.368","hvala lep dr. Dular prositi dr. Voljč dr. Buser najprej dobro ker biti blizu in Gajšek"
"parl.DruzPolZb","seja",18,"1991-05-22","19:00:00","19:20:00","BuserStanko1932",0,"DruzPolZb.1991-05-22.s018-04.sp-227","DruzPolZb.1991-05-22.s018-04.sp-227.2",DruzPolZb.1991-05-22.s018-04.toc-item2,"taxonomy.3.9.1.1","topic.368","spoštovan vedno biti biti za kompromis in vedno biti vendar meniti da tale kompromis na 2. točka ki ustno po izbira kandidat iz predmet in tako dalje kar slediti in drug predmet lahko nadomestiti prositi pozitivno ocenjen seminarski naloga z zagovor ali pozitivno ocenjen naloga v okvir znanost mladina z zagovor ali izdelek oziroma storitev z zagovor prositi ta pa vendar morati kot strokovnjak iz šolstvo priznati in o biti toliko mladinski tabor doslej voditi na ves raven da na ta če biti biti danes član strokoven svet na ta pa ne biti pristati resnično ne ker vedeti kako se ta naloga lahko napravljati in kako biti se delati pred leto ko biti sam v ta sodelovati na takšen raven pa biti škoda da biti se spustiti hvala lep"
"parl.DruzPolZb","seja",18,"1991-05-22","19:00:00","19:20:00","ToplakLudvik1942",1,"DruzPolZb.1991-05-22.s018-04.sp-228","DruzPolZb.1991-05-22.s018-04.sp-228.2",DruzPolZb.1991-05-22.s018-04.toc-item2,"taxonomy.3.9.1.1","topic.368","hvala prositi gospod Gajšek"
"parl.DruzPolZb","seja",18,"1991-05-22","19:00:00","19:20:00","GajsekJanez",0,"DruzPolZb.1991-05-22.s018-04.sp-229","DruzPolZb.1991-05-22.s018-04.sp-229.2",DruzPolZb.1991-05-22.s018-04.toc-item2,"taxonomy.3.9.1.1","topic.368","tokrat biti povedati profesor Moge član liberalno-demokratski stranka biti v Maribor podpirati in razlagati dijak da imeti pravica zahtevati moratorij liberalen stranka v Maribor biti biti ta morati ta povedati da tudi podpredsednik skupščina občina Maribor gospod Sovič pardon tovariš Sodič biti prav tako nagovarjati dijak da imeti ves pravica ta zahtevati"
"parl.DruzPolZb","seja",18,"1991-05-22","19:00:00","19:20:00","ToplakLudvik1942",1,"DruzPolZb.1991-05-22.s018-04.sp-230","DruzPolZb.1991-05-22.s018-04.sp-230.2",DruzPolZb.1991-05-22.s018-04.toc-item2,"taxonomy.3.9.1.1","topic.368","hvala še kdo dr. Voljč"
"parl.DruzPolZb","seja",18,"1991-05-22","19:00:00","19:20:00","VoljcBozidar1939",0,"DruzPolZb.1991-05-22.s018-04.sp-231","DruzPolZb.1991-05-22.s018-04.sp-231.2",DruzPolZb.1991-05-22.s018-04.toc-item2,"taxonomy.3.9.1.1","topic.368","spoštovan poslanka in poslanec ne vedeti ali biti še razpravljati o ta tema ali ne rad pa biti da biti se današnji seja ki biti biti oster mestoma in kolikor mogoč reči uspešen tudi upati da biti končati z malo lep misel rad biti se namreč zahvaliti naš mlad liberalno-demokratski poslanec da biti se jaz spomniti in jaz obdariti z ta knjižica in tak biti reči skorajda poetičen misel v ta listič ki biti on dobiti naj povedati da ko biti on prebrati čeprav biti se ustaviti ob tisti kitajski rek in čeprav biti že izpolniti tisti kar kitajski rek pisati ne misliti kar tako odnehati zlasti pa še ne v registriranje pomlad in rad biti ti povedati da naj biti zdaj še jaz malo poetičen da nežen zelenje mlad bukov listje tako tipično za pomlad še biti doseči vrh ves slovenski gozd in da kdor v ta uživati on še zmeraj lahko videti in rad biti ti tudi ta povedati da biti tudi ptičji petje čeprav zdaj ob zora bogat in lepo in kdo želeti tudi ta lahko poslušati ta čas biti namreč vsak leto izjemno kratek zato biti se ti rad zahvaliti tisti ki biti jaz spomniti na ta pomlad hkrati pa se seveda želeti da biti biti ta pomlad za jaz še po drugačen kriterij res pomlad hvala lep"
"parl.DruzPolZb","seja",18,"1991-05-22","19:00:00","19:20:00","PersakAnton1947",1,"DruzPolZb.1991-05-22.s018-04.sp-232","DruzPolZb.1991-05-22.s018-04.sp-232.2",DruzPolZb.1991-05-22.s018-04.toc-item2,"taxonomy.3.9.1.1","topic.368","gospod Toplak"
"parl.DruzPolZb","seja",18,"1991-05-22","19:00:00","19:20:00","ToplakLudvik1942",1,"DruzPolZb.1991-05-22.s018-04.sp-233","DruzPolZb.1991-05-22.s018-04.sp-233.2",DruzPolZb.1991-05-22.s018-04.toc-item2,"taxonomy.3.9.1.1","topic.368","razprava k ta točka biti v bistvo že zaključen ta biti samo še porazprava dr. Voljč kot naš liberalno-demokratski stranka danes spominjati na kitajski rek naj povedati zgodba resnica tam nekje sredi Peking pred univerziteten center biti jezero v kateri biti utoniti več sto profesor ko biti se on študent upreti v takrat voden kulturen revolucija profesor biti zmetati v jezero kjer biti profesor stati do pas ali do vrat kakor kdaj in kakor kdo in šele ko biti dvigniti roka in priseči da nikoli več ne biti mučiti študent z izpit biti on dovoliti da biti priti iz jezero sicer biti ostati v jezero"
"parl.DruzPolZb","seja",18,"1991-05-22","19:00:00","19:20:00","ToplakLudvik1942",1,"DruzPolZb.1991-05-22.s018-04.sp-233","DruzPolZb.1991-05-22.s018-04.sp-233.3",DruzPolZb.1991-05-22.s018-04.toc-item2,"taxonomy.3.9.1.1","topic.368","kakorkoli ocenjevati res biti gibanje kakor se biti pač začeti nekje tam kot biti reči rdeč univerza v berkley pa se biti končati tam nekje na Daljnji vzhod biti pač biti en proces nekje izživet nekje pa pač biti izživet jaz ves ta k ta ne biti dajati sodba izreči pa biti na konec vendarle zadovoljstvo da biti včeraj proglasiti oziroma sprejeti zakon da biti srednji verski šola v Vipava in v Želimlje približno priznan evropsko priznan dva srednji šola kateri spričevalo ali matura ali zaključen izpit biti evropsko priznan hvala lep"
"parl.DruzPolZb","seja",18,"1991-05-22","19:00:00","19:20:00","PersakAnton1947",1,"DruzPolZb.1991-05-22.s018-04.sp-234","DruzPolZb.1991-05-22.s018-04.sp-234.2",DruzPolZb.1991-05-22.s018-04.toc-item2,"taxonomy.3.9.1.1","topic.368","hvala še gospod Zagožen potem biti pa apelirati da biti končati ta porazprava ker videti situacija biti rešen v splošen zadovoljstvo ali ne ampak ta kar zdaj delati biti raven nek javen polemika ki on res lahko kje drugje opravljati"
"parl.DruzPolZb","seja",18,"1991-05-22","19:00:00","19:20:00","ZagozenFrance1942",0,"DruzPolZb.1991-05-22.s018-04.sp-235","DruzPolZb.1991-05-22.s018-04.sp-235.2",DruzPolZb.1991-05-22.s018-04.toc-item2,"taxonomy.3.9.1.1","topic.368","ta biti res ampak ker biti biti konflikt zelo oster misliti da biti tudi ta upravičen najprej biti rad popraviti svoj kolega v Maribor najbrž biti niti konstituiran liberalen stranka ampak liberalno-demokratski stranka zame iti jaz biti prej že omenjati da biti biti dobro razpravljati o delo nekateri frakcija tudi v naš zbor in biti zdaj ob ta reči da se biti zgoditi tisti kar biti ob prvi razprava v ta zbor povedati da biti izgubiti ves največ pa mladina in da ne verjeti v konstruktivnost in demokratičnost stranka tudi če sedeti v večstrankarski parlament če biti za ta da biti se pridobiti nek volilen glas mlad človek ki biti prihodnji leto polnoleten za on primeren sredstvo tudi tak vrsta manipulacija obstrukcija nekateri stranka se biti začeti pred dober leto na prvi seja ta skupščina na tisti ko biti se konstituirati potem končno v dva dolg noč in po en leto se tak nedemokratičen metoda še vedno ponavljati hvala"
"parl.DruzPolZb","seja",18,"1991-05-22","19:00:00","19:20:00","ToplakLudvik1942",1,"DruzPolZb.1991-05-22.s018-04.sp-236","DruzPolZb.1991-05-22.s018-04.sp-236.2",DruzPolZb.1991-05-22.s018-04.toc-item2,"taxonomy.3.9.1.1","topic.368","hvala lep Metka mencinov pa Peter Bekeš"
"parl.DruzPolZb","seja",18,"1991-05-22","19:00:00","19:20:00","MencinMetka",0,"DruzPolZb.1991-05-22.s018-04.sp-237","DruzPolZb.1991-05-22.s018-04.sp-237.2",DruzPolZb.1991-05-22.s018-04.toc-item2,"taxonomy.3.9.1.1","topic.368","ker se biti zdajle že nekajkrat opozoriti na ta da biti nekateri stranka spodbujati dijaški revolt biti reči ta nekateri stranka biti res podpirati dijak v njihov zahteva in biti jasno eksplicitno povedati zakaj on podpirati po naš mnenje pa on biti bolj spodbujati vlada z nepripravljenost na kompromis do ta zadnji trenutek ta biti en drug pa ta gospod Dular biti tukaj lahko govoriti v ime strokoven svet tisti ki biti pa ves čas soudeležen v ta spor se praviti tudi soudeležen v ta spor dijak pa biti imeti možnost govoriti v ta skupščina tudi v ta trenutek jaz biti jasen po kakšen logika in kako biti gospod Dular lahko razpravljati o ta sklep oziroma o ta informacija ki biti on dobiti"
"parl.DruzPolZb","seja",18,"1991-05-22","19:00:00","19:20:00","ToplakLudvik1942",1,"DruzPolZb.1991-05-22.s018-04.sp-238","DruzPolZb.1991-05-22.s018-04.sp-238.2",DruzPolZb.1991-05-22.s018-04.toc-item2,"taxonomy.3.9.1.1","topic.368","hvala še Peter Bekeš"
"parl.DruzPolZb","seja",18,"1991-05-22","19:00:00","19:20:00","BekesPeter1946",0,"DruzPolZb.1991-05-22.s018-04.sp-239","DruzPolZb.1991-05-22.s018-04.sp-239.2",DruzPolZb.1991-05-22.s018-04.toc-item2,"taxonomy.3.9.1.1","topic.368","spoštovan kolegica in kolega morati dva stvar ugotoviti v zveza z razprava spoštovan kolega Zagožen in sicer prvič zaskrbljenost nad ta da se v ta naš parlament ki želeti vsaj tako se ves deklarirati biti ali vsaj začeti postajati demokratičen morati namreč spoštovan kolega obvestiti da biti pravica do stavka mednarodno konvecijsko zavarovan pravica in da družba ki ta pravica omejevati v svet ne veljati za posebno demokratičen in seveda veljati tudi za promotor tovrsten ideja"
"parl.DruzPolZb","seja",18,"1991-05-22","19:00:00","19:20:00","BekesPeter1946",0,"DruzPolZb.1991-05-22.s018-04.sp-239","DruzPolZb.1991-05-22.s018-04.sp-239.3",DruzPolZb.1991-05-22.s018-04.toc-item2,"taxonomy.3.9.1.1","topic.368","drugič da biti naš znamenit profesor praven teorija dr. Ivo Perenič ki on biti ta skupščina pred nedaven izvoliti za sodnik ustaven sodišče že pred nekaj leto na simpozij v Portorož kjer biti oba sodelovati na tema državljanski nepokorščina povedati da danes odprtost nek demokratičen družba do dopuščanje državljanski nepokornost kot en od način neformalen kontrola demokratičen sistem in njihov izvršen organ postajati eden temeljen kriterij demokratičnost nek družba"
"parl.DruzPolZb","seja",18,"1991-05-22","19:00:00","19:20:00","BekesPeter1946",0,"DruzPolZb.1991-05-22.s018-04.sp-239","DruzPolZb.1991-05-22.s018-04.sp-239.4",DruzPolZb.1991-05-22.s018-04.toc-item2,"taxonomy.3.9.1.1","topic.368","skratka demokracija biti veliko več od zgolj pluralen sestava parlament v ta se pa z ti strinjati"
"parl.DruzPolZb","seja",18,"1991-05-22","19:00:00","19:20:00","ToplakLudvik1942",1,"DruzPolZb.1991-05-22.s018-04.sp-240","DruzPolZb.1991-05-22.s018-04.sp-240.2",DruzPolZb.1991-05-22.s018-04.toc-item2,"taxonomy.3.9.1.1","topic.368","hvala lep še kdo če ne zaključevati razprava porazprava k ta točka jaz morati ugotoviti da biti prejeti informacija izvršen svet in z ta zaključevati 18. seja družbenopolitičen zbor hvala"
"parl.DruzPolZb","seja",18,"1991-05-22","19:00:00","19:20:00","ToplakLudvik1942",1,"DruzPolZb.1991-05-22.s018-04.sp-240","DruzPolZb.1991-05-22.s018-04.sp-240.3",DruzPolZb.1991-05-22.s018-04.toc-item2,"taxonomy.3.9.1.1","topic.368","nadaljevati predvidoma naslednji četrtek kot biti verjetno že obveščen predvidoma naslednji četrtek hvala"
