"orgId","type of session","number","date","notBefore","notAfter","persId","chairman","spId","uId","titleId","taxonomyIds","topicIds","lemmata"
"parl.ZbZdruDel","seja",35,"1991-12-11","10:20:00","13:05:00","RojcIvan",0,"ZbZdruDel.1991-12-11.s035-01.sp-65","ZbZdruDel.1991-12-11.s035-01.sp-65.4",ZbZdruDel.1991-12-11.s035-01.toc-item8,"taxonomy.3.7.1","topic.279","meniti da situacija tak kot biti povzročati tudi problem pri obvladljivost položaj zato biti tudi izvršen svet oceniti da biti potreben v sklad z predložen zakon izvesti fazen vzpostavitev nov služba kot biti iz zakon razviden ta zakon direktno ne posegati na področje SDK ker imeti še vedno veljaven ustava ki natančno opredeljevati položaj in naloga SDK ja temveč se samo posredno nanašati na ta služba v 10. in 23. člen z ta da naj biti po 23. člen ko biti sprejet ustava ustaven zakon in pa na osnova ta ustaven zakon tudi sprejet zakonski predpis ki biti posebej urejati določen zadeva potem preiti v sestava nov služba praktično iti za fazen vzpostavitev nov služba glede na stališče deloven telo pa biti verjetno morati izvršen svet predložiti korekcija zakon in sicer v smer da biti ta čist zakon v smisel urejanje zadeva samo znotraj področje uprava za družben prihodek in kontrola poslovanje fizičen oseba z ta da morati omeniti še pomemben novost misliti pomembnost del zakon v ta da v zakon ne vključevati tisti rešitev ki biti že zajet v obstoječ predpis ta veljati za zakon o sistem državen uprava zakon o delavec v državen uprava in pa tudi zakon o organizacija republiški upraven organ kakor tudi ne tisti zakon ki urejati postopek odmera obračun izterjava davek iti praktično za potenciran vsebina zakon ki urejati zadeva predvsem z organizacijski vidik vključen biti pa notri samo inšpekcija ki biti naveden v zakon o uprava za družben prihodek ki pa če biti ta zakon sprejet prenehati veljati torej biti potrebno nekateri stvar v ta zakon le dograditi hvala lep"
"parl.ZbZdruDel","seja",35,"1991-12-11","10:20:00","13:05:00","ZupancicJoze1936",1,"ZbZdruDel.1991-12-11.s035-01.sp-66","ZbZdruDel.1991-12-11.s035-01.sp-66.2",ZbZdruDel.1991-12-11.s035-01.toc-item8,"taxonomy.3.7.1","topic.279","hvala lep želeti poročevalec deloven telo beseda"
"parl.ZbZdruDel","seja",35,"1991-12-11","10:20:00","13:05:00","ZupancicJoze1936",1,"ZbZdruDel.1991-12-11.s035-01.sp-66","ZbZdruDel.1991-12-11.s035-01.sp-66.4",ZbZdruDel.1991-12-11.s035-01.toc-item8,"taxonomy.3.7.1","topic.279","pričenjati z razprava kdo želeti razpravljati slišati biti tudi kakšen biti stališče v deloven telo jaz biti ti on na kratek prebrati odbor za proračun in javen finance in pa zakonodajno-praven komisija"
"parl.ZbZdruDel","seja",35,"1991-12-11","10:20:00","13:05:00","ZupancicJoze1936",1,"ZbZdruDel.1991-12-11.s035-01.sp-66","ZbZdruDel.1991-12-11.s035-01.sp-66.5",ZbZdruDel.1991-12-11.s035-01.toc-item8,"taxonomy.3.7.1","topic.279","če biti razpravljalec pa biti razprava sedaj imeti tukaj samo stališče oba deloven telo če ti še enkrat prebrati odbor za proračun in javen finance ki meniti da biti naslov zakon vprašljiv podan pa biti biti tudi predlog naj se zakon vrniti v faza predlog za izdaja zakon ker biti treba z zakon urediti integracija ves služba ki skrbeti za javen prihodek ta biti en stališče"
"parl.ZbZdruDel","seja",35,"1991-12-11","10:20:00","13:05:00","ZupancicJoze1936",1,"ZbZdruDel.1991-12-11.s035-01.sp-66","ZbZdruDel.1991-12-11.s035-01.sp-66.6",ZbZdruDel.1991-12-11.s035-01.toc-item8,"taxonomy.3.7.1","topic.279","medtem ko zakonodajno-praven komisija naštevati celo vrsta razlog in biti v bistvo proti sprejem ta zakon in tudi podpirati enako da se vrniti ves skupaj v predlog za izdaja zakon beseda imeti gospod Andrej Šter"
"parl.ZbZdruDel","seja",35,"1991-12-11","10:20:00","13:05:00","SterAndrej1958",0,"ZbZdruDel.1991-12-11.s035-01.sp-67","ZbZdruDel.1991-12-11.s035-01.sp-67.2",ZbZdruDel.1991-12-11.s035-01.toc-item8,"taxonomy.3.7.1","topic.279","oglašati se kot član odbor za pravosodje in uprava ki biti danes zjutraj obravnavati tudi ta predpis čakati biti da biti dobiti pisen poročilo in biti tudi želeti da on ti dobiti skušati on biti tukaj ustno podati jaz biti presoditi da biti predpis ki on obravnavati potreben da biti potreben o on opraviti razprava in pričakovati biti da on biti vsaj nekaj na odbor biti se pojaviti posamezen vprašanje odbor za pravosodje predlagati da pač zbor po opravljen obravnava osnutek zakon z podan pripomba sprejeti hvala"
"parl.ZbZdruDel","seja",35,"1991-12-11","10:20:00","13:05:00","ZupancicJoze1936",1,"ZbZdruDel.1991-12-11.s035-01.sp-68","ZbZdruDel.1991-12-11.s035-01.sp-68.2",ZbZdruDel.1991-12-11.s035-01.toc-item8,"taxonomy.3.7.1","topic.279","hvala gospod Grašič"
"parl.ZbZdruDel","seja",35,"1991-12-11","10:20:00","13:05:00","GrasicFranc1941",0,"ZbZdruDel.1991-12-11.s035-01.sp-69","ZbZdruDel.1991-12-11.s035-01.sp-69.2",ZbZdruDel.1991-12-11.s035-01.toc-item8,"taxonomy.3.7.1","topic.279","gospod predsednik izgledati da biti priti do nek nesporazum odbor za proračun in javen finance predlagati da izvršen svet predlagatelj v faza priprava predlog upoštevati ta pripomba takšen biti tudi sklep predlog"
"parl.ZbZdruDel","seja",35,"1991-12-11","10:20:00","13:05:00","ZupancicJoze1936",1,"ZbZdruDel.1991-12-11.s035-01.sp-70","ZbZdruDel.1991-12-11.s035-01.sp-70.2",ZbZdruDel.1991-12-11.s035-01.toc-item8,"taxonomy.3.7.1","topic.279","predloga ali osnutek"
"parl.ZbZdruDel","seja",35,"1991-12-11","10:20:00","13:05:00","GrasicFranc1941",0,"ZbZdruDel.1991-12-11.s035-01.sp-71","ZbZdruDel.1991-12-11.s035-01.sp-71.2",ZbZdruDel.1991-12-11.s035-01.toc-item8,"taxonomy.3.7.1","topic.279","ne konkretno predlog odbor za proračun in javen finance biti da se predlog za izdaja zakon o služba za javen prihodek z osnutek zakon sprejeti in se izvršen svet skupščina republika Slovenija ob ta nalagati da v faza predlog zakon dopolniti tako da biti v on zajet le centralizacija občinski uprava za javen prihodek in ustrezno ta spremenjen tudi naslov zakon"
"parl.ZbZdruDel","seja",35,"1991-12-11","10:20:00","13:05:00","ZupancicJoze1936",1,"ZbZdruDel.1991-12-11.s035-01.sp-72","ZbZdruDel.1991-12-11.s035-01.sp-72.2",ZbZdruDel.1991-12-11.s035-01.toc-item8,"taxonomy.3.7.1","topic.279","hvala v red še želeti kdo prositi gospod Rudi Moge"
"parl.ZbZdruDel","seja",35,"1991-12-11","10:20:00","13:05:00","MogeRudi1944",0,"ZbZdruDel.1991-12-11.s035-01.sp-73","ZbZdruDel.1991-12-11.s035-01.sp-73.2",ZbZdruDel.1991-12-11.s035-01.toc-item8,"taxonomy.3.7.1","topic.279","z ta zakon kot videti nekako urejati v republika Slovenija na nov davčen uprava vprašanje predlagatelj biti kako biti pa v ta vtkan služba družben knjigovodstvo namreč o on tukaj v obrazložitev biti niti besedica ali imeti za posledica če ta reč sprejeti tudi dejstvo da se biti potem morati tudi služba družben knjigovodstvo tako spremeniti ali raztransformirati"
"parl.ZbZdruDel","seja",35,"1991-12-11","10:20:00","13:05:00","ZupancicJoze1936",1,"ZbZdruDel.1991-12-11.s035-01.sp-74","ZbZdruDel.1991-12-11.s035-01.sp-74.2",ZbZdruDel.1991-12-11.s035-01.toc-item8,"taxonomy.3.7.1","topic.279","hvala še kdo če ne biti jaz predlagati naslednji saj biti mogoče prejesti da biti predlagati potem biti pa še dati gospod Rojc beseda namreč jaz biti pa predlagati glede na ta da biti tu pač nekako različen mnenje naslednji sklep predlog za izdaja zakon o služba za javen prihodek z osnutek se sprejeti in se izvršen svet skupščina republika slovenje ob ta nalagati da v faza predlog zakon dopolniti tako da biti v on zajet le centralizacija občinski uprava za javen prihodek in ustrezno ta spremeniti tudi naslov zakon ta biti en del"
"parl.ZbZdruDel","seja",35,"1991-12-11","10:20:00","13:05:00","ZupancicJoze1936",1,"ZbZdruDel.1991-12-11.s035-01.sp-74","ZbZdruDel.1991-12-11.s035-01.sp-74.3",ZbZdruDel.1991-12-11.s035-01.toc-item8,"taxonomy.3.7.1","topic.279","in drugič izvršen svet skupščina republika Slovenija naj v prvi polovica 1992. v sodelovanje z služba družben knjigovodstvo gospodarski zbornica Slovenija združenje banka in drug zainteresiran organ in organizacija pripraviti projekt in zakonski osnutek za vzpostavitev celovit in enoten služba za javen prihodek v republika Slovenija ki biti vključevati tudi preobrazba služba družben knjigovodstvo pri priprava predlog zakon naj predlagatelj proučiti in ustrezno upoštevati stališče in pripomba deloven telo skupščina in pripomba delegat in drug inštitucija"
"parl.ZbZdruDel","seja",35,"1991-12-11","10:20:00","13:05:00","ZupancicJoze1936",1,"ZbZdruDel.1991-12-11.s035-01.sp-74","ZbZdruDel.1991-12-11.s035-01.sp-74.4",ZbZdruDel.1991-12-11.s035-01.toc-item8,"taxonomy.3.7.1","topic.279","biti ta biti možen gospod Rojc se strinjati kaj pa ti poslanka in poslanec gospod Grašič biti ta ustrezno tudi v ime odbor gospod Šter tudi"
"parl.ZbZdruDel","seja",35,"1991-12-11","10:20:00","13:05:00","ZupancicJoze1936",1,"ZbZdruDel.1991-12-11.s035-01.sp-74","ZbZdruDel.1991-12-11.s035-01.sp-74.5",ZbZdruDel.1991-12-11.s035-01.toc-item8,"taxonomy.3.7.1","topic.279","in biti ugotoviti prisotnost 46 jaz biti še vedno samo fant"
"parl.ZbZdruDel","seja",35,"1991-12-11","10:20:00","13:05:00","ZupancicJoze1936",1,"ZbZdruDel.1991-12-11.s035-01.sp-74","ZbZdruDel.1991-12-11.s035-01.sp-74.6",ZbZdruDel.1991-12-11.s035-01.toc-item8,"taxonomy.3.7.1","topic.279","koliko jaz biti za ta dva sklep ki biti on prečitati"
"parl.ZbZdruDel","seja",35,"1991-12-11","10:20:00","13:05:00","ZupancicJoze1936",1,"ZbZdruDel.1991-12-11.s035-01.sp-74","ZbZdruDel.1991-12-11.s035-01.sp-74.8",ZbZdruDel.1991-12-11.s035-01.toc-item8,"taxonomy.3.7.1","topic.279","proti"
"parl.ZbZdruDel","seja",35,"1991-12-11","10:20:00","13:05:00","ZupancicJoze1936",1,"ZbZdruDel.1991-12-11.s035-01.sp-74","ZbZdruDel.1991-12-11.s035-01.sp-74.10",ZbZdruDel.1991-12-11.s035-01.toc-item8,"taxonomy.3.7.1","topic.279","vzdržan"
"parl.ZbZdruDel","seja",35,"1991-12-11","10:20:00","13:05:00","ZupancicJoze1936",1,"ZbZdruDel.1991-12-11.s035-01.sp-74","ZbZdruDel.1991-12-11.s035-01.sp-74.12",ZbZdruDel.1991-12-11.s035-01.toc-item8,"taxonomy.3.7.1","topic.279","ugotavljati da biti zbor z večina glas sprejeti predlagan sklep"
"parl.ZbZdruDel","seja",35,"1991-12-11","10:20:00","13:05:00","ZupancicJoze1936",1,"ZbZdruDel.1991-12-11.s035-01.sp-74","ZbZdruDel.1991-12-11.s035-01.sp-74.13",ZbZdruDel.1991-12-11.s035-01.toc-item8,"taxonomy.3.7.1","topic.279","potem imeti še imeti čas jaz biti biti za ta da res intenzivno delati da biti danes iti domov da ne biti potem jutri zato morati vsak minuta izkoristiti in biti škoda da sedaj tam zunaj stati in čakati"
"parl.ZbZdruDel","seja",35,"1991-12-11","10:20:00","13:05:00","ZupancicJoze1936",1,"ZbZdruDel.1991-12-11.s035-01.sp-74","ZbZdruDel.1991-12-11.s035-01.sp-74.14",ZbZdruDel.1991-12-11.s035-01.toc-item9,"taxonomy.3.4.5","topic.211","6. točka dneven red predlog za izdaja zakon o varstvo industrijski lastnina z osnutek zakon"
"parl.ZbZdruDel","seja",35,"1991-12-11","10:20:00","13:05:00","ZupancicJoze1936",1,"ZbZdruDel.1991-12-11.s035-01.sp-74","ZbZdruDel.1991-12-11.s035-01.sp-74.15",ZbZdruDel.1991-12-11.s035-01.toc-item9,"taxonomy.3.4.5","topic.211","tudi tu iti za osnutek predlog za izdaja zakon z osnutek zakon biti v obravnava predložiti izvršen svet skupščina republika Slovenija predlog za izdaja zakon z osnutek zakon biti obravnavati odbor za raziskovalen dejavnost in tehnologija kateri član biti podati konkreten pripomba k osnutek zakon soglasno pa biti podpreti združitev zakonski faza ker biti z odlašanje sprejetje za Slovenija tako pomemben zakon lahko nastati na ta področje znaten škoda upoštevati biti potrebno gospodarski pomen obravnavan zakon ker soditi v ureditev varstvo industrijski lastnina skladno z mednaroden konvencija ob mednaroden priznanje Slovenija in njen vključevanje v mednaroden tok med pogoj priznanje status država z velik trgovinski ugodnost na odbor biti biti opozorjen na dejstvo da biti tako okleščen obseg sredstvo za financiranje raziskovalen dejavnost kot on predvidevati osnutek proračun republika Slovenija za leto 1992 tu pa ti prositi da se ne spuščati v obravnava proračun ki biti sedaj v skupščinski procedura resno ogroziti izvajanje določba zakon o varstvo industrijski lastnina odbor predlagati da se predlog za izdaja zakon z osnutek zakon sprejeti"
"parl.ZbZdruDel","seja",35,"1991-12-11","10:20:00","13:05:00","ZupancicJoze1936",1,"ZbZdruDel.1991-12-11.s035-01.sp-74","ZbZdruDel.1991-12-11.s035-01.sp-74.16",ZbZdruDel.1991-12-11.s035-01.toc-item9,"taxonomy.3.4.5","topic.211","odbor za splošen gospodarski zadeva ki se biti z predlog za izdaja zakon z osnutek strinjati"
"parl.ZbZdruDel","seja",35,"1991-12-11","10:20:00","13:05:00","ZupancicJoze1936",1,"ZbZdruDel.1991-12-11.s035-01.sp-74","ZbZdruDel.1991-12-11.s035-01.sp-74.17",ZbZdruDel.1991-12-11.s035-01.toc-item9,"taxonomy.3.4.5","topic.211","zakonodajno-praven komisija biti predlog za izdaja zakon podpreti ob obravnava osnutek zakon biti ugotoviti da predlagatelj zakon v velik mera povzemati rešitev iz dosedanji zvezen zakon o varstvo izum tehničen izboljšava in znak razlikovanje iz leto 1981 kar pomeniti da iti za preizkušen in uveljavljen rešitev ki on predlagatelj zakon skušati še ustrezno posodobiti na podlaga mednarodno uveljavljen rešitev"
"parl.ZbZdruDel","seja",35,"1991-12-11","10:20:00","13:05:00","ZupancicJoze1936",1,"ZbZdruDel.1991-12-11.s035-01.sp-74","ZbZdruDel.1991-12-11.s035-01.sp-74.18",ZbZdruDel.1991-12-11.s035-01.toc-item9,"taxonomy.3.4.5","topic.211","k posamezen člen osnutek zakon pa biti predlagatelj predlagati vrsta pripomba"
"parl.ZbZdruDel","seja",35,"1991-12-11","10:20:00","13:05:00","ZupancicJoze1936",1,"ZbZdruDel.1991-12-11.s035-01.sp-74","ZbZdruDel.1991-12-11.s035-01.sp-74.19",ZbZdruDel.1991-12-11.s035-01.toc-item9,"taxonomy.3.4.5","topic.211","odbor za varstvo potrošnik predlagati da predlog za izdaja zakon z osnutek zakon sprejeti podpreti biti on ves želeti predstavnik izvršen svet beseda prositi dr. Bojan Pretnar direktor urad republika Slovenija za varstvo industrijski lastnina glede na podpora biti verjetno uvod kratek"
"parl.ZbZdruDel","seja",35,"1991-12-11","10:20:00","13:05:00","PretnarBojan",0,"ZbZdruDel.1991-12-11.s035-01.sp-75","ZbZdruDel.1991-12-11.s035-01.sp-75.2",ZbZdruDel.1991-12-11.s035-01.toc-item9,"taxonomy.3.4.5","topic.211","hvala lep poskušati biti biti kratek toda spoštovan zbor vendarle misliti da biti potrebno ob ta osnutek povedati nekaj beseda ki se predvsem nanašati na sam pomen gospodarski pomen ta zakon"
"parl.ZbZdruDel","seja",35,"1991-12-11","10:20:00","13:05:00","PretnarBojan",0,"ZbZdruDel.1991-12-11.s035-01.sp-75","ZbZdruDel.1991-12-11.s035-01.sp-75.3",ZbZdruDel.1991-12-11.s035-01.toc-item9,"taxonomy.3.4.5","topic.211","kot biti znan biti skupščina republika Slovenija z sprejetje ustaven zakon ob razglasitev neodvisnost 25. junij med drug tudi ustanoviti svoj urad za varstvo industrijski lastnina urad biti prevzeti opraviti ki on biti doslej in v zadnji leto korektno opravljati edino le zvezen zavod za patent v Beograd povsem logičen biti potemtakem da Slovenija čim prej sprejeti tudi svoj lasten zakon o industrijski lastnina"
"parl.ZbZdruDel","seja",35,"1991-12-11","10:20:00","13:05:00","PretnarBojan",0,"ZbZdruDel.1991-12-11.s035-01.sp-75","ZbZdruDel.1991-12-11.s035-01.sp-75.4",ZbZdruDel.1991-12-11.s035-01.toc-item9,"taxonomy.3.4.5","topic.211","pri oblikovanje predlog za izdaja in osnutek ki on danes imeti na vaši miza kazati omeniti naslednji izhodišče"
"parl.ZbZdruDel","seja",35,"1991-12-11","10:20:00","13:05:00","PretnarBojan",0,"ZbZdruDel.1991-12-11.s035-01.sp-75","ZbZdruDel.1991-12-11.s035-01.sp-75.5",ZbZdruDel.1991-12-11.s035-01.toc-item9,"taxonomy.3.4.5","topic.211","1. zakon morati biti usklajen in združljiv z mednaroden norma in predpis v razvit svet ta biti pomemben zaradi izjemen pomen industrijski lastnina v mednaroden ekonomski odnos dejstvo biti namreč da biti v bližnji prihodnost končan tako imenovan urugvajski krog pogajanje v okvir GATT ki biti v mednaroden trgovina vnesti ne samo minimalen standard zaščita intelektualen lastnina kateri osrednji del biti industrijski lastnina temveč tudi sankcija za država ki ta standard ne biti upoštevati vključitev problematika industrijski lastnina v GATT biti logičen nadaljevanje pot ki ovirati razvit svet bodisi na nacionalen bodisi na nadnacionalen raven kot primer navajati ameriški zakon o kršenje blagoven znamka iz leto 1984 ki poleg denaren kazen do 5 milijon dolar uvajati tudi zaporen kazen za kršitelj za jaz Slovenija biti morda še bolj relevanten uredba EGS po kateri se vsak v evropski skupnost uvožen blago v primer da kršiti blagoven znamka ne samo zaseči temveč tudi obvezno uničiti končno čeprav ne nazadnje kazati omeniti še lani sprejet zakon v Nemčija ki tudi uvajati visok denaren in zaporen kazen za kršitelj pravica industrijski lastnina"
"parl.ZbZdruDel","seja",35,"1991-12-11","10:20:00","13:05:00","PretnarBojan",0,"ZbZdruDel.1991-12-11.s035-01.sp-75","ZbZdruDel.1991-12-11.s035-01.sp-75.6",ZbZdruDel.1991-12-11.s035-01.toc-item9,"taxonomy.3.4.5","topic.211","takšen stanje narekovati kar hiter prilagoditev naš gospodarstvo na razmera ki vladati na evropski trg ki biti za jaz kot Slovenija eksistenčen pomen in dober korak biti po naš prepričanje v ta smer lasten zakonodaja ki prevzemati enak norma kot razvit Evropa ne nazadnje z ta Slovenija tudi izpolnjevati tudi formalnost ki biti pogoj za priključitev k evropski patenten konvencija"
"parl.ZbZdruDel","seja",35,"1991-12-11","10:20:00","13:05:00","PretnarBojan",0,"ZbZdruDel.1991-12-11.s035-01.sp-75","ZbZdruDel.1991-12-11.s035-01.sp-75.7",ZbZdruDel.1991-12-11.s035-01.toc-item9,"taxonomy.3.4.5","topic.211","resnica na ljubo biti treba reči da nekateri zagovarjati tudi mnenje da ravno zaradi resen posledica evropski zakonodaja kazati naš zakonodaja omiliti običajno se kot glaven argument takšen pristop navajati argument nezadosten pripravljenost naš podjetje na položaj v Evropa in drugod žal biti takšen odlašanje soočenje z pravilo igra na mednaroden trg zgolj potiskanje glava v pesek ki jaz ob ves tegoba izguba nekdanji jugoslovanski trg le dodatno škoditi poleg ta biti jaz skoraj zanesljivo doleteti nekateri neprijetnost naj navesti v ilustracija izjemen nepopustljivost združen država Amerika ki sklenitev dvostranski trgovinski sporazum brezpogojno vezati na primeren zakonodaja o industrijski lastnina brez takšen ureditev država ki sklepati takšen dvostranski sporazum ne moči računati na status država z velik trgovinski ugodnost kako resen biti ta pogoj biti že neposredno spoznati tako sovjetski zveza kakor Poljska slednji zaradi piratstvo groziti odvzem že pridobljen status država z velik ugodnost"
"parl.ZbZdruDel","seja",35,"1991-12-11","10:20:00","13:05:00","PretnarBojan",0,"ZbZdruDel.1991-12-11.s035-01.sp-75","ZbZdruDel.1991-12-11.s035-01.sp-75.8",ZbZdruDel.1991-12-11.s035-01.toc-item9,"taxonomy.3.4.5","topic.211","naveden gospodarski pomen vsekakor utemeljevati odločitev izvršen svet da združiti dva faza in ti danes predstaviti predlog za izdaja zakon skupaj z osnutek zakon priznanje Slovenija biti vse blizu in ko biti do on priti biti prav da izpolniti pogoj za kar se dati nagel sklepanje dvostranski trgovinski sporazum pristopanje k multilateralen pogodba in članstvo v mednaroden konvencija brez ta biti se po nepotreben sam otežiti še iz drug razlog več kot dovolj obremenjen mednaroden poslovanje"
"parl.ZbZdruDel","seja",35,"1991-12-11","10:20:00","13:05:00","PretnarBojan",0,"ZbZdruDel.1991-12-11.s035-01.sp-75","ZbZdruDel.1991-12-11.s035-01.sp-75.9",ZbZdruDel.1991-12-11.s035-01.toc-item9,"taxonomy.3.4.5","topic.211","2. drug osnoven izhodišče biti ustreznost zakon značilnost slovenski gospodarski struktura kar seveda biti isti kot opuščanje mednaroden standard zaščita v ta zveza osnutek zakon upoštevati naslednji danost najprej velik potencial zaseben inovator kot nosilec droben gospodarstvo za ta krog nosilec patenten pravica biti predviden relativno cenen in enostaven postopek zaščita njihov ideja na soroden čeprav nekoliko različen način kakršen poznati npr. ZRN z varstvo tako imenovan uporaben model ki se tudi imenovati mali izum iti za rešitev da izumitelj za doba do deset leto patenten zaščita biti potreben priskrbeti dokaj drag in tudi strokovno zahteven dokazilo da njegov izum izpolnjevati ves z zakon predpisan pogoj"
"parl.ZbZdruDel","seja",35,"1991-12-11","10:20:00","13:05:00","PretnarBojan",0,"ZbZdruDel.1991-12-11.s035-01.sp-75","ZbZdruDel.1991-12-11.s035-01.sp-75.10",ZbZdruDel.1991-12-11.s035-01.toc-item9,"taxonomy.3.4.5","topic.211","drug dejstvo biti da biti breme tovrsten dokazilo na prijavitelj kar izhajati iz izjemno zahteven postopek ugotavljanje absoluten novost za izum ki on naš v nekaj mesec iz nič postavljen urad republika Slovenija za varstvo industrijski lastnina niti kadrovsko niti materialno biti sposoben kompetentno opravljati ta nenazadnje veljati tudi za urad majhen evropski država pa čeprav imeti nekateri že več kot sto leto delovanje za se takšen zasnova postopek za priznavanje patenten varstvo kateri jedro predstavljati 71. člen osnutek jaz biti omogočiti da biti urad republika Slovenija za varstvo industrijski lastnina kadrovski približen polovica majhen kot biti sicer biti če biti npr. slediti vzor organiziranost in postopek sicer visoko učinkovit ameriški patenten urad jaz seveda pri ta upoštevati število prijava ki on pričakovati v Slovenija obenem pa z izbran postopek kvaliteta patenten varstvo niti najmanj biti prizadet"
"parl.ZbZdruDel","seja",35,"1991-12-11","10:20:00","13:05:00","PretnarBojan",0,"ZbZdruDel.1991-12-11.s035-01.sp-75","ZbZdruDel.1991-12-11.s035-01.sp-75.11",ZbZdruDel.1991-12-11.s035-01.toc-item9,"taxonomy.3.4.5","topic.211","3. poseben pozornost biti po drug stran torej poleg mali inovator posvetiti slovenski farmacevtski industrija ki se biti z nov zakon znajti v spremenjen položaj osnutek zakon predvidevati prehoden rok do konec leto 1992 obenem pa biti primerno urejen inštitut prisilen licenca v kolikor biti biti potreben po on poseči posebej biti v ta pogled pomemben 114. člen osnutek ki predvidevati prisilen licenca za tako imenovan vezan izum ki biti značilen za naš farmacevtski industrija"
"parl.ZbZdruDel","seja",35,"1991-12-11","10:20:00","13:05:00","PretnarBojan",0,"ZbZdruDel.1991-12-11.s035-01.sp-75","ZbZdruDel.1991-12-11.s035-01.sp-75.12",ZbZdruDel.1991-12-11.s035-01.toc-item9,"taxonomy.3.4.5","topic.211","nadalje biti omemba vreden izhodišče kontinuiteta namerno biti obdržati struktura bivši jugoslovanski zakon ki on tako doma kot v tujina zainteresiran krog poznati torej biti prehod na nov slovenski zakon relativno neproblematičen"
"parl.ZbZdruDel","seja",35,"1991-12-11","10:20:00","13:05:00","PretnarBojan",0,"ZbZdruDel.1991-12-11.s035-01.sp-75","ZbZdruDel.1991-12-11.s035-01.sp-75.13",ZbZdruDel.1991-12-11.s035-01.toc-item9,"taxonomy.3.4.5","topic.211","zadnji pomemben izhodišče biti praven varnost ki on morati zagotoviti ves domač in tuj nosilec sedaj veljaven oziroma prijavljen pravica industrijski lastnina ki on biti oziroma on biti priznati zvezen zavod za patent v Beograd ta problem urejevati 123. člen osnutek ki pa biti glede na razprava na zakonodajno-praven komisija v predlog zakon še popoln in biti predvideti možnost prenos pravica iz Beograd v Ljubljana z drug zoren kot spadati v ta izhodišče praven varnost tudi rešitev da se za ves soden spor z področje industrijski lastnina deligirati le en sodišče in sicer temeljen sodišče v Ljubljana z deligiranje biti namreč zagotovljen ustaljen soden praksa kar biti pomemben za takšen specifičen praven področje kot biti ta industrijski lastnina"
"parl.ZbZdruDel","seja",35,"1991-12-11","10:20:00","13:05:00","PretnarBojan",0,"ZbZdruDel.1991-12-11.s035-01.sp-75","ZbZdruDel.1991-12-11.s035-01.sp-75.14",ZbZdruDel.1991-12-11.s035-01.toc-item9,"taxonomy.3.4.5","topic.211","spoštovan lahko ti zagotoviti da biti pri priprava osnutek zakon sodelovati priznan domač in tuj strokovnjak in biti zato osnutek strokovno korekten seveda pričakovati do predlog zakon še sugestija in izboljšava kljub ta pa biti biti koncept zakonski ureditev skupaj z racionalen zasnova urad deležen širok podpora verjetno ti biti znan da biti urad republika Slovenija za varstvo industrijski lastnina najbrž en prvi državen slovenski institucija ki biti še pred formalen priznanje Slovenija uspeti skleniti sporazum o sodelovanje z patenten urad ZRN sporazum biti biti dogovorjen in podpisan 28. november letos v München med obisk delegacija ministrstvo za znanost in tehnologija v Nemčija ki on biti voditi minister dr. Tancig poleg ta osnutek zakon zakon že prevajati ker obstajati možnost da postati vzor za zakonodaja v ostal bivši socialističen država vzhoden in srednji Evropa za kateri v leto 1992 1993 svetoven organizacija za intelektualen lastnina ki imeti sedež v Genova predvidevati obsežen program tehničen pomoč"
"parl.ZbZdruDel","seja",35,"1991-12-11","10:20:00","13:05:00","PretnarBojan",0,"ZbZdruDel.1991-12-11.s035-01.sp-75","ZbZdruDel.1991-12-11.s035-01.sp-75.15",ZbZdruDel.1991-12-11.s035-01.toc-item9,"taxonomy.3.4.5","topic.211","na podlaga ves povedan ter na podlaga gradivo ki biti on prejeti ti v ime izvršen svet kot predlagatelj predlagati da vaš zbor danes sprejeti predlog za izdaja zakon o varstvo industrijski lastnina skupaj z osnutek zakon hvala lep"
"parl.ZbZdruDel","seja",35,"1991-12-11","10:20:00","13:05:00","ZupancicJoze1936",1,"ZbZdruDel.1991-12-11.s035-01.sp-76","ZbZdruDel.1991-12-11.s035-01.sp-76.2",ZbZdruDel.1991-12-11.s035-01.toc-item9,"taxonomy.3.4.5","topic.211","hvala lep gospod doktor tu imeti še zelo skrbno napisan razprava gospod Andrej Murn pisen ki on biti dati tudi izvršen svet"
