"orgId","type of session","number","date","notBefore","notAfter","persId","chairman","spId","uId","titleId","taxonomyIds","topicIds","lemmata"
"parl.ZbZdruDel","seja",29,"1991-09-12","13:15:00","14:50:00","ZupancicJoze1936",1,"ZbZdruDel.1991-09-12.s029-02.sp-247","ZbZdruDel.1991-09-12.s029-02.sp-247.12",ZbZdruDel.1991-09-12.s029-02.toc-item4,"taxonomy.3.10.2.3","topic.446","iti k 109. člen izvršen svet predlagati matičen odbor pa podpirati amandma v drug odstavek se beseda postati z dan uveljavitev ta zakon lastnica nadomestiti z beseda in drug praven oseba postati z dan uveljavitev ta zakon lastnica"
"parl.ZbZdruDel","seja",29,"1991-09-12","13:15:00","14:50:00","ZupancicJoze1936",1,"ZbZdruDel.1991-09-12.s029-02.sp-247","ZbZdruDel.1991-09-12.s029-02.sp-247.13",ZbZdruDel.1991-09-12.s029-02.toc-item4,"taxonomy.3.10.2.3","topic.446","kdo biti za ta amandma izvršen svet"
"parl.ZbZdruDel","seja",29,"1991-09-12","13:15:00","14:50:00","ZupancicJoze1936",1,"ZbZdruDel.1991-09-12.s029-02.sp-247","ZbZdruDel.1991-09-12.s029-02.sp-247.15",ZbZdruDel.1991-09-12.s029-02.toc-item4,"taxonomy.3.10.2.3","topic.446","biti kdo proti"
"parl.ZbZdruDel","seja",29,"1991-09-12","13:15:00","14:50:00","ZupancicJoze1936",1,"ZbZdruDel.1991-09-12.s029-02.sp-247","ZbZdruDel.1991-09-12.s029-02.sp-247.17",ZbZdruDel.1991-09-12.s029-02.toc-item4,"taxonomy.3.10.2.3","topic.446","se biti kdo vzdržati"
"parl.ZbZdruDel","seja",29,"1991-09-12","13:15:00","14:50:00","ZupancicJoze1936",1,"ZbZdruDel.1991-09-12.s029-02.sp-247","ZbZdruDel.1991-09-12.s029-02.sp-247.19",ZbZdruDel.1991-09-12.s029-02.toc-item4,"taxonomy.3.10.2.3","topic.446","ugotavljati da biti amandma sprejet"
"parl.ZbZdruDel","seja",29,"1991-09-12","13:15:00","14:50:00","ZupancicJoze1936",1,"ZbZdruDel.1991-09-12.s029-02.sp-247","ZbZdruDel.1991-09-12.s029-02.sp-247.20",ZbZdruDel.1991-09-12.s029-02.toc-item4,"taxonomy.3.10.2.3","topic.446","110. člen Franci Gradišar predlagati da se dodati nov drug odstavek ki se glasiti stanovanjski sklad delavec pri obrtnik v Slovenija postati z dan uveljavitev ta zakon lastnik stanovanje in stanovanjski hiša zgrajen in kupljen namensko za potreba ta delavec matičen odbor ne podpirati ker biti ta zajet v 108. člen"
"parl.ZbZdruDel","seja",29,"1991-09-12","13:15:00","14:50:00","ZupancicJoze1936",1,"ZbZdruDel.1991-09-12.s029-02.sp-247","ZbZdruDel.1991-09-12.s029-02.sp-247.22",ZbZdruDel.1991-09-12.s029-02.toc-item4,"taxonomy.3.10.2.3","topic.446","sam po se se ne moči ampak on lahko ti on umikati hvala"
"parl.ZbZdruDel","seja",29,"1991-09-12","13:15:00","14:50:00","ZupancicJoze1936",1,"ZbZdruDel.1991-09-12.s029-02.sp-247","ZbZdruDel.1991-09-12.s029-02.sp-247.23",ZbZdruDel.1991-09-12.s029-02.toc-item4,"taxonomy.3.10.2.3","topic.446","111. člen amandma zakonodajno-praven komisija beseda biti prenehati biti se nadomestiti z beseda biti izvršen svet praviti da biti ta v red"
"parl.ZbZdruDel","seja",29,"1991-09-12","13:15:00","14:50:00","ZupancicJoze1936",1,"ZbZdruDel.1991-09-12.s029-02.sp-247","ZbZdruDel.1991-09-12.s029-02.sp-247.24",ZbZdruDel.1991-09-12.s029-02.toc-item4,"taxonomy.3.10.2.3","topic.446","kdo biti za ta amandma"
"parl.ZbZdruDel","seja",29,"1991-09-12","13:15:00","14:50:00","ZupancicJoze1936",1,"ZbZdruDel.1991-09-12.s029-02.sp-247","ZbZdruDel.1991-09-12.s029-02.sp-247.26",ZbZdruDel.1991-09-12.s029-02.toc-item4,"taxonomy.3.10.2.3","topic.446","biti kdo proti"
"parl.ZbZdruDel","seja",29,"1991-09-12","13:15:00","14:50:00","ZupancicJoze1936",1,"ZbZdruDel.1991-09-12.s029-02.sp-247","ZbZdruDel.1991-09-12.s029-02.sp-247.28",ZbZdruDel.1991-09-12.s029-02.toc-item4,"taxonomy.3.10.2.3","topic.446","se biti kdo vzdržati"
"parl.ZbZdruDel","seja",29,"1991-09-12","13:15:00","14:50:00","ZupancicJoze1936",1,"ZbZdruDel.1991-09-12.s029-02.sp-247","ZbZdruDel.1991-09-12.s029-02.sp-247.30",ZbZdruDel.1991-09-12.s029-02.toc-item4,"taxonomy.3.10.2.3","topic.446","ugotavljati da biti amandma sprejet"
"parl.ZbZdruDel","seja",29,"1991-09-12","13:15:00","14:50:00","ZupancicJoze1936",1,"ZbZdruDel.1991-09-12.s029-02.sp-247","ZbZdruDel.1991-09-12.s029-02.sp-247.31",ZbZdruDel.1991-09-12.s029-02.toc-item4,"taxonomy.3.10.2.3","topic.446","112. člen amandma Majde Oblak ki pa on izvršen svet ne podpirati in matičen odbor tudi ne predlagati da se dodati nov 112. a člen ki se glasiti družben stanovanjski sklad biti biti pretežno zgrajen iz sredstvo stanovanjski prispevek zaposlen na podlaga svoj prispevek k ustvarjanje stanovanjski sklad republika Slovenija imeti vsak polnoleten državljan republika Slovenija ki stanovati v stanovanje družben stanovanjski sklad za vsak poln leto deloven doba v čas od 15. maj 1945 do dan uveljavitev ta zakon pravica do dinarski protivrednost povprečen cena 1 m2 stanovanjski površina družben stanovanjski sklad v republika Slovenija kot vrednost svoj lastninski delež na stanovanjski sklad republika Slovenija vrednost svoj lastninski delež lahko vsak polnoleten državljan republika Slovenija uveljaviti kot popust pri nakup stanovanje kot solastniški delež na stanovanje nad kateri biti doslej imeti stanovanjski pravica kot pravica do izplačilo obveznica republika Slovenija nominiran v valuta republika Slovenija z devizen klavzula izplačljiv v deset leten obrok od kateri prvi zapasti v plačilo po pretek prvi leto po uveljavitev zakon vrednost povprečen cena l m2 stanovanje ugotoviti in objaviti v rok trije mesec po uveljavitev pristojen minister izvršen svet in matičen odbor ta amandma ne podpirati Majda prositi"
"parl.ZbZdruDel","seja",29,"1991-09-12","13:15:00","14:50:00","OblakMajda1946",0,"ZbZdruDel.1991-09-12.s029-02.sp-248","ZbZdruDel.1991-09-12.s029-02.sp-248.2",ZbZdruDel.1991-09-12.s029-02.toc-item4,"taxonomy.3.10.2.3","topic.446","ta člen oziroma amandma biti pravzaprav v duh razprava ki biti on imeti včeraj včeraj biti nekateri razpravljalec predlagati da se delavec ki biti v pretekel leto iz svoj dohodek vlagati v stanovanjski fond ta na nek način povrniti ta amandma ta reševati na dosti human in sprejemljiv način"
"parl.ZbZdruDel","seja",29,"1991-09-12","13:15:00","14:50:00","ZupancicJoze1936",1,"ZbZdruDel.1991-09-12.s029-02.sp-249","ZbZdruDel.1991-09-12.s029-02.sp-249.2",ZbZdruDel.1991-09-12.s029-02.toc-item4,"taxonomy.3.10.2.3","topic.446","hvala gospod Jazbinšek"
"parl.ZbZdruDel","seja",29,"1991-09-12","13:15:00","14:50:00","JazbinsekMiha1941",0,"ZbZdruDel.1991-09-12.s029-02.sp-250","ZbZdruDel.1991-09-12.s029-02.sp-250.2",ZbZdruDel.1991-09-12.s029-02.toc-item4,"taxonomy.3.10.2.3","topic.446","human način imeti tudi osnoven zakon tu iti za vprašanje tehnika in sedaj biti ta tehnika malo pa da biti deloven doba zoper kriterij ta biti ta biti skušati skoz razglati da biti kriterij pač če začeti z deloven doba potem začeti z najemnina in tako naprej in ta se jaz vleči pri kar imeti ta člen kot posledica celo nek naturalen gospodarstvo in nek mešan odnos v stanovanje kar naenkrat se zgoditi da se 45 m2 dobiti v lastnina ostati biti še v lastnina ne vedeti kdo drug ali pa se imeti več deloven doba kolikor imeti m2 in tako naprej saj deloven doba biti biti kriterij za pridobitev stanovanjski pravica pa se potem ta dvakrat vpletati skratka ta biti eden tisti člen pri kateri se biti morati tudi 113. člen biti tak ta amandma biti še in še ko biti iti skozi ta amandma odločati za en princip"
"parl.ZbZdruDel","seja",29,"1991-09-12","13:15:00","14:50:00","JazbinsekMiha1941",0,"ZbZdruDel.1991-09-12.s029-02.sp-250","ZbZdruDel.1991-09-12.s029-02.sp-250.3",ZbZdruDel.1991-09-12.s029-02.toc-item4,"taxonomy.3.10.2.3","topic.446","osnoven princip ki jaz biti voditi pri ta ko biti ta pisati biti biti da se sistem popust vezati na značaj stanovanje ta se praviti če biti stanovanje star biti poceni potem biti dodati še ta amandma če biti stanovanje dotrajan se že pri točkoven sistem ta odpisati takoj ko začeti z popust na lastnost tisti ki kupovati priti potem do ta enkrat deloven doba enkrat stanarina enkrat invalidnost enkrat primeren stanovanje ne celo stanovanje enkrat 18 tisoč DEM in tako naprej in potem priti pri ta stvar do toliko različen kriterij ker ta amandma biti v nasprotje z ves drug da se zaplesti skratka priti do socialen kartica kot kriterij kot minister povedati pri nakup pri ta privatizacija iti na lastnost stanovanje ta se praviti star izrabljen in tako naprej imeti majhen vrednost pač pa iti potem skozi poceni kredit iz stanovanjski sklad in skozi stanovanjski nacionalen program vendar v razlika med socialen skupina in pa v razlika med poseben skupina pri pridobivanje reči nov denar tako da ta deloven doba ravnokar biti izglasovati kdo imeti prednost pri nek denar se biti verižiti stokrat notri in tako naprej ta biti treba gledati tudi v luč 113. člen jaz iti v ta da biti značaj stanovanje izhodišče za popust ne pa značaj tisti ki ta kupovati in ves paleta ta amandma se morati v en ali pa v drug smer obrniti in kolikor se biti obrniti v smer poseben kriterij ki biti vezan na tisti ki tam stanovati ne biti danes jutri in pojutrišnjem končati ta seja ker biti med se toliko kontradiktornost in biti morati iti v poseben sistem socialen kartica zelo razvejen sistem ki biti na konec prinesti kakšen 10 razlika pri kupnina zelo naporno zelo veliko ugotavljanje če iti obratno po lastnost fond biti mehanizem zelo preprost in začeti lahko prodajati jutri drugače biti pa kljuka pucati ta upravičenec z dokazilo ves vrsta še najti ne biti dokument da biti uveljavljati ta pravica on biti pucati še in še in jaz biti imeti delo še pa še"
"parl.ZbZdruDel","seja",29,"1991-09-12","13:15:00","14:50:00","ZupancicJoze1936",1,"ZbZdruDel.1991-09-12.s029-02.sp-251","ZbZdruDel.1991-09-12.s029-02.sp-251.2",ZbZdruDel.1991-09-12.s029-02.toc-item4,"taxonomy.3.10.2.3","topic.446","gospod minister pa biti spucati mikrofon še pa še prositi gospa Majda Oblak"
"parl.ZbZdruDel","seja",29,"1991-09-12","13:15:00","14:50:00","OblakMajda1946",0,"ZbZdruDel.1991-09-12.s029-02.sp-252","ZbZdruDel.1991-09-12.s029-02.sp-252.2",ZbZdruDel.1991-09-12.s029-02.toc-item4,"taxonomy.3.10.2.3","topic.446","glede na razprava minister in na sugestija ki biti jaz biti dan v klop biti amandma korigirati v besedilo in sicer da se črtati beseda ki stanovati v stanovanje družben stanovanjski sklad ves drug biti ostati meniti da z ta dobiti ves ki biti stanovati ali stanovati v družben stanovanje in tisti ki biti in biti se izgraditi svoj dom z lasten denar nek delež"
"parl.ZbZdruDel","seja",29,"1991-09-12","13:15:00","14:50:00","JazbinsekMiha1941",0,"ZbZdruDel.1991-09-12.s029-02.sp-253","ZbZdruDel.1991-09-12.s029-02.sp-253.2",ZbZdruDel.1991-09-12.s029-02.toc-item4,"taxonomy.3.10.2.3","topic.446","ta razbiti ves koncepcija ta zakon ta pomeniti da razdeliti državljanski delnica na ta fond iz naslov deloven doba kar na nek način pomeniti ta da biti treba začeti ta tehnika prestavljati da biti tudi tisti ki biti zgraditi lasten hiša začeti ugotavljati kakšen delež imeti tam kjer biti dati kredit in tako naprej potem ne vedeti kdo biti lastnik kaj povedati ti če začeti tako razmišljati pri ta pretok se ta številčno ne iziti jaz biti težko ta razložiti da se ta ne iziti če ta prečrtati ker biti vsak do sedaj zaposlen priti in biti hoteti reči v en družina biti se zgraditi svoj hiša in biti priti in zahtevati dva biti graditi iz nek nacionalen sklad ne vedeti kje se biti dobiti 90 m2 v last meniti tu lahko začeti pleteničiti ta se ne iziti osebno sicer dobronamernost ta želja lahko razumeti samo ta biti terjati ogromen kvantitativen preverba da se dokazati da tak amandma ne moči zdržati"
"parl.ZbZdruDel","seja",29,"1991-09-12","13:15:00","14:50:00","ZupancicJoze1936",1,"ZbZdruDel.1991-09-12.s029-02.sp-254","ZbZdruDel.1991-09-12.s029-02.sp-254.2",ZbZdruDel.1991-09-12.s029-02.toc-item4,"taxonomy.3.10.2.3","topic.446","dobro gospod Berglez"
"parl.ZbZdruDel","seja",29,"1991-09-12","13:15:00","14:50:00","BrglezStanislav1936",0,"ZbZdruDel.1991-09-12.s029-02.sp-255","ZbZdruDel.1991-09-12.s029-02.sp-255.2",ZbZdruDel.1991-09-12.s029-02.toc-item4,"taxonomy.3.10.2.3","topic.446","meniti da biti dolžen pojasniti stališče odbor tudi na odbor biti o ta kar trikrat razpravljati in biti precej različen mnenje ampak na konec biti se vendarle uskladiti na ta solucija ki biti biti tu v ta amandma predlagan biti mogoč ker sicer se potem ta problem navezovati na 113. člen kjer biti predlagati tudi sprememba o kateri biti v naslednji amandma nekaj povedati meniti da če hoteti začeti šteti leto potem morati tudi višina od pogledati ker na konec konec biti tisti ki imeti 4 krat velik plača 4 krat več dajati za stanovanjski sklad z prispevek itd. ker biti ta biti mera kako biti ta plačevati v preteklost na konec pa biti morati revalorizirati kredit in videti koliko biti kdo kredit vrniti koliko on biti še dolžen preprosto biti videti konec pri ta in zato odbor ta amandma ne podpirati in biti pač enkrat drugačen mnenje hvala lep"
"parl.ZbZdruDel","seja",29,"1991-09-12","13:15:00","14:50:00","ZupancicJoze1936",1,"ZbZdruDel.1991-09-12.s029-02.sp-256","ZbZdruDel.1991-09-12.s029-02.sp-256.2",ZbZdruDel.1991-09-12.s029-02.toc-item4,"taxonomy.3.10.2.3","topic.446","še gospod Gradišar"
"parl.ZbZdruDel","seja",29,"1991-09-12","13:15:00","14:50:00","GradisarFranc1945",0,"ZbZdruDel.1991-09-12.s029-02.sp-257","ZbZdruDel.1991-09-12.s029-02.sp-257.2",ZbZdruDel.1991-09-12.s029-02.toc-item4,"taxonomy.3.10.2.3","topic.446","glasovati biti proti amandma iz preprost razlog ker ta predviden privatizacija v ta zakon omogočati hitro enostavno in v narekovanje biti reči 80 ali pa 75 pravično ta ideja biti zelo dober in pravičen samo praktično biti neizvedljiv če jaz ta kriterij dati in on dati 10 ko on dati 10 on dati še 10 on imeti 20 in potem trajati ta do neskočnost hvala"
"parl.ZbZdruDel","seja",29,"1991-09-12","13:15:00","14:50:00","ZupancicJoze1936",1,"ZbZdruDel.1991-09-12.s029-02.sp-258","ZbZdruDel.1991-09-12.s029-02.sp-258.2",ZbZdruDel.1991-09-12.s029-02.toc-item4,"taxonomy.3.10.2.3","topic.446","v red gospod Jazbinšek še enkrat"
"parl.ZbZdruDel","seja",29,"1991-09-12","13:15:00","14:50:00","JazbinsekMiha1941",0,"ZbZdruDel.1991-09-12.s029-02.sp-259","ZbZdruDel.1991-09-12.s029-02.sp-259.2",ZbZdruDel.1991-09-12.s029-02.toc-item4,"taxonomy.3.10.2.3","topic.446","tak odnos pomeniti razglasiti za popolnoma nelegalen dosedanji sistem javen finance na stanovanjski področje ta pomeniti nazaj potegniti ves kar se biti 45 leto dogajati po sistem javen finance vzajemnost in solidarnost ta pomeniti brisati 45 leto zgodovina"
"parl.ZbZdruDel","seja",29,"1991-09-12","13:15:00","14:50:00","ZupancicJoze1936",1,"ZbZdruDel.1991-09-12.s029-02.sp-260","ZbZdruDel.1991-09-12.s029-02.sp-260.2",ZbZdruDel.1991-09-12.s029-02.toc-item4,"taxonomy.3.10.2.3","topic.446","predlagati da glasovati sedaj o ta amandma kot dopolnitev 112. člen z nov"
"parl.ZbZdruDel","seja",29,"1991-09-12","13:15:00","14:50:00","ZupancicJoze1936",1,"ZbZdruDel.1991-09-12.s029-02.sp-260","ZbZdruDel.1991-09-12.s029-02.sp-260.3",ZbZdruDel.1991-09-12.s029-02.toc-item4,"taxonomy.3.10.2.3","topic.446","oprostiti sedaj biti najprej ugotoviti prisotnost prositi prisoten biti 57 delegat"
"parl.ZbZdruDel","seja",29,"1991-09-12","13:15:00","14:50:00","ZupancicJoze1936",1,"ZbZdruDel.1991-09-12.s029-02.sp-260","ZbZdruDel.1991-09-12.s029-02.sp-260.4",ZbZdruDel.1991-09-12.s029-02.toc-item4,"taxonomy.3.10.2.3","topic.446","kdo biti za amandma ki on biti predlagati Majda Oblak"
"parl.ZbZdruDel","seja",29,"1991-09-12","13:15:00","14:50:00","ZupancicJoze1936",1,"ZbZdruDel.1991-09-12.s029-02.sp-260","ZbZdruDel.1991-09-12.s029-02.sp-260.6",ZbZdruDel.1991-09-12.s029-02.toc-item4,"taxonomy.3.10.2.3","topic.446","biti kdo proti"
"parl.ZbZdruDel","seja",29,"1991-09-12","13:15:00","14:50:00","ZupancicJoze1936",1,"ZbZdruDel.1991-09-12.s029-02.sp-260","ZbZdruDel.1991-09-12.s029-02.sp-260.8",ZbZdruDel.1991-09-12.s029-02.toc-item4,"taxonomy.3.10.2.3","topic.446","se biti kdo vzdržati"
"parl.ZbZdruDel","seja",29,"1991-09-12","13:15:00","14:50:00","ZupancicJoze1936",1,"ZbZdruDel.1991-09-12.s029-02.sp-260","ZbZdruDel.1991-09-12.s029-02.sp-260.10",ZbZdruDel.1991-09-12.s029-02.toc-item4,"taxonomy.3.10.2.3","topic.446","ugotavljati da amandma biti sprejet"
"parl.ZbZdruDel","seja",29,"1991-09-12","13:15:00","14:50:00","ZupancicJoze1936",1,"ZbZdruDel.1991-09-12.s029-02.sp-260","ZbZdruDel.1991-09-12.s029-02.sp-260.11",ZbZdruDel.1991-09-12.s029-02.toc-item4,"taxonomy.3.10.2.3","topic.446","zdaj priti k 113. člen ki imeti formalno 17 amandma od ta on morati jaz 14 obravnavati in o on sklepati iti po vrsta"
"parl.ZbZdruDel","seja",29,"1991-09-12","13:15:00","14:50:00","ZupancicJoze1936",1,"ZbZdruDel.1991-09-12.s029-02.sp-260","ZbZdruDel.1991-09-12.s029-02.sp-260.12",ZbZdruDel.1991-09-12.s029-02.toc-item4,"taxonomy.3.10.2.3","topic.446","najprej biti amandma gospod Andrej Šter prvi odstavek se spremeniti tako da se glasiti lastnik iz 107. 108. in prvi odstavek 109. ali iz 110. člen lahko na želja imetnik stanovanjski pravica ki biti imeti ta pravica na dan uveljavitev ta zakon v nadaljnji besedilo prejšnji imetnik stanovanjski pravica prodati ta prejšnji lastnik stanovanjski pravica breme prost stanovanje na kateri biti imeti stanovanjski pravica ob pisen privolitev prejšnji imetnik stanovanjski pravica lahko prodati ta stanovanje tudi njegov ožjemu družinski član izvršen svet ta amandma ne podpirati matičen odbor tudi ne"
"parl.ZbZdruDel","seja",29,"1991-09-12","13:15:00","14:50:00","JazbinsekMiha1941",0,"ZbZdruDel.1991-09-12.s029-02.sp-261","ZbZdruDel.1991-09-12.s029-02.sp-261.3",ZbZdruDel.1991-09-12.s029-02.toc-item4,"taxonomy.3.10.2.3","topic.446","tu biti treba načelno povedati imetnik stanovanjski pravica biti izenačen in imeti pravica do nakup ta pravica podjetje ne moči biti dan drugače ta zakon biti potreben"
"parl.ZbZdruDel","seja",29,"1991-09-12","13:15:00","14:50:00","ZupancicJoze1936",1,"ZbZdruDel.1991-09-12.s029-02.sp-262","ZbZdruDel.1991-09-12.s029-02.sp-262.2",ZbZdruDel.1991-09-12.s029-02.toc-item4,"taxonomy.3.10.2.3","topic.446","dobro kdo biti za amandma Andrej Šter k 113. člen"
"parl.ZbZdruDel","seja",29,"1991-09-12","13:15:00","14:50:00","ZupancicJoze1936",1,"ZbZdruDel.1991-09-12.s029-02.sp-262","ZbZdruDel.1991-09-12.s029-02.sp-262.4",ZbZdruDel.1991-09-12.s029-02.toc-item4,"taxonomy.3.10.2.3","topic.446","biti kdo proti"
"parl.ZbZdruDel","seja",29,"1991-09-12","13:15:00","14:50:00","ZupancicJoze1936",1,"ZbZdruDel.1991-09-12.s029-02.sp-262","ZbZdruDel.1991-09-12.s029-02.sp-262.6",ZbZdruDel.1991-09-12.s029-02.toc-item4,"taxonomy.3.10.2.3","topic.446","se biti kdo vzdržati"
"parl.ZbZdruDel","seja",29,"1991-09-12","13:15:00","14:50:00","ZupancicJoze1936",1,"ZbZdruDel.1991-09-12.s029-02.sp-262","ZbZdruDel.1991-09-12.s029-02.sp-262.8",ZbZdruDel.1991-09-12.s029-02.toc-item4,"taxonomy.3.10.2.3","topic.446","ugotavljati da amandma biti sprejet"
"parl.ZbZdruDel","seja",29,"1991-09-12","13:15:00","14:50:00","ZupancicJoze1936",1,"ZbZdruDel.1991-09-12.s029-02.sp-262","ZbZdruDel.1991-09-12.s029-02.sp-262.9",ZbZdruDel.1991-09-12.s029-02.toc-item4,"taxonomy.3.10.2.3","topic.446","amandma Marija Lončar v prvi odstavek se beseda biti dolžen prodati nadomestiti z beseda lahko prodati ter v zadnji odstavek se za beseda lastnik dodati besedilo v kolikor se za prodaja odločiti izvršen svet in matičen odbor ta amandma ne podpirati"
"parl.ZbZdruDel","seja",29,"1991-09-12","13:15:00","14:50:00","ZupancicJoze1936",1,"ZbZdruDel.1991-09-12.s029-02.sp-262","ZbZdruDel.1991-09-12.s029-02.sp-262.10",ZbZdruDel.1991-09-12.s029-02.toc-item4,"taxonomy.3.10.2.3","topic.446","kdo biti za amandma"
"parl.ZbZdruDel","seja",29,"1991-09-12","13:15:00","14:50:00","ZupancicJoze1936",1,"ZbZdruDel.1991-09-12.s029-02.sp-262","ZbZdruDel.1991-09-12.s029-02.sp-262.12",ZbZdruDel.1991-09-12.s029-02.toc-item4,"taxonomy.3.10.2.3","topic.446","biti kdo proti"
"parl.ZbZdruDel","seja",29,"1991-09-12","13:15:00","14:50:00","ZupancicJoze1936",1,"ZbZdruDel.1991-09-12.s029-02.sp-262","ZbZdruDel.1991-09-12.s029-02.sp-262.14",ZbZdruDel.1991-09-12.s029-02.toc-item4,"taxonomy.3.10.2.3","topic.446","se biti kdo vzdržati"
"parl.ZbZdruDel","seja",29,"1991-09-12","13:15:00","14:50:00","ZupancicJoze1936",1,"ZbZdruDel.1991-09-12.s029-02.sp-262","ZbZdruDel.1991-09-12.s029-02.sp-262.16",ZbZdruDel.1991-09-12.s029-02.toc-item4,"taxonomy.3.10.2.3","topic.446","ugotavljati da amandma biti sprejet"
"parl.ZbZdruDel","seja",29,"1991-09-12","13:15:00","14:50:00","ZupancicJoze1936",1,"ZbZdruDel.1991-09-12.s029-02.sp-262","ZbZdruDel.1991-09-12.s029-02.sp-262.17",ZbZdruDel.1991-09-12.s029-02.toc-item4,"taxonomy.3.10.2.3","topic.446","Boštjan Kovačič predlagati Boštjan praviti da umikati amandma k 113. člen"
"parl.ZbZdruDel","seja",29,"1991-09-12","13:15:00","14:50:00","ZupancicJoze1936",1,"ZbZdruDel.1991-09-12.s029-02.sp-262","ZbZdruDel.1991-09-12.s029-02.sp-262.19",ZbZdruDel.1991-09-12.s029-02.toc-item4,"taxonomy.3.10.2.3","topic.446",""
"parl.ZbZdruDel","seja",29,"1991-09-12","13:15:00","14:50:00","ZupancicJoze1936",1,"ZbZdruDel.1991-09-12.s029-02.sp-262","ZbZdruDel.1991-09-12.s029-02.sp-262.20",ZbZdruDel.1991-09-12.s029-02.toc-item4,"taxonomy.3.10.2.3","topic.446","potem biti pri amandma k 113. člen Božo Kočevar besedilo drug odstavek se spremeniti tako da glasiti prejšnji imetnik stanovanjski pravica oziroma ozek družinski član ki z on najmanj dva leto živeti v skupen gospodinjstvo imeti pri nakup pravica do popust v višina do 30 od vrednost stanovanje zmanjšan za njegov lastninski delež lasten udeležba in lasten vlaganje izvršen z soglasje lastnik ki se izražati v povprečen vrednost stanovanje in sicer po 1 za vsak leto skupen deloven doba prejšnji imetnik stanovanjski pravica in njegov zakonec oziroma ozek družinski član ki kupovati stanovanje pridobljen v Slovenija amandma izvršen svet in matičen deloven telo ne podpirati"
"parl.ZbZdruDel","seja",29,"1991-09-12","13:15:00","14:50:00","ZupancicJoze1936",1,"ZbZdruDel.1991-09-12.s029-02.sp-262","ZbZdruDel.1991-09-12.s029-02.sp-262.21",ZbZdruDel.1991-09-12.s029-02.toc-item4,"taxonomy.3.10.2.3","topic.446","kdo podpirati amandma Božo Kočevar"
"parl.ZbZdruDel","seja",29,"1991-09-12","13:15:00","14:50:00","ZupancicJoze1936",1,"ZbZdruDel.1991-09-12.s029-02.sp-262","ZbZdruDel.1991-09-12.s029-02.sp-262.23",ZbZdruDel.1991-09-12.s029-02.toc-item4,"taxonomy.3.10.2.3","topic.446","biti kdo proti"
"parl.ZbZdruDel","seja",29,"1991-09-12","13:15:00","14:50:00","ZupancicJoze1936",1,"ZbZdruDel.1991-09-12.s029-02.sp-262","ZbZdruDel.1991-09-12.s029-02.sp-262.25",ZbZdruDel.1991-09-12.s029-02.toc-item4,"taxonomy.3.10.2.3","topic.446","se biti kdo vzdržati"
"parl.ZbZdruDel","seja",29,"1991-09-12","13:15:00","14:50:00","ZupancicJoze1936",1,"ZbZdruDel.1991-09-12.s029-02.sp-262","ZbZdruDel.1991-09-12.s029-02.sp-262.27",ZbZdruDel.1991-09-12.s029-02.toc-item4,"taxonomy.3.10.2.3","topic.446","ugotavljati da amandma biti sprejet"
"parl.ZbZdruDel","seja",29,"1991-09-12","13:15:00","14:50:00","ZupancicJoze1936",1,"ZbZdruDel.1991-09-12.s029-02.sp-262","ZbZdruDel.1991-09-12.s029-02.sp-262.28",ZbZdruDel.1991-09-12.s029-02.toc-item4,"taxonomy.3.10.2.3","topic.446","potem imeti drug amandma Boštjan Kovačič ki on izvršen svet in matičen odbor ne podpirati tudi ta Boštjan umik"
"parl.ZbZdruDel","seja",29,"1991-09-12","13:15:00","14:50:00","ZupancicJoze1936",1,"ZbZdruDel.1991-09-12.s029-02.sp-262","ZbZdruDel.1991-09-12.s029-02.sp-262.29",ZbZdruDel.1991-09-12.s029-02.toc-item4,"taxonomy.3.10.2.3","topic.446","biti pri amandma Marija Lončar za kateri praviti da biti delno povzet v amandma odbor prejšnji imetnik stanovanjski pravica oziroma ozek družinski član imeti pri nakup pravica do popust v višina do 30 od vrednost stanovanje zmanjšan za njegov še ne vrnjen lasten udeležba"
"parl.ZbZdruDel","seja",29,"1991-09-12","13:15:00","14:50:00","ZupancicJoze1936",1,"ZbZdruDel.1991-09-12.s029-02.sp-262","ZbZdruDel.1991-09-12.s029-02.sp-262.30",ZbZdruDel.1991-09-12.s029-02.toc-item4,"taxonomy.3.10.2.3","topic.446","amandma odbor pa se glasiti drug odstavek se spremeniti in se glasiti prejšnji imetnik stanovanjski pravica oziroma njegov ozek družinski član imeti pri nakup stanovanje pravica do popust v višina 30 od vrednost stanovanje zmanjšan za še nerealno vrnjen lasten udeležba in za lasten vlaganje ki se odražati v povečan vrednost stanovanje ta amandma izvršen svet podpirati Marija Lončar amandma umik"
"parl.ZbZdruDel","seja",29,"1991-09-12","13:15:00","14:50:00","ZupancicJoze1936",1,"ZbZdruDel.1991-09-12.s029-02.sp-262","ZbZdruDel.1991-09-12.s029-02.sp-262.31",ZbZdruDel.1991-09-12.s029-02.toc-item4,"taxonomy.3.10.2.3","topic.446","amandma Majde Oblak v drug odstavek se besedilo v višina 30 od vrednost stanovanje nadomestiti z besedilo v višina vrednost svoj lastninski delež na stanovanjski prispevek v sklad z 112. a člen ta zakon ker pa ta biti sprejeti 112. a člen ta kar biti sedaj kot deveti predlog prebrati Majda Oblak umikati"
"parl.ZbZdruDel","seja",29,"1991-09-12","13:15:00","14:50:00","ZupancicJoze1936",1,"ZbZdruDel.1991-09-12.s029-02.sp-262","ZbZdruDel.1991-09-12.s029-02.sp-262.32",ZbZdruDel.1991-09-12.s029-02.toc-item4,"taxonomy.3.10.2.3","topic.446","biti še vedno pri 113. člen in sicer Franci Erce drug odstavek se spremeniti tako da se glasiti prejšnji imetnik stanovanjski pravica oziroma ozek družinski član imeti pri nakup pravica do popust v višina 30 od vrednost primeren stanovanje zmanjšan za njegov lastninski delež lasten udeležba in lasten vlaganje izvršen z soglasje lastnik ki se izražati v povprečen vrednost stanovanje do popust biti upravičen imetnik stanovanjski pravica ki že imeti lastninski pravica na kakšen drug stanovanje stanovanjski hiša ali nepremičnina velik vrednost kot biti posestvo počitniški hiša plovilo dolžina najmanj 8 m. izvršen svet in matičen odbor ta ne podpirati"
