"orgId","type of session","number","date","notBefore","notAfter","persId","chairman","spId","uId","titleId","taxonomyIds","topicIds","lemmata"
"parl.ZbZdruDel","seja",29,"1991-09-12","15:10:00","20:00:00","DretnikIvan1921",0,"ZbZdruDel.1991-09-12.s029-02.sp-294","ZbZdruDel.1991-09-12.s029-02.sp-294.5",ZbZdruDel.1991-09-12.s029-02.toc-item5,"taxonomy.3.6.1.2","topic.225","predlog zakon o zadruga omogočati združevanje tisti član ki imeti namen pospeševati isti gospodarski korist določiti ta zakon predvidevati več vrsta zadruga med on tudi kmetijski na splošen urejati status zadruga medsebojen odnos pa vsak zadruga urediti z sprejet zadružen pravilo z predlog zakon o zadruga se kmet načelno strinjati sporen jabolko pa biti tisti zaradi kar biti najbolj pogosto prepir pri vsak bajta zaradi denar v ta primer biti delitev zadružen premoženje kmet namreč vztrajati da biti treba razčistiti vračanje zadružen premoženje in združen vložen ali prenesen sredstvo ter lastninjenje premoženje ustvarjen v trajen sodelovanje z zadružen organizacija kmet kot tržen proizvajalec se namreč hoteti zagotoviti tisti pravica za kateri biti biti v preteklost vselej prikrajšan naš proizvoden proces se namreč vedno končati tam kjer biti važen faza pri prodaja proizvod posrednik ta biti predelovalen industrija in trgovina zajemati z velik žlica delež ki pripadati kmet proizvajalec posledica ta biti da biti cena kmetijski proizvod za potrošnik relativno visok kmet pa imeti pokrit niti proizvoden strošek da o akumulacija ki biti za nadaljnji vlaganje nujno potreben niti ne govoriti ugotovljen biti da biti naš kmet pod enak pogoj enako produktiven in konkurenčen kot kmet na zahod predelovalen industrija biti zame dvakrat drag trgovina trikrat bančen storitev pa za desetkrat drago ta pomeniti da prodajen cena kmetijski proizvod dvigovati posrednik odkupen cena za kmet pa nikoli biti stimulativen ta cenoven razlika biti prejšnji režim skušati ublažiti z razen intervencijski sredstvo ki on biti zbirati na več način največ od potrošnik z tak sistem reševanje ta kočljiv vprašanje biti prihajati večkrat do očitek da potrošnik kmet socialno podpirati kar pa biti biti le obratno res ta sistem pospeševanje kmetijstvo se do nek mera uporabljati tudi sedaj čeprav na veliko govoriti o tako imenovan tržen gospodarstvo"
"parl.ZbZdruDel","seja",29,"1991-09-12","15:10:00","20:00:00","DretnikIvan1921",0,"ZbZdruDel.1991-09-12.s029-02.sp-294","ZbZdruDel.1991-09-12.s029-02.sp-294.6",ZbZdruDel.1991-09-12.s029-02.toc-item5,"taxonomy.3.6.1.2","topic.225","kmet upravičeno zahtevati da se ta stanje narediti konec kmet kot tržen predelovalec morati imeti svoj vpliv do končen faza proizvoden veriga ta jaz biti omogočen če biti imeti večinski delež in vpliv v predelovalen industrija"
"parl.ZbZdruDel","seja",29,"1991-09-12","15:10:00","20:00:00","DretnikIvan1921",0,"ZbZdruDel.1991-09-12.s029-02.sp-294","ZbZdruDel.1991-09-12.s029-02.sp-294.7",ZbZdruDel.1991-09-12.s029-02.toc-item5,"taxonomy.3.6.1.2","topic.225","zakon o zadruga biti torej pred jaz drug zbor biti on že obravnavati na zadnji seja jaz pa biti on zavrniti z sklep da se uvrstiti na dneven red naslednji seja ta biti na današnji seja ta sklep pa biti včeraj skoraj ves pojesti in komaj komaj biti ostati na dneven red ta jaz biti res neprijetno presenetiti še bolj presenetiti pa jaz biti ta nadebuden izjava ali napoved ki biti biti na ta mesto dvakrat izrečen namreč da biti iz ta zakon o zadruga 10. poglavje ki govoriti o zadružen premoženje črtati in da biti ta vprašanje urediti z zakon o denacionalizacija verjeti da z ta manever ne biti prikrajšan naš delež izničiti ampak on biti izminirati prav tam kjer on prav krepko potrebovati namreč kot delež kot lastninski delež na podlaga kateri biti lahko soodločati v naš predelovalen industrija tukaj v zbor jaz biti 8 kmet se praviti točno desetina ves član zbor in ta manjšina lahko ti gladko preglasovati ta majhen manjšina pa zastopati kmetijski področje in z ta interes kmet z področje ves Slovenija in zato biti naš svet dolžnost da zagovarjati pravica in interes kmet v ta zakon o zadruga"
"parl.ZbZdruDel","seja",29,"1991-09-12","15:10:00","20:00:00","DretnikIvan1921",0,"ZbZdruDel.1991-09-12.s029-02.sp-294","ZbZdruDel.1991-09-12.s029-02.sp-294.8",ZbZdruDel.1991-09-12.s029-02.toc-item5,"taxonomy.3.6.1.2","topic.225","v slovenski skupščina biti trije kmet slučajno vsak v en zbor ki se lahko ponašati z ta da biti že sodelovati pri ustanavljanje prvi splošen kmetijski zadruga glaven motiv za ta da biti iti v ta korak biti biti vsaj tako biti biti jaz tolmačen če se tako po domače izraziti da tako združen kmet biti lahko in bolj ugodno nabavljati potrošen material takrat biti tako reči danes se reči bolj učeno reprodukcijski repromaterial po drug stran pa biti lahko lahko prodajati svoj izdelek ali bolj učeno povedan solidarnost vzajemnost in učinkovitost ta biti zadružen prvina ki premagovati političen in gospodarski kriza v vsak obdobje kako biti se ta zadružen prvina uresničevati biti kmet doživeti kmalu po ustanovitev zadruga najprej se jaz biti izmuzniti zadružen trgovina po razen zakon ne le da kmet biti moči poceni nakupovati repromaterial v določen primer biti on plačevati celo drago kot v drug trgovina da ne govoriti o nabava kmetijski mehanizacija kar pa takrat biti biti krivda zadružen trgovina kajti v ta obdobje biti biti nabava mehanizacija za zaseben kmet prepovedan kosilnica v roka privaten kmet biti isti kakor strojnica proti socializem ta biti zgodovinski beseda naš velik slovenski politik in teoretik"
"parl.ZbZdruDel","seja",29,"1991-09-12","15:10:00","20:00:00","DretnikIvan1921",0,"ZbZdruDel.1991-09-12.s029-02.sp-294","ZbZdruDel.1991-09-12.s029-02.sp-294.9",ZbZdruDel.1991-09-12.s029-02.toc-item5,"taxonomy.3.6.1.2","topic.225","po drug stran pa biti biti sistematično in počasi izrinjen tudi iz upravljanje v zadruga prav srečen biti lahko biti če biti imeti četrtina kmet v zadružen svet kakšen pa biti stanje danes vedeti saj se ta stanje nadaljevati kmet biti še zmeraj odvisen od naš predelovalen industrija primer v naš kraj biti ta klavnica in mlekarna pogledati on jaz povečevati zamik mleko na 2 do 3 mesec na primer mlekarna Celje jaz biti še danes dolžen pol izplačilo za mleko ki biti on on dobaviti v čas vojna ta biti v mesec julij danes pa biti 15. september in še ne vedeti povedati kdaj biti ta plačan čeprav biti morati že izplačati mleko oddan v mesec avgust ta stanje se morati nehati in prav z ta zakon misliti doseči da biti kot soupravljalec v predelovalen industrija z svoj delež lahko imeti svoj vpliv tudi do končen faza naš proizvoden veriga"
"parl.ZbZdruDel","seja",29,"1991-09-12","15:10:00","20:00:00","DretnikIvan1921",0,"ZbZdruDel.1991-09-12.s029-02.sp-294","ZbZdruDel.1991-09-12.s029-02.sp-294.10",ZbZdruDel.1991-09-12.s029-02.toc-item5,"taxonomy.3.6.1.2","topic.225","spoštovan poslanka in poslanec upati da biti jaz na podlaga podan argument pravilno razumeti in da biti tako tudi glasovati hvala"
"parl.ZbZdruDel","seja",29,"1991-09-12","15:10:00","20:00:00","ZupancicJoze1936",1,"ZbZdruDel.1991-09-12.s029-02.sp-295","ZbZdruDel.1991-09-12.s029-02.sp-295.2",ZbZdruDel.1991-09-12.s029-02.toc-item5,"taxonomy.3.6.1.2","topic.225","hvala prositi gospod Prelovec"
"parl.ZbZdruDel","seja",29,"1991-09-12","15:10:00","20:00:00","PrelovecValentin1934",0,"ZbZdruDel.1991-09-12.s029-02.sp-296","ZbZdruDel.1991-09-12.s029-02.sp-296.2",ZbZdruDel.1991-09-12.s029-02.toc-item5,"taxonomy.3.6.1.2","topic.225","spoštovan kolega kolegica gospod predsednik imeti kaj z ves moč kakor on pač zmoči nek poslanec biti podpreti razpravljalec pred jaz ki biti povedati tegoba ki biti kmet spremljati in njihov današnji težnja da uresničiti tisti kar on iti"
"parl.ZbZdruDel","seja",29,"1991-09-12","15:10:00","20:00:00","PrelovecValentin1934",0,"ZbZdruDel.1991-09-12.s029-02.sp-296","ZbZdruDel.1991-09-12.s029-02.sp-296.3",ZbZdruDel.1991-09-12.s029-02.toc-item5,"taxonomy.3.6.1.2","topic.225","hkrati pa morati v sam predgovor povedati da biti iz drug območje ta se praviti iz obrt iz kooperacija nad ta zakon v določen poglavje razočaran kljub ta da biti v odbor dajati naš zahteva po določen sprememba da biti zakon obravnavati tudi obrt se ta biti zgoditi da biti bolj precizen v Slovenija imeti 106 obrten zadruga ki biti on v ta zakon malo pozabiti namreč treba biti vedeti kako biti ta zadruga nastajati kakšen biti težnja danes ta zadružnik kako biti naj se lastniniti oziroma kako naj biti ta zadružnik priti do kapital privaten kapital ta biti specifičen primer kako biti priti do ta kapital skozi ta zakon dan biti biti predlog za ta biti pa biti upoštevan"
"parl.ZbZdruDel","seja",29,"1991-09-12","15:10:00","20:00:00","PrelovecValentin1934",0,"ZbZdruDel.1991-09-12.s029-02.sp-296","ZbZdruDel.1991-09-12.s029-02.sp-296.4",ZbZdruDel.1991-09-12.s029-02.toc-item5,"taxonomy.3.6.1.2","topic.225","jaz biti v 53. člen dvakrat oziroma trikrat se ponavljati skozi ta zakon želeti napisati da se odgovarjati resoren ministrstvo ne pa kmečki ministrstvo ta točno kazati da se ta naš težnja iz zakon sam izdvaj vsekakor se strinjati z predgovornik da biti treba poseben teža dati lastninjenje t. i. reproverigi spraševati se zakaj ta počenjati skozi ta zakon mogoč jaz ta ne uspevati razumeti in tudi nekateri drug ali ne moči ta urejevati zakon o lastninjenje podjetje z poseben poglavje in tukaj 10. poglavje na ta način ne biti biti sporen"
"parl.ZbZdruDel","seja",29,"1991-09-12","15:10:00","20:00:00","PrelovecValentin1934",0,"ZbZdruDel.1991-09-12.s029-02.sp-296","ZbZdruDel.1991-09-12.s029-02.sp-296.5",ZbZdruDel.1991-09-12.s029-02.toc-item5,"taxonomy.3.6.1.2","topic.225","tukaj biti dati tudi pisen obrazložitev on biti kar prečitati osnoven koncept zakon ki se nanašati na ustanavljanje in ureditev zadruga ocenjevati socialdemokratski stranka Slovenija kot velik prispevek ureditev ta področje in poudarjati zlasti pomen ta zakon tudi za proizvajalen in potrošniški zadruga imeti pa resen načelen pomislek k 10. poglavje ta zakon ki po naš ocena pomeniti nesistematski pristop in izjesti od splošen načelo lastninski preoblikovanje dosedanji družben in zadružen lastnina organizacija ki biti zajet v ta poglavje še zlasti pa v 53. člen namreč predstavljati v bistvo kar dvakraten izjema od splošen princip najprej panožen izjema kljub ta da biti zakon o zadruga splošen se podan rešitev v 10. poglavje nanašati le na kooperantski odnos v kmetijstvo ta poudarjati ne pa tudi na odnos z drug območje industrija obrt tudi tu biti biti kooperantstvo in biti z kooperacija nastajati nek skupen kapital in temelj kapital"
"parl.ZbZdruDel","seja",29,"1991-09-12","15:10:00","20:00:00","PrelovecValentin1934",0,"ZbZdruDel.1991-09-12.s029-02.sp-296","ZbZdruDel.1991-09-12.s029-02.sp-296.6",ZbZdruDel.1991-09-12.s029-02.toc-item5,"taxonomy.3.6.1.2","topic.225","potem stanovanjski gospodarstvo potem pa še posamičen izjema v okvir kmetijski oziroma živilski predelovalen panoga na podlaga spisek ki biti priloga zakon podpirati sam rešitev iz 56. člen zakon ki dajati poleg zaposlen v ta organizacija prednosten pravica tudi upravičenec iz zadruga ki biti poslovno sodelovati z omenjen organizacija z ta biti postavljen zaposlen in kooperant v enakopraven položaj hkrati pa biti zagotovljen tudi materialen povezava med primaren proizvodnja in predelava na ta področje zavzemati se da se ves ostal rešitev preobrazba družben lastnina na področje živilstvo reševati v okvir splošen zakon o privatizacija vedeti kaj pomeniti izjema v zakon jaz biti imeti lanski leto priložnost ta poslušati ko biti poslanec zahtevati izjema v davčen zakon rečen biti biti ustvariti biti precedens in podreti moč zakon ta se praviti če zahtevati eden izjema biti drug točno toliko upravičen do takšen izjema zaradi ta ne odrekati noben pravica kmet da se ta reproveriga o lastnina urediti tako kot tukaj praviti vendar biti se morati ta prenesti v zakon o lastninjenje takšen biti moj mišljenje ostati biti podati v amandma ta biti toliko da ne biti veljati čitati in biti razpravljati oziroma povedati takrat ko biti amandma na vrsta hvala lep"
"parl.ZbZdruDel","seja",29,"1991-09-12","15:10:00","20:00:00","ZupancicJoze1936",1,"ZbZdruDel.1991-09-12.s029-02.sp-297","ZbZdruDel.1991-09-12.s029-02.sp-297.2",ZbZdruDel.1991-09-12.s029-02.toc-item5,"taxonomy.3.6.1.2","topic.225","hvala lep javiti se biti gospod Ban"
"parl.ZbZdruDel","seja",29,"1991-09-12","15:10:00","20:00:00","BanFranc1938",0,"ZbZdruDel.1991-09-12.s029-02.sp-298","ZbZdruDel.1991-09-12.s029-02.sp-298.2",ZbZdruDel.1991-09-12.s029-02.toc-item5,"taxonomy.3.6.1.2","topic.225","že na en zadnji seja biti reči da načelno imeti pripomba na zakon o zadruga v ta celoten del ki govoriti o organiziranje kmetijski proizvajalec in ves drug biti močno sporen 10. poglavje ker se v amandma v nasprotje z 55. člen pojavljati zahteva po 51 prenos in širiti spisek opredeliti se biti dokaj argumentirano do trije štirje konkreten vprašanje ki on zelo dobro poznati in ker prizadeti direktno tudi firma Merx iz kateri izhajati"
"parl.ZbZdruDel","seja",29,"1991-09-12","15:10:00","20:00:00","BanFranc1938",0,"ZbZdruDel.1991-09-12.s029-02.sp-298","ZbZdruDel.1991-09-12.s029-02.sp-298.3",ZbZdruDel.1991-09-12.s029-02.toc-item5,"taxonomy.3.6.1.2","topic.225","prvi stvar pri seznam podjetje biti na šesti mesto postavljen družbeno danes še podjetje čeprav biti že v preobrazba Merx-Mesarstvo Jurij Šentjur ta klavnica da poenostavljen reči biti biti v obdobje pet šest leto nazaj na Janezov spisek za likvidacija skupen med šestintrideset klavnica v Slovenija Janezov spisek praviti zato ker biti Janez Zemljarič ukinjati fabrika obrat itd. jaz biti se ta upreti in iz propadajoč klavnica ustvariti moderen klavnica ne vedeti če on biti minister Osterc že videti ta biti sodoben klavnica pri ta biti treba reči da biti se oborožiti z podatek kako biti teči kooperacijski odnos kako biti teči ta nekdanji včasih biti ta reči reproveriga iz kateri sredstvo konkretno biti biti kaj zgrajen tu biti opozoriti v ta primer in še nekateri drug da biti biti v nerazvit področje angažiran velik sredstvo iz tako imenovan FN sklad fond za nerazvit ker biti ta najmanj nerazvit področje"
"parl.ZbZdruDel","seja",29,"1991-09-12","15:10:00","20:00:00","BanFranc1938",0,"ZbZdruDel.1991-09-12.s029-02.sp-298","ZbZdruDel.1991-09-12.s029-02.sp-298.4",ZbZdruDel.1991-09-12.s029-02.toc-item5,"taxonomy.3.6.1.2","topic.225","narediti biti tudi izračun in vedeti se kaj biti biti v ta obdobje ki on zakon opredeljevati koliko in kako biti zadeva teči iz konkreten kooperacijski odnos zato meniti da biti absolutno nesprejemljiv prenos ta knjigovodski vrednost 51 misliti tudi da biti nesprejemljivo 40 ne misliti pa da biti nič vendar biti treba od primer do primer videti in potem iz konkreten situacija izhajati"
"parl.ZbZdruDel","seja",29,"1991-09-12","15:10:00","20:00:00","BanFranc1938",0,"ZbZdruDel.1991-09-12.s029-02.sp-298","ZbZdruDel.1991-09-12.s029-02.sp-298.5",ZbZdruDel.1991-09-12.s029-02.toc-item5,"taxonomy.3.6.1.2","topic.225","drug stvar pri izgradnja danes biti biti že omenjen mlekarna v Arji vas biti Merx vložiti preko 20 delavec Merx ta podatek biti znan ta biti treba rešpektirati od takraten predračunski vrednost skupno seveda z kasen podražitev biti biti en glaven kar biti logičen glede na funkcija Merx za preskrba ta širok območje ta pomeniti da biti ves naš maloprodaja podatek zbrati in biti terjati svoj status takšen ali drugačen kako se biti tale cirkus razplesti tale hip preprosto ne vedeti opozarjati na ta da biti Merx opravljati in opravljati še danes poleg vlaganje v proizvodnja hrana tudi varen in zagotovljen preskrba ta velik območje skoraj 18 Slovenija pokrivati"
"parl.ZbZdruDel","seja",29,"1991-09-12","15:10:00","20:00:00","BanFranc1938",0,"ZbZdruDel.1991-09-12.s029-02.sp-298","ZbZdruDel.1991-09-12.s029-02.sp-298.6",ZbZdruDel.1991-09-12.s029-02.toc-item5,"taxonomy.3.6.1.2","topic.225","tretji stvar v tovarna sladkor Ormož biti Merx vložiti 11 in po ta ključ ves leto tudi sprejemati za oskrba količina sladkor ta govoriti iz preprost razlog ker biti treba ugotoviti kaj in kako biti iti pri ta velik živilski predelovalen kompleks ta biti nov stvar zadnji deset leto preskrbovalen trgovina in preskrbovalen organizacija biti z velik razumevanje in delavec biti se odpovedati vlagati nepovratno ta morati poudariti jaz biti ta ves odpisati ta biti nepovraten ta biti kredit ker biti biti dogovor takšen da ta obrat ne biti moči vlagati in biti namenoma majhen izguba prikazovati zato da ne biti vračati"
"parl.ZbZdruDel","seja",29,"1991-09-12","15:10:00","20:00:00","BanFranc1938",0,"ZbZdruDel.1991-09-12.s029-02.sp-298","ZbZdruDel.1991-09-12.s029-02.sp-298.7",ZbZdruDel.1991-09-12.s029-02.toc-item5,"taxonomy.3.6.1.2","topic.225","ker tudi zelo dobro poznati biti še en primer povedati na deseti mesto biti celjski mesnina velik klavnica ki imeti status klavnica EGS ta biti gotovo v zadnji pet leto če biti prav podatek najbrž minister z on razpolaga biti med 5 in 6 glede na proizvoden kapaciteta oskrbovan iz kooperacijski odnos ker biti biti ugoden in poceni uvažati zmrznjen meso za predelava iz Bolgarija Romunija Poljska itd."
"parl.ZbZdruDel","seja",29,"1991-09-12","15:10:00","20:00:00","BanFranc1938",0,"ZbZdruDel.1991-09-12.s029-02.sp-298","ZbZdruDel.1991-09-12.s029-02.sp-298.8",ZbZdruDel.1991-09-12.s029-02.toc-item5,"taxonomy.3.6.1.2","topic.225","danes biti priti na miza še en amandma ki dajati na spisek tudi merxov kisarna v Šempeter v savinjski dolina podatek da merxov kisarna kis okrog 1000 tona zelje in on tudi plasirati na tržišče biti točen morati povedati da se strinjati da priti ta na spisek samo jutri biti dati nalog da takoj kooperant obvestiti da se kooperant ki biti dobavitelj zelje v ta kisarna opredeliti najprej in da on povedati kako ta relacija teči morati zelo naravnost reči če jaz ne biti želeti v neposreden bližina organizirati proizvodnja zelje proizvodnja zelje biti visoko rentabilen pri ravninski kmet ki imeti zemlja in če biti pred nos kisarna ki zagotoviti plasma zelje da se razumeti biti problem zelje proizvesti problem biti varen sigurno plasirati vsak leto dostikrat biti tudi sodelovati v prepir od kateri kmet biti vzeti ker biti biti kapaciteta veliko velik tudi v letošnji leto biti zavračati količina zelje ki biti v osnova 100 nizko pripeljan iz Varaždin in Čakovec ta kisarna biti biti kakršen biti biti pred leto danes biti ta moderen kisarna in na hiter se videti vabljiv zadeva dosti preprost tu biti proizvajalec tu biti kisarna in plasma jaz se prizadevati in uraden politika se prizadevati kar biti gospod Dretnik prej govoriti da morati priti do poceni hrana surovina biti kupovati za plasma za oskrba prebivalec tam kjer biti poceni kjer biti kvaliteta zagotovljen itd. močno se bati da se biti začeti ta ustaljen pot in veriga brez potreba trgati ta primer biti bistveno drugačen od mlekarna od mesno-predelovalen kompleks"
"parl.ZbZdruDel","seja",29,"1991-09-12","15:10:00","20:00:00","BanFranc1938",0,"ZbZdruDel.1991-09-12.s029-02.sp-298","ZbZdruDel.1991-09-12.s029-02.sp-298.9",ZbZdruDel.1991-09-12.s029-02.toc-item5,"taxonomy.3.6.1.2","topic.225","torej če se hoteti povzročiti težava na področje stabilen oskrba potem predlagati da resno razmišljati o 10. poglavje vendar poudarjati da se zavzemati da črtati ves tukaj biti treba narediti korak naprej samo apetit da se 51 prenesti odvzeti in prenesti biti nerealen in biti povzročiti brez pravi potreba strahovit težava meniti da biti treba ves ta argument ta biti še veliko upoštevati in najbrž pristati prej biti zunaj srečati gospod Frelih in biti on reči pa dobro kam riniti zdaj kar enainpedeset ali se zavedati kakšen špetir povzročati kaj biti povzročiti v ta ustaljen pot ker v večina primer biti nek ustaljen pot vedeti kaj jaz biti reči pa se zmeniti saj biti lahko tudi 35 samo zmeniti se ne vedeti če tudi uradno tako govoriti glas iz klop tako zato biti tudi on vprašati ker on in gospod Podobnik biti glaven v ta predložen amandma"
"parl.ZbZdruDel","seja",29,"1991-09-12","15:10:00","20:00:00","BanFranc1938",0,"ZbZdruDel.1991-09-12.s029-02.sp-298","ZbZdruDel.1991-09-12.s029-02.sp-298.10",ZbZdruDel.1991-09-12.s029-02.toc-item5,"taxonomy.3.6.1.2","topic.225","torej predlagati da se v ta in še v nekateri primer vendarle za ta petleten obdobje realno analizirati blagoven tok in tok surovina predelava trg ker iti za pomemben obrat fabrika živilski predelovalen industrija drug da na ta osnova na ta predpostavka priti do normalen procent ali biti ta 30 ali biti ta 40 ali 35 ta ne vedeti samo za inat vztrajati na 51 vedeti kaj pomeniti 51. in biti pravi čas in biti pravi trenutek da biti na ta tako pomemben področje stvar komplicirati že dvanajst leto delati na ta živilsko-predelovalen trgovski delo vedno biti najti ustrezen rešitev ob moder politika blagoven rezerva Slovenija da biti biti preskrba prebivalstvo Slovenija stabilen takrat ko po Jugoslavija biti nič štimati ta se spomniti mnog štirje pet leto nazaj biti biti predvsem zaradi ta ker biti ta reproveriga na tak ali drugačen način delovati lahko biti še veliko diskutirati o ta ali biti hrana predrag ali biti prepoceni ta biti ob vstop v Evropa Slovenija kot samostojen država začeti sam regulirati"
"parl.ZbZdruDel","seja",29,"1991-09-12","15:10:00","20:00:00","BanFranc1938",0,"ZbZdruDel.1991-09-12.s029-02.sp-298","ZbZdruDel.1991-09-12.s029-02.sp-298.11",ZbZdruDel.1991-09-12.s029-02.toc-item5,"taxonomy.3.6.1.2","topic.225","prej ko biti biti odsoten biti imeti en ura zelo pomemben razgovor nekateri pripravljati intervencijski uvoz nekateri proizvod ki on na naš tržišče biti in ko gledati kaj ves ta biti kakšen biti cena itd. človek ne moči razumeti da tudi ves ta velik šticunga če on pridati pa biti še vedno marsikateri proizvod poceni kot biti v ta trenutek na naš tržišče hvala lep"
"parl.ZbZdruDel","seja",29,"1991-09-12","15:10:00","20:00:00","ZupancicJoze1936",1,"ZbZdruDel.1991-09-12.s029-02.sp-299","ZbZdruDel.1991-09-12.s029-02.sp-299.2",ZbZdruDel.1991-09-12.s029-02.toc-item5,"taxonomy.3.6.1.2","topic.225","hvala beseda imeti Mirjana Bekeš predstavnica gospodarski zbornica Slovenija"
"parl.ZbZdruDel","seja",29,"1991-09-12","15:10:00","20:00:00","BekesMirjana",0,"ZbZdruDel.1991-09-12.s029-02.sp-300","ZbZdruDel.1991-09-12.s029-02.sp-300.2",ZbZdruDel.1991-09-12.s029-02.toc-item5,"taxonomy.3.6.1.2","topic.225","v ime gospodarski zbornica biti rad samo opozoriti na stališče ki on biti sprejeti naš upraven odbor ta pa biti pripomba oziroma amandma ki biti hkrati načelen pa tudi konkreten narava ta biti da se celotno 10. poglavje črta namen ta amandma biti kot biti lahko iz razprava moj predhodnik sklepati oziroma en od prejšnji razprava da biti zavirati razvoj zadružništvo pač pa ugotavljati da predlagan 10. poglavje ne urejati specifika zadružništvo temveč vprašanje lastninjenje in vračanje odvzet premoženje na drugačen osnova kot biti ta urejen v zakon o lastninjenje oziroma v zakon o denacionalizacija predlagati da biti tudi za zadruga enak pristop ta se praviti da biti se glede vračanje premoženje določilo ta poglavje uskladiti z načelo zakon o denacionalizacija tukaj iti namreč predvsem za vprašanje praven nasledstvo na kateri biti opozarjati glede lastninjenje pa biti se uporabljati enak načelo kot veljati za zakon o lastninski preoblikovanje podjetje ta se praviti da biti ves gospodarski subjekt v ta načelen izhodišče imeti enakovreden položaj hvala lep"
"parl.ZbZdruDel","seja",29,"1991-09-12","15:10:00","20:00:00","ZupancicJoze1936",1,"ZbZdruDel.1991-09-12.s029-02.sp-301","ZbZdruDel.1991-09-12.s029-02.sp-301.2",ZbZdruDel.1991-09-12.s029-02.toc-item5,"taxonomy.3.6.1.2","topic.225","hvala lep beseda imeti gospod drča"
"parl.ZbZdruDel","seja",29,"1991-09-12","15:10:00","20:00:00","DrcaVinko1960",0,"ZbZdruDel.1991-09-12.s029-02.sp-302","ZbZdruDel.1991-09-12.s029-02.sp-302.2",ZbZdruDel.1991-09-12.s029-02.toc-item5,"taxonomy.3.6.1.2","topic.225","spoštovan poslanka in poslanec ves jaz kmet biti jasen da se biti ves delavec v predelovalen industrija boriti za svoj delež jasno jaz biti tudi da on ta delež nobeden ne biti odvzeti povsem jasno pa morati biti delavec predelovalen industrija da jaz morati imeti takšen procent upravljanje da se ne biti ta predelovalen industrija spomniti tako kot pred štirje pet leto da biti se zaloga meso in pa ostal izdelek kopičiti doma v hlev biti moči prodati niti komad obenem pa biti uvažati iz vzhoden Evropa nekvaliteten blago kaj biti biti v naš tržnica v mesnica in karkoli se biti že prodajati mleko v prah ta se biti mešati in prodajati za čist mleko kakšen meso biti uvažati naj povedati potrošnik biti biti črn in ves barva razen tisti ki biti točno napisan kakšen morati biti za prodaja meso ves ta interventen uvoz ki se biti dogajati biti biti namenjen za predelava in za ta da biti ta predelan izdelek poceni na polica vendar se ta biti zgoditi v predelava biti iti drug blago in pod ta pogoj biti naš izdelek ostajati doma kar se tikati predelovalen industrija v mlekarna morati gospod Ban jasen povedati pred mesec in pol jaz biti direktor pritisniti ob zid in jaz biti jasno povedati da morati v Avstrija najeti kredit 22 milijon šiling"
