"orgId","type of session","number","date","notBefore","notAfter","persId","chairman","spId","uId","titleId","taxonomyIds","topicIds","lemmata"
"parl.DruzPolZb","seja",35,"1992-04-09","11:00:00","11:05:00","ToplakLudvik1942",1,"DruzPolZb.1992-04-09.s035-04.sp-174","DruzPolZb.1992-04-09.s035-04.sp-174.2",DruzPolZb.1992-04-09.s035-04.toc-item1,"taxonomy.3.9.4.3","topic.388","za pet minuta še prelagati začetek seja ker biti dovolj navzoč obvestiti biti jaz da biti skupen seja danes predvidoma ob 15. ura in 30 minuta ponovno prositi poslanec družbenopolitičen zbor da ugotoviti navzočnost hvala lep čez pet minuta ponovno ugotavljati"
"parl.DruzPolZb","seja",35,"1992-04-09","11:00:00","11:05:00","ToplakLudvik1942",1,"DruzPolZb.1992-04-09.s035-04.sp-174","DruzPolZb.1992-04-09.s035-04.sp-174.3",DruzPolZb.1992-04-09.s035-04.toc-item2,"taxonomy.3.9.4.3","topic.388","sedaj se vračati na 35. seja usklajevanje nadaljevanje 35. seja družbenopolitičen zbor kjer imeti ponoven obravnava predlog za izdaja zakon o sprememba in dopolnitev zakon o naraven in kulturen dediščina z predlog zakon poročevalec biti Rudi Šeligo prejeti biti skupen poročilo želeti kdo razpravljati če ne dajati na glasovanje predloga kjer se predlagati družbenopolitičen zbor da v 3. člen umakniti že sprejeti amandma zakonodajno-praven komisija k drug odstavek da umakniti še sprejeti amandma poslanec Janez Kopač k prvo in drug odstavek ter sprejeti amandma v naslednji besedilo samo malo prositi za potrpljenje 40. člen se spremeniti tako da se glasiti imetnik ki nameravati spomenik ali znamenitost prodati on morati ponuditi na prodaj občina na območje kateri biti spomenik ali znamenitost in republika ter navesti označbo in cena spomenik in znamenitost ter drug prodajen pogoj pri nakup imeti prednost občina ki morati v 30-t dan sporočiti imetnik ki prodajati spomenik ali znamenitost in republika ali sprejemati prodajen ponudba če občina v rok iz prejšnji odstavek ne uveljaviti predkupen pravica on lahko uveljaviti republika v nadaljnji toti dan"
"parl.DruzPolZb","seja",35,"1992-04-09","11:00:00","11:05:00","ToplakLudvik1942",1,"DruzPolZb.1992-04-09.s035-04.sp-174","DruzPolZb.1992-04-09.s035-04.sp-174.4",DruzPolZb.1992-04-09.s035-04.toc-item2,"taxonomy.3.9.4.3","topic.388","želeti kdo razpravljati o predlog komisija glasovati ločeno najprej glede umik sprejet amandma zakonodajno-praven komisija k drug odstavek ugotoviti navzočnost"
"parl.DruzPolZb","seja",35,"1992-04-09","11:00:00","11:05:00","ToplakLudvik1942",1,"DruzPolZb.1992-04-09.s035-04.sp-174","DruzPolZb.1992-04-09.s035-04.sp-174.5",DruzPolZb.1992-04-09.s035-04.toc-item2,"taxonomy.3.9.4.3","topic.388","kdo biti za"
"parl.DruzPolZb","seja",35,"1992-04-09","11:00:00","11:05:00","ToplakLudvik1942",1,"DruzPolZb.1992-04-09.s035-04.sp-174","DruzPolZb.1992-04-09.s035-04.sp-174.7",DruzPolZb.1992-04-09.s035-04.toc-item2,"taxonomy.3.9.4.3","topic.388","biti kdo proti"
"parl.DruzPolZb","seja",35,"1992-04-09","11:00:00","11:05:00","ToplakLudvik1942",1,"DruzPolZb.1992-04-09.s035-04.sp-174","DruzPolZb.1992-04-09.s035-04.sp-174.9",DruzPolZb.1992-04-09.s035-04.toc-item2,"taxonomy.3.9.4.3","topic.388","se biti kdo vzdržati"
"parl.DruzPolZb","seja",35,"1992-04-09","11:00:00","11:05:00","ToplakLudvik1942",1,"DruzPolZb.1992-04-09.s035-04.sp-174","DruzPolZb.1992-04-09.s035-04.sp-174.11",DruzPolZb.1992-04-09.s035-04.toc-item2,"taxonomy.3.9.4.3","topic.388","ugotavljati da biti predlog izglasovan"
"parl.DruzPolZb","seja",35,"1992-04-09","11:00:00","11:05:00","ToplakLudvik1942",1,"DruzPolZb.1992-04-09.s035-04.sp-174","DruzPolZb.1992-04-09.s035-04.sp-174.12",DruzPolZb.1992-04-09.s035-04.toc-item2,"taxonomy.3.9.4.3","topic.388","predlagati se naj se umakniti že sprejeti amandma poslanec Janez Kopač k prvo in drug odstavek ker se biti medtem navzočnost spremeniti prositi da ponovno ugotoviti navzočnost navzoč biti 42 poslanec glasovati"
"parl.DruzPolZb","seja",35,"1992-04-09","11:00:00","11:05:00","ToplakLudvik1942",1,"DruzPolZb.1992-04-09.s035-04.sp-174","DruzPolZb.1992-04-09.s035-04.sp-174.13",DruzPolZb.1992-04-09.s035-04.toc-item2,"taxonomy.3.9.4.3","topic.388","kdo biti za"
"parl.DruzPolZb","seja",35,"1992-04-09","11:00:00","11:05:00","ToplakLudvik1942",1,"DruzPolZb.1992-04-09.s035-04.sp-174","DruzPolZb.1992-04-09.s035-04.sp-174.15",DruzPolZb.1992-04-09.s035-04.toc-item2,"taxonomy.3.9.4.3","topic.388","biti kdo proti"
"parl.DruzPolZb","seja",35,"1992-04-09","11:00:00","11:05:00","ToplakLudvik1942",1,"DruzPolZb.1992-04-09.s035-04.sp-174","DruzPolZb.1992-04-09.s035-04.sp-174.17",DruzPolZb.1992-04-09.s035-04.toc-item2,"taxonomy.3.9.4.3","topic.388","se biti kdo vzdržati"
"parl.DruzPolZb","seja",35,"1992-04-09","11:00:00","11:05:00","ToplakLudvik1942",1,"DruzPolZb.1992-04-09.s035-04.sp-174","DruzPolZb.1992-04-09.s035-04.sp-174.19",DruzPolZb.1992-04-09.s035-04.toc-item2,"taxonomy.3.9.4.3","topic.388","ugotavljati da biti predlog izglasovan"
"parl.DruzPolZb","seja",35,"1992-04-09","11:00:00","11:05:00","ToplakLudvik1942",1,"DruzPolZb.1992-04-09.s035-04.sp-174","DruzPolZb.1992-04-09.s035-04.sp-174.20",DruzPolZb.1992-04-09.s035-04.toc-item2,"taxonomy.3.9.4.3","topic.388","tretji predlagati se družbenopolitičen zbor naj sprejeti amandma v naslednji besedilo 40. člen se spremeniti tako da se glasiti kakor biti prebrati ponovno prositi ugotoviti navzočnost"
"parl.DruzPolZb","seja",35,"1992-04-09","11:00:00","11:05:00","ToplakLudvik1942",1,"DruzPolZb.1992-04-09.s035-04.sp-174","DruzPolZb.1992-04-09.s035-04.sp-174.22",DruzPolZb.1992-04-09.s035-04.toc-item2,"taxonomy.3.9.4.3","topic.388","kdo biti za"
"parl.DruzPolZb","seja",35,"1992-04-09","11:00:00","11:05:00","ToplakLudvik1942",1,"DruzPolZb.1992-04-09.s035-04.sp-174","DruzPolZb.1992-04-09.s035-04.sp-174.24",DruzPolZb.1992-04-09.s035-04.toc-item2,"taxonomy.3.9.4.3","topic.388","biti kdo proti"
"parl.DruzPolZb","seja",35,"1992-04-09","11:00:00","11:05:00","ToplakLudvik1942",1,"DruzPolZb.1992-04-09.s035-04.sp-174","DruzPolZb.1992-04-09.s035-04.sp-174.26",DruzPolZb.1992-04-09.s035-04.toc-item2,"taxonomy.3.9.4.3","topic.388","se biti kdo vzdržati"
"parl.DruzPolZb","seja",35,"1992-04-09","11:00:00","11:05:00","ToplakLudvik1942",1,"DruzPolZb.1992-04-09.s035-04.sp-174","DruzPolZb.1992-04-09.s035-04.sp-174.28",DruzPolZb.1992-04-09.s035-04.toc-item2,"taxonomy.3.9.4.3","topic.388","ugotavljati da biti predlog izglasovan"
"parl.DruzPolZb","seja",35,"1992-04-09","11:00:00","11:05:00","ToplakLudvik1942",1,"DruzPolZb.1992-04-09.s035-04.sp-174","DruzPolZb.1992-04-09.s035-04.sp-174.29",DruzPolZb.1992-04-09.s035-04.toc-item2,"taxonomy.3.9.4.3","topic.388","sedaj dajati na glasovanje zakon z amandma kakor biti on izglasovati"
"parl.DruzPolZb","seja",35,"1992-04-09","11:00:00","11:05:00","ToplakLudvik1942",1,"DruzPolZb.1992-04-09.s035-04.sp-174","DruzPolZb.1992-04-09.s035-04.sp-174.30",DruzPolZb.1992-04-09.s035-04.toc-item2,"taxonomy.3.9.4.3","topic.388","kdo biti za"
"parl.DruzPolZb","seja",35,"1992-04-09","11:00:00","11:05:00","ToplakLudvik1942",1,"DruzPolZb.1992-04-09.s035-04.sp-174","DruzPolZb.1992-04-09.s035-04.sp-174.32",DruzPolZb.1992-04-09.s035-04.toc-item2,"taxonomy.3.9.4.3","topic.388","biti kdo proti"
"parl.DruzPolZb","seja",35,"1992-04-09","11:00:00","11:05:00","ToplakLudvik1942",1,"DruzPolZb.1992-04-09.s035-04.sp-174","DruzPolZb.1992-04-09.s035-04.sp-174.34",DruzPolZb.1992-04-09.s035-04.toc-item2,"taxonomy.3.9.4.3","topic.388","se biti kdo vzdržati"
"parl.DruzPolZb","seja",35,"1992-04-09","11:00:00","11:05:00","ToplakLudvik1942",1,"DruzPolZb.1992-04-09.s035-04.sp-174","DruzPolZb.1992-04-09.s035-04.sp-174.36",DruzPolZb.1992-04-09.s035-04.toc-item2,"taxonomy.3.9.4.3","topic.388","ugotavljati da biti zakon z amandma izglasovan"
"parl.DruzPolZb","seja",35,"1992-04-09","11:00:00","11:05:00","ToplakLudvik1942",1,"DruzPolZb.1992-04-09.s035-04.sp-174","DruzPolZb.1992-04-09.s035-04.sp-174.37",DruzPolZb.1992-04-09.s035-04.toc-item2,"taxonomy.3.9.4.3","topic.388","prositi petčlanski deloven komisija za morebiten nadaljnji usklajevanje sporočiti biti da biti potreben usklajevanje prositi pet ime Rudi Šeligo on biti tukaj Kolešnik Šeligo Gošnik Pregelj še eden Šuklje Šeligo Kolešnik Gošnik Pregelj Šuklje"
"parl.DruzPolZb","seja",35,"1992-04-09","11:00:00","11:05:00","ToplakLudvik1942",1,"DruzPolZb.1992-04-09.s035-04.sp-174","DruzPolZb.1992-04-09.s035-04.sp-174.38",DruzPolZb.1992-04-09.s035-04.toc-item2,"taxonomy.3.9.4.3","topic.388","kdo biti za"
"parl.DruzPolZb","seja",35,"1992-04-09","11:00:00","11:05:00","ToplakLudvik1942",1,"DruzPolZb.1992-04-09.s035-04.sp-174","DruzPolZb.1992-04-09.s035-04.sp-174.40",DruzPolZb.1992-04-09.s035-04.toc-item2,"taxonomy.3.9.4.3","topic.388","biti kdo proti"
"parl.DruzPolZb","seja",35,"1992-04-09","11:00:00","11:05:00","ToplakLudvik1942",1,"DruzPolZb.1992-04-09.s035-04.sp-174","DruzPolZb.1992-04-09.s035-04.sp-174.42",DruzPolZb.1992-04-09.s035-04.toc-item2,"taxonomy.3.9.4.3","topic.388","se biti kdo vzdržati"
"parl.DruzPolZb","seja",35,"1992-04-09","11:00:00","11:05:00","ToplakLudvik1942",1,"DruzPolZb.1992-04-09.s035-04.sp-174","DruzPolZb.1992-04-09.s035-04.sp-174.44",DruzPolZb.1992-04-09.s035-04.toc-item2,"taxonomy.3.9.4.3","topic.388","ugotavljati da biti predlog komisija izglasovan"
