"orgId","type of session","number","date","notBefore","notAfter","persId","chairman","spId","uId","titleId","taxonomyIds","topicIds","lemmata"
"parl.DruzPolZb","seja",44,"1992-09-24","15:10:00","15:45:00","PersakAnton1947",1,"DruzPolZb.1992-09-24.s044-05.sp-137","DruzPolZb.1992-09-24.s044-05.sp-137.2",DruzPolZb.1992-09-24.s044-05.toc-item1,"taxonomy.3.1.3","topic.98","prehajati na 44. seja družbenopolitičen zbor"
"parl.DruzPolZb","seja",44,"1992-09-24","15:10:00","15:45:00","PersakAnton1947",1,"DruzPolZb.1992-09-24.s044-05.sp-137","DruzPolZb.1992-09-24.s044-05.sp-137.3",DruzPolZb.1992-09-24.s044-05.toc-item1,"taxonomy.3.1.3","topic.98","obravnavati zakon o nezdružljivost javen funkcija z pridobiten dejavnost ponoven obravnava zaradi magnetogram prositi gospod Potrč"
"parl.DruzPolZb","seja",44,"1992-09-24","15:10:00","15:45:00","PotrcMiran1938",0,"DruzPolZb.1992-09-24.s044-05.sp-138","DruzPolZb.1992-09-24.s044-05.sp-138.2",DruzPolZb.1992-09-24.s044-05.toc-item1,"taxonomy.3.1.3","topic.98","gospod predsednik najprej vprašati ali poslanec žeti obvestilo o amandma ki biti biti sprejet v ves trije zbor da biti vedeti kaj biti dopolnitev vprašati če ta želeti kajti ta sicer biti nujen ne v red potem dajati samo trije predlog ki zadevati neposredno naš zbor"
"parl.DruzPolZb","seja",44,"1992-09-24","15:10:00","15:45:00","PotrcMiran1938",0,"DruzPolZb.1992-09-24.s044-05.sp-138","DruzPolZb.1992-09-24.s044-05.sp-138.3",DruzPolZb.1992-09-24.s044-05.toc-item1,"taxonomy.3.1.3","topic.98","v 6. člen v 3. vrstica kjer se govoriti o upravljanje stanovanjski hiša počitniški hiša zemljišče biti besedica in tako dalje usklajevalen komisija predlagati da biti biti ta in podoben zaradi ta ker biti ta pač primeren in tako dalje biti lahko karkoli in podoben pa smiselno kar pač že biti zajet v ta trije primer ta biti prvi predlog in ta biti predlog ves trije zbor"
"parl.DruzPolZb","seja",44,"1992-09-24","15:10:00","15:45:00","PotrcMiran1938",0,"DruzPolZb.1992-09-24.s044-05.sp-138","DruzPolZb.1992-09-24.s044-05.sp-138.4",DruzPolZb.1992-09-24.s044-05.toc-item1,"taxonomy.3.1.3","topic.98","drug predlog biti enako v 6. člen v 1. odstavek 6. člen kjer iti za beseda da se ne šteti kot pridobiten dejavnost umetniško kulturen publicističen delo se predlagati da se pred ta beseda vstaviti tudi znanstveno-raziskovalno in potem naprej kulturen umetniško in publicističen delo"
"parl.DruzPolZb","seja",44,"1992-09-24","15:10:00","15:45:00","PersakAnton1947",1,"DruzPolZb.1992-09-24.s044-05.sp-139","DruzPolZb.1992-09-24.s044-05.sp-139.2",DruzPolZb.1992-09-24.s044-05.toc-item1,"taxonomy.3.1.3","topic.98","ta biti amandma gospod Kociper če se ne motiti"
"parl.DruzPolZb","seja",44,"1992-09-24","15:10:00","15:45:00","PotrcMiran1938",0,"DruzPolZb.1992-09-24.s044-05.sp-140","DruzPolZb.1992-09-24.s044-05.sp-140.2",DruzPolZb.1992-09-24.s044-05.toc-item1,"taxonomy.3.1.3","topic.98","tretji k 6. člen biti skupen predlog ves trije zbor da se na konec zaključen del stavek črta in ta biti da se črtati besedilo če ta biti v zveza z opravljanje funkcija skratka iti za kulturen znanstveno-raziskovalen umetniško in publicističen delo brez dostavek če ta biti v zveza z opravljanje funkcija"
"parl.DruzPolZb","seja",44,"1992-09-24","15:10:00","15:45:00","PersakAnton1947",1,"DruzPolZb.1992-09-24.s044-05.sp-141","DruzPolZb.1992-09-24.s044-05.sp-141.2",DruzPolZb.1992-09-24.s044-05.toc-item1,"taxonomy.3.1.3","topic.98","samo en opozorilo v naš zbor biti biti ta amandma sprejet"
"parl.DruzPolZb","seja",44,"1992-09-24","15:10:00","15:45:00","PotrcMiran1938",0,"DruzPolZb.1992-09-24.s044-05.sp-142","DruzPolZb.1992-09-24.s044-05.sp-142.2",DruzPolZb.1992-09-24.s044-05.toc-item1,"taxonomy.3.1.3","topic.98","ali biti biti sprejet ja obvestilo biti biti jaz na ta točka biti biti da ta amandma biti biti nikjer sprejet zato biti on skupno predlagati"
"parl.DruzPolZb","seja",44,"1992-09-24","15:10:00","15:45:00","PersakAnton1947",1,"DruzPolZb.1992-09-24.s044-05.sp-143","DruzPolZb.1992-09-24.s044-05.sp-143.2",DruzPolZb.1992-09-24.s044-05.toc-item1,"taxonomy.3.1.3","topic.98","v naš zbor biti ta amandma sprejet"
"parl.DruzPolZb","seja",44,"1992-09-24","15:10:00","15:45:00","PotrcMiran1938",0,"DruzPolZb.1992-09-24.s044-05.sp-144","DruzPolZb.1992-09-24.s044-05.sp-144.2",DruzPolZb.1992-09-24.s044-05.toc-item1,"taxonomy.3.1.3","topic.98","potem se opravičevati in zadnji predlog k 14. člen v zveza z javnost podatek biti biti dan več amandma ta 14. člen določati podatek o premoženje in dohodek funkcionar se šteti kot oseben podatek in se smeti uporabljati izključno za spremljanje premoženjski stanje funkcionar po ta zakon k ta biti biti dva amandma in usklajevalen skupina biti ugotoviti da po svoj vsebina biti ustrezen da pa po smisel predstavljati želja zagotoviti da biti biti plača in drug dohodek funkcionar ki se izplačevati iz proračun biti javen zaradi ta predlagati ves trije zbor da sprejeti amandma da se k 14. člen da drug odstavek ki se glasiti plača in drug dohodek funkcionar ki se izplačevati iz proračun biti javen hvala lep"
"parl.DruzPolZb","seja",44,"1992-09-24","15:10:00","15:45:00","PersakAnton1947",1,"DruzPolZb.1992-09-24.s044-05.sp-145","DruzPolZb.1992-09-24.s044-05.sp-145.2",DruzPolZb.1992-09-24.s044-05.toc-item1,"taxonomy.3.1.3","topic.98","spraševati zbor da ne biti ugovor ker še biti poročiti ali biti dovolj natančno razumeti za kateri predlog iti da ne biti čakati na pisen poročilo kajti sicer biti dobro da počakati če biti lahko priti do nesporazum"
"parl.DruzPolZb","seja",44,"1992-09-24","15:10:00","15:45:00","PersakAnton1947",1,"DruzPolZb.1992-09-24.s044-05.sp-145","DruzPolZb.1992-09-24.s044-05.sp-145.3",DruzPolZb.1992-09-24.s044-05.toc-item1,"taxonomy.3.1.3","topic.98","prav potem predlagati da glasovati ker se ves z ta strinjati"
"parl.DruzPolZb","seja",44,"1992-09-24","15:10:00","15:45:00","PersakAnton1947",1,"DruzPolZb.1992-09-24.s044-05.sp-145","DruzPolZb.1992-09-24.s044-05.sp-145.4",DruzPolZb.1992-09-24.s044-05.toc-item1,"taxonomy.3.1.3","topic.98","najprej glasovati o ta da se vnesti v 6. člen tako kot biti biti povedan in podoben namesto itn. kdo biti za ta predlog"
"parl.DruzPolZb","seja",44,"1992-09-24","15:10:00","15:45:00","PersakAnton1947",1,"DruzPolZb.1992-09-24.s044-05.sp-145","DruzPolZb.1992-09-24.s044-05.sp-145.5",DruzPolZb.1992-09-24.s044-05.toc-item1,"taxonomy.3.1.3","topic.98","kdor biti za naj prositi glasovati"
"parl.DruzPolZb","seja",44,"1992-09-24","15:10:00","15:45:00","PersakAnton1947",1,"DruzPolZb.1992-09-24.s044-05.sp-145","DruzPolZb.1992-09-24.s044-05.sp-145.7",DruzPolZb.1992-09-24.s044-05.toc-item1,"taxonomy.3.1.3","topic.98","biti kdo proti"
"parl.DruzPolZb","seja",44,"1992-09-24","15:10:00","15:45:00","PersakAnton1947",1,"DruzPolZb.1992-09-24.s044-05.sp-145","DruzPolZb.1992-09-24.s044-05.sp-145.9",DruzPolZb.1992-09-24.s044-05.toc-item1,"taxonomy.3.1.3","topic.98","se biti kdo vzdržati"
"parl.DruzPolZb","seja",44,"1992-09-24","15:10:00","15:45:00","PersakAnton1947",1,"DruzPolZb.1992-09-24.s044-05.sp-145","DruzPolZb.1992-09-24.s044-05.sp-145.11",DruzPolZb.1992-09-24.s044-05.toc-item1,"taxonomy.3.1.3","topic.98","ugotavljati da biti ta amandma z 44 glas za in 1 proti sprejet"
"parl.DruzPolZb","seja",44,"1992-09-24","15:10:00","15:45:00","PersakAnton1947",1,"DruzPolZb.1992-09-24.s044-05.sp-145","DruzPolZb.1992-09-24.s044-05.sp-145.12",DruzPolZb.1992-09-24.s044-05.toc-item1,"taxonomy.3.1.3","topic.98","glasovati o ta da se v 6. člen tako kot biti biti povedan pred umetniško kulturno dodati besedilo znanstveno-raziskovalen kot biti v naš zbor predlagati gospod Buser kdo biti za ta predlog"
"parl.DruzPolZb","seja",44,"1992-09-24","15:10:00","15:45:00","PersakAnton1947",1,"DruzPolZb.1992-09-24.s044-05.sp-145","DruzPolZb.1992-09-24.s044-05.sp-145.14",DruzPolZb.1992-09-24.s044-05.toc-item1,"taxonomy.3.1.3","topic.98","stališče vlada biti biti v ta primer da ne podpirati biti pa sedaj usklajen predlog"
"parl.DruzPolZb","seja",44,"1992-09-24","15:10:00","15:45:00","PersakAnton1947",1,"DruzPolZb.1992-09-24.s044-05.sp-145","DruzPolZb.1992-09-24.s044-05.sp-145.15",DruzPolZb.1992-09-24.s044-05.toc-item1,"taxonomy.3.1.3","topic.98","kdor biti za naj prositi glasovati"
"parl.DruzPolZb","seja",44,"1992-09-24","15:10:00","15:45:00","PersakAnton1947",1,"DruzPolZb.1992-09-24.s044-05.sp-145","DruzPolZb.1992-09-24.s044-05.sp-145.17",DruzPolZb.1992-09-24.s044-05.toc-item1,"taxonomy.3.1.3","topic.98","biti kdo proti"
"parl.DruzPolZb","seja",44,"1992-09-24","15:10:00","15:45:00","PersakAnton1947",1,"DruzPolZb.1992-09-24.s044-05.sp-145","DruzPolZb.1992-09-24.s044-05.sp-145.19",DruzPolZb.1992-09-24.s044-05.toc-item1,"taxonomy.3.1.3","topic.98","se biti kdo vzdržati"
"parl.DruzPolZb","seja",44,"1992-09-24","15:10:00","15:45:00","PersakAnton1947",1,"DruzPolZb.1992-09-24.s044-05.sp-145","DruzPolZb.1992-09-24.s044-05.sp-145.21",DruzPolZb.1992-09-24.s044-05.toc-item1,"taxonomy.3.1.3","topic.98","ugotavljati da biti z 39 glas za in 1 vzdržan predlog sprejet"
"parl.DruzPolZb","seja",44,"1992-09-24","15:10:00","15:45:00","PersakAnton1947",1,"DruzPolZb.1992-09-24.s044-05.sp-145","DruzPolZb.1992-09-24.s044-05.sp-145.22",DruzPolZb.1992-09-24.s044-05.toc-item1,"taxonomy.3.1.3","topic.98","glasovati o predlog da se v 14. člen dodati drug odstavek plača in drug dohodek funkcionar ki se plačevati iz proračun biti javen kdo biti za ta predlog"
"parl.DruzPolZb","seja",44,"1992-09-24","15:10:00","15:45:00","PersakAnton1947",1,"DruzPolZb.1992-09-24.s044-05.sp-145","DruzPolZb.1992-09-24.s044-05.sp-145.23",DruzPolZb.1992-09-24.s044-05.toc-item1,"taxonomy.3.1.3","topic.98","kdor biti za naj prositi glasovati"
"parl.DruzPolZb","seja",44,"1992-09-24","15:10:00","15:45:00","PersakAnton1947",1,"DruzPolZb.1992-09-24.s044-05.sp-145","DruzPolZb.1992-09-24.s044-05.sp-145.25",DruzPolZb.1992-09-24.s044-05.toc-item1,"taxonomy.3.1.3","topic.98","biti kdo proti"
"parl.DruzPolZb","seja",44,"1992-09-24","15:10:00","15:45:00","PersakAnton1947",1,"DruzPolZb.1992-09-24.s044-05.sp-145","DruzPolZb.1992-09-24.s044-05.sp-145.27",DruzPolZb.1992-09-24.s044-05.toc-item1,"taxonomy.3.1.3","topic.98","se biti kdo vzdržati"
"parl.DruzPolZb","seja",44,"1992-09-24","15:10:00","15:45:00","PersakAnton1947",1,"DruzPolZb.1992-09-24.s044-05.sp-145","DruzPolZb.1992-09-24.s044-05.sp-145.29",DruzPolZb.1992-09-24.s044-05.toc-item1,"taxonomy.3.1.3","topic.98","ugotavljati da biti ta amandma z 43 glas za soglasno sprejet"
"parl.DruzPolZb","seja",44,"1992-09-24","15:10:00","15:45:00","PersakAnton1947",1,"DruzPolZb.1992-09-24.s044-05.sp-145","DruzPolZb.1992-09-24.s044-05.sp-145.30",DruzPolZb.1992-09-24.s044-05.toc-item1,"taxonomy.3.1.3","topic.98","glasovati o zakon o nezdružljivost javen funkcija vključno z ta amandma prositi kdo biti za"
"parl.DruzPolZb","seja",44,"1992-09-24","15:10:00","15:45:00","PersakAnton1947",1,"DruzPolZb.1992-09-24.s044-05.sp-145","DruzPolZb.1992-09-24.s044-05.sp-145.31",DruzPolZb.1992-09-24.s044-05.toc-item1,"taxonomy.3.1.3","topic.98","kdor biti za naj prositi glasovati"
"parl.DruzPolZb","seja",44,"1992-09-24","15:10:00","15:45:00","PersakAnton1947",1,"DruzPolZb.1992-09-24.s044-05.sp-145","DruzPolZb.1992-09-24.s044-05.sp-145.33",DruzPolZb.1992-09-24.s044-05.toc-item1,"taxonomy.3.1.3","topic.98","biti kdo proti"
"parl.DruzPolZb","seja",44,"1992-09-24","15:10:00","15:45:00","PersakAnton1947",1,"DruzPolZb.1992-09-24.s044-05.sp-145","DruzPolZb.1992-09-24.s044-05.sp-145.35",DruzPolZb.1992-09-24.s044-05.toc-item1,"taxonomy.3.1.3","topic.98","se biti kdo vzdržati"
"parl.DruzPolZb","seja",44,"1992-09-24","15:10:00","15:45:00","PersakAnton1947",1,"DruzPolZb.1992-09-24.s044-05.sp-145","DruzPolZb.1992-09-24.s044-05.sp-145.37",DruzPolZb.1992-09-24.s044-05.toc-item1,"taxonomy.3.1.3","topic.98","ugotavljati da biti zakon o nezdružljivost itn. z 46 glas za soglasno sprejet"
