"orgId","type of session","number","date","notBefore","notAfter","persId","chairman","spId","uId","titleId","taxonomyIds","topicIds","lemmata"
"parl.Skup","delovna seja",13,"1992-03-30","16:30:00","17:55:00","BizjakIvan1956",1,"VsiZbor.1992-03-30.d013-01.sp-76","VsiZbor.1992-03-30.d013-01.sp-76.11",VsiZbor.1992-03-30.d013-01.toc-item4,"taxonomy.3.7.2.1","topic.314","biti kdo proti"
"parl.Skup","delovna seja",13,"1992-03-30","16:30:00","17:55:00","BizjakIvan1956",1,"VsiZbor.1992-03-30.d013-01.sp-76","VsiZbor.1992-03-30.d013-01.sp-76.13",VsiZbor.1992-03-30.d013-01.toc-item4,"taxonomy.3.7.2.1","topic.314","se biti kdo vzdržati"
"parl.Skup","delovna seja",13,"1992-03-30","16:30:00","17:55:00","BizjakIvan1956",1,"VsiZbor.1992-03-30.d013-01.sp-76","VsiZbor.1992-03-30.d013-01.sp-76.15",VsiZbor.1992-03-30.d013-01.toc-item4,"taxonomy.3.7.2.1","topic.314","ugotavljati da amandma biti biti sprejet"
"parl.Skup","delovna seja",13,"1992-03-30","16:30:00","17:55:00","BizjakIvan1956",1,"VsiZbor.1992-03-30.d013-01.sp-76","VsiZbor.1992-03-30.d013-01.sp-76.16",VsiZbor.1992-03-30.d013-01.toc-item4,"taxonomy.3.7.2.1","topic.314","iti na naslednji sporen vprašanje ta biti amandma št. 155. družbenopolitičen zbor in zbor občina ta amandma biti sprejeti sprejeti pa on biti zbor združen delo in on biti umakniti čeprav biti komisija ta predlagati vlada in matičen odbor biti podpreti ta amandma gospod Daneu želeti obrazložiti svoj glas"
"parl.Skup","delovna seja",13,"1992-03-30","16:30:00","17:55:00","DaneuIvo1937",0,"VsiZbor.1992-03-30.d013-01.sp-77","VsiZbor.1992-03-30.d013-01.sp-77.2",VsiZbor.1992-03-30.d013-01.toc-item4,"taxonomy.3.7.2.1","topic.314","hvala za beseda spoštovan upati da ti ne jemati preveč dragocen čas ker biti do sedaj porabiti ogromen milijarda tokrat iti pa za piškav 12 milijon in prositi ves tisti v interes otrok in tisti ki biti za mladina da glasovati za ta amandma tako kot biti jaz iti za sredstvo za šolski in izvenšolski rekreativen dejavnost da biti z ta preprečiti preventivno tudi sredstvo zdravstvo in sociala ker kot vedeti biti na pohod grozljiv dejavnost dejavnost mamilo drog med naši mladina ki biti statistično dokazan misliti da jaz biti tu podpreti tudi gospod Janša ker biti z ta lahko omogočiti mnogo dober fizičen telesen pripravljenost naš mladenič za obramba in da ne govoriti naprej o ves ta pozitiven trend ki naj biti on imeti šolstvo in športen dejavnost v šola ker biti prej ves amandma zavrniti ti lepo prositi da ne diskutirati več in da glasovati za hvala morati še povedati ker biti ves do sedaj dajati amandma z ta da biti reči kje vzeti lani biti reči naj se ta vzeti obramba in policija letos ta ne biti storiti prositi biti če lahko gospod Šešok iz rezerva predvideti ta sredstvo lahko tudi v drug polovica letošnji leto hvala"
"parl.Skup","delovna seja",13,"1992-03-30","16:30:00","17:55:00","BizjakIvan1956",1,"VsiZbor.1992-03-30.d013-01.sp-78","VsiZbor.1992-03-30.d013-01.sp-78.2",VsiZbor.1992-03-30.d013-01.toc-item4,"taxonomy.3.7.2.1","topic.314","hvala no prej biti prebrati ta amandma pa zdaj popravljati ta pri porabnik ministrstvo za šolstvo in šport se pri postavka 7100 konto 437 vnesti nov šifra in znesek 12 milijon slt za šport mlad ta biti ta potem izgled iti lahko na glasovanje medtem se prisotnost biti spremeniti"
"parl.Skup","delovna seja",13,"1992-03-30","16:30:00","17:55:00","BizjakIvan1956",1,"VsiZbor.1992-03-30.d013-01.sp-78","VsiZbor.1992-03-30.d013-01.sp-78.3",VsiZbor.1992-03-30.d013-01.toc-item4,"taxonomy.3.7.2.1","topic.314","kdo biti za ta amandma"
"parl.Skup","delovna seja",13,"1992-03-30","16:30:00","17:55:00","BizjakIvan1956",1,"VsiZbor.1992-03-30.d013-01.sp-78","VsiZbor.1992-03-30.d013-01.sp-78.5",VsiZbor.1992-03-30.d013-01.toc-item4,"taxonomy.3.7.2.1","topic.314","biti kdo proti"
"parl.Skup","delovna seja",13,"1992-03-30","16:30:00","17:55:00","BizjakIvan1956",1,"VsiZbor.1992-03-30.d013-01.sp-78","VsiZbor.1992-03-30.d013-01.sp-78.7",VsiZbor.1992-03-30.d013-01.toc-item4,"taxonomy.3.7.2.1","topic.314","se biti kdo vzdržati"
"parl.Skup","delovna seja",13,"1992-03-30","16:30:00","17:55:00","BizjakIvan1956",1,"VsiZbor.1992-03-30.d013-01.sp-78","VsiZbor.1992-03-30.d013-01.sp-78.9",VsiZbor.1992-03-30.d013-01.toc-item4,"taxonomy.3.7.2.1","topic.314","zdaj biti pa povprašati predstavnik predlagatelj ker biti ta zadnji od sporen vprašanje ali biti potrebno zdaj da biti biti proračun oziroma zakon o proračun konsistenten sprejeti še kakšen dodaten amandma da ne biti potem biti delo na pol opravljen"
"parl.Skup","delovna seja",13,"1992-03-30","16:30:00","17:55:00","SesokDusan1953",0,"VsiZbor.1992-03-30.d013-01.sp-79","VsiZbor.1992-03-30.d013-01.sp-79.2",VsiZbor.1992-03-30.d013-01.toc-item4,"taxonomy.3.7.2.1","topic.314","torej glede na ta da biti na voda čutiti da biti iti ta skozi biti tudi ta izračunati tako da biti ta tekoč proračunski rezerva ta postavka 7608 znašati 348.800.115 tolar"
"parl.Skup","delovna seja",13,"1992-03-30","16:30:00","17:55:00","BizjakIvan1956",1,"VsiZbor.1992-03-30.d013-01.sp-80","VsiZbor.1992-03-30.d013-01.sp-80.2",VsiZbor.1992-03-30.d013-01.toc-item4,"taxonomy.3.7.2.1","topic.314","torej ta amandma glede tekoče proračunski rezerva veljati še sprejeti da uskladiti proračun sam o se glasovati torej še o ta"
"parl.Skup","delovna seja",13,"1992-03-30","16:30:00","17:55:00","BizjakIvan1956",1,"VsiZbor.1992-03-30.d013-01.sp-80","VsiZbor.1992-03-30.d013-01.sp-80.3",VsiZbor.1992-03-30.d013-01.toc-item4,"taxonomy.3.7.2.1","topic.314","kdo biti za"
"parl.Skup","delovna seja",13,"1992-03-30","16:30:00","17:55:00","BizjakIvan1956",1,"VsiZbor.1992-03-30.d013-01.sp-80","VsiZbor.1992-03-30.d013-01.sp-80.5",VsiZbor.1992-03-30.d013-01.toc-item4,"taxonomy.3.7.2.1","topic.314","biti kdo proti"
"parl.Skup","delovna seja",13,"1992-03-30","16:30:00","17:55:00","BizjakIvan1956",1,"VsiZbor.1992-03-30.d013-01.sp-80","VsiZbor.1992-03-30.d013-01.sp-80.7",VsiZbor.1992-03-30.d013-01.toc-item4,"taxonomy.3.7.2.1","topic.314","se biti kdo vzdržati"
"parl.Skup","delovna seja",13,"1992-03-30","16:30:00","17:55:00","BizjakIvan1956",1,"VsiZbor.1992-03-30.d013-01.sp-80","VsiZbor.1992-03-30.d013-01.sp-80.9",VsiZbor.1992-03-30.d013-01.toc-item4,"taxonomy.3.7.2.1","topic.314","ugotavljati da biti ta amandma z večina poslanec sprejet"
"parl.Skup","delovna seja",13,"1992-03-30","16:30:00","17:55:00","BizjakIvan1956",1,"VsiZbor.1992-03-30.d013-01.sp-80","VsiZbor.1992-03-30.d013-01.sp-80.10",VsiZbor.1992-03-30.d013-01.toc-item4,"taxonomy.3.7.2.1","topic.314","zdaj morati glasovati še o predlog proračun republika Slovenija za leto 1992 v celota skupaj z ves sprejet amandma"
"parl.Skup","delovna seja",13,"1992-03-30","16:30:00","17:55:00","BizjakIvan1956",1,"VsiZbor.1992-03-30.d013-01.sp-80","VsiZbor.1992-03-30.d013-01.sp-80.11",VsiZbor.1992-03-30.d013-01.toc-item4,"taxonomy.3.7.2.1","topic.314","kdo biti za predlog proračun v celota"
"parl.Skup","delovna seja",13,"1992-03-30","16:30:00","17:55:00","BizjakIvan1956",1,"VsiZbor.1992-03-30.d013-01.sp-80","VsiZbor.1992-03-30.d013-01.sp-80.13",VsiZbor.1992-03-30.d013-01.toc-item4,"taxonomy.3.7.2.1","topic.314","biti kdo proti"
"parl.Skup","delovna seja",13,"1992-03-30","16:30:00","17:55:00","BizjakIvan1956",1,"VsiZbor.1992-03-30.d013-01.sp-80","VsiZbor.1992-03-30.d013-01.sp-80.15",VsiZbor.1992-03-30.d013-01.toc-item4,"taxonomy.3.7.2.1","topic.314","se biti kdo vzdržati"
"parl.Skup","delovna seja",13,"1992-03-30","16:30:00","17:55:00","BizjakIvan1956",1,"VsiZbor.1992-03-30.d013-01.sp-80","VsiZbor.1992-03-30.d013-01.sp-80.17",VsiZbor.1992-03-30.d013-01.toc-item4,"taxonomy.3.7.2.1","topic.314","ugotavljati da biti predlog zakon o proračun republika Slovenija za leto 1992 v celota z večina glas sprejet"
"parl.Skup","delovna seja",13,"1992-03-30","16:30:00","17:55:00","BizjakIvan1956",1,"VsiZbor.1992-03-30.d013-01.sp-80","VsiZbor.1992-03-30.d013-01.sp-80.18",VsiZbor.1992-03-30.d013-01.toc-item4,"taxonomy.3.7.2.1","topic.314","z ta zaključevati 13. deloven skupen seja ves trije zbor skupščina republika Slovenija in se ti zahvaljevati za udeležba in sodelovanje"
